,title,score,upvote-ratio,id,subreddit,url,num_comments,created,author,over18
342,Asked the question of why? But don’t want answers for why… I thought they were the generation that could take criticism like a man?,366,0.98,ojken0,okboomer,https://i.redd.it/2f2artwql0b71.jpg,30,2021-07-13 22:57:05,AutomaticConfidence9,False
343,"Saw this on Instagram, though it belonged here",482,0.99,oit665,okboomer,https://i.redd.it/p25udp35ssa71.jpg,62,2021-07-12 20:38:41,,False
344,"Saw this online, made me lol.",1085,0.99,oi4c0b,okboomer,https://i.redd.it/7bz91kns3la71.jpg,40,2021-07-11 18:50:11,Emanouche,False
345,Saw this on Facebook. The entitlement with this generation is real.,21,1.0,oi6uxc,okboomer,https://i.imgur.com/jyBPDbT.jpg,7,2021-07-11 21:17:36,BeckTech,False
346,"Millennials can’t mow grass, very funny.",566,0.99,oftwnb,okboomer,https://i.redd.it/3xwmirrtbv971.jpg,31,2021-07-08 04:08:26,Badgerfaction5,False
347,Suddenly all of the described “old people” aren’t running the world right now.,29,1.0,ofyabf,okboomer,https://i.redd.it/uze58rzikw971.jpg,19,2021-07-08 08:18:58,Mrcushington,False
348,But can we though?,526,0.98,of1z2m,okboomer,https://i.redd.it/xtnifpse7n971.jpg,55,2021-07-07 00:49:26,Northwest_Napoleon,False
349,I wanna tell him about that flag....,77,0.99,odtsmp,okboomer,https://i.redd.it/pr1mb7yzn9971.jpg,3,2021-07-05 03:17:27,TheMartianArtist6,False
350,How to turn $40 into $400...,332,0.98,oblfxl,okboomer,https://i.redd.it/vdezr61r2l871.jpg,24,2021-07-01 18:35:55,RayBrower,False
351,Har Har Har Making fun of literal children for not knowing how to use technology that died DECADES before they were born is hilarious.,680,0.99,oayhf5,okboomer,https://i.redd.it/kxupskgkxe871.jpg,52,2021-06-30 19:59:34,janiceian1983,False
352,Woke boomer!,356,0.99,oax3u8,okboomer,https://i.redd.it/xe5bd7uxke871.jpg,11,2021-06-30 18:45:05,alex1247,False
353,Kids today …,390,0.99,o9z9e9,okboomer,https://i.redd.it/e46qhq7ka4871.jpg,21,2021-06-29 08:09:06,robertpod,False
354,"This counts? I mean, of course boomers would be here...",82,1.0,oa2y8b,okboomer,https://i.redd.it/1aszflptj5871.png,14,2021-06-29 12:22:51,ladyintears,False
355,🙄🙄🙄 Like any of those are useful in 2021,525,0.96,o8tccy,okboomer,https://i.redd.it/8u05h8zcvr771.jpg,76,2021-06-27 14:22:31,Caron9391,False
356,Goes hand in hand with boomer humor,605,0.98,o75f3b,okboomer,https://i.redd.it/qwu38esii8771.jpg,8,2021-06-24 22:46:40,RayBrower,False
357,Ok boomer,451,0.99,o6tj6i,okboomer,https://i.redd.it/70fifwfj55771.jpg,40,2021-06-24 09:58:37,puppies42O,False
358,Ok New Yorker,278,0.99,o65c8b,okboomer,https://i.redd.it/hmfm7kumyx671.jpg,2,2021-06-23 09:47:26,rumdumdumrum,False
359,Checkmate,509,0.99,o5rcz0,okboomer,https://i.redd.it/ns2jpq63iu671.jpg,60,2021-06-22 22:09:21,,False
360,Boomers never ever got divorced,473,0.99,o5b0el,okboomer,https://i.redd.it/kcreddy50q671.jpg,30,2021-06-22 07:01:45,PorgCT,False
361,"To the dude who said that, easy: DON'T COMMENT.",36,0.91,o5myrn,okboomer,https://i.redd.it/ycjmsd48it671.jpg,7,2021-06-22 18:48:20,,False
362,Father’s Day boomer post,711,0.98,o4duul,okboomer,https://i.redd.it/qyhxtxcb9h671.jpg,61,2021-06-21 01:37:00,Rowdydust,False
363,This feels like boomer logic to me,71,0.95,o42eoh,okboomer,https://i.redd.it/224zoq1vsc671.jpg,0,2021-06-20 15:36:09,fa5878,False
364,Was posting memes in Discord and I encountered one.,737,0.97,o3q3hi,okboomer,https://i.redd.it/n7g6fqm4ha671.png,34,2021-06-20 02:48:28,sk00mathief,False
365,Found by my friend in a Chevron bathroom,35,1.0,o38nfm,okboomer,https://i.redd.it/yfm4paxsm5671.jpg,1,2021-06-19 10:31:15,Christian2049,False
366,Back in your day you just beat/killed people different than you for fun,64,0.99,o2w96v,okboomer,https://i.redd.it/4jwdt853m0671.jpg,11,2021-06-18 23:35:52,FurryIrishFury,False
367,Don't repeat their mistakes [oc],698,0.99,o1wxmg,okboomer,https://i.redd.it/v0wlqrvost571.png,20,2021-06-17 18:42:59,scarecrowbar,False
368,Maybe get the phonebook yourself ya lazy boomer.,852,0.96,o0ktjo,okboomer,https://i.imgur.com/59Z3VoE.jpg,43,2021-06-15 23:45:11,RayBrower,False
369,Turbulent times we live in,577,0.98,nzu4am,okboomer,https://i.redd.it/w7ove3ln3a571.jpg,49,2021-06-15 00:28:41,alexwitwicky,False
370,Near future Gameshow,64,1.0,nzznyy,okboomer,https://i.redd.it/nh8011tacb571.jpg,2,2021-06-15 04:38:56,Kelvin8R3ooo,False
371,Sure… “kids” under 30 are the problem. 🤦🏼‍♀️,675,0.98,nz2bsp,okboomer,https://i.redd.it/ijzcf5zoq2571.jpg,54,2021-06-13 23:43:34,Hypnomoose,False
372,Alright Karen...,58,0.98,nzgu3x,okboomer,https://i.redd.it/wqc8cplli6571.jpg,6,2021-06-14 12:25:20,JubzAlmighty,False
373,My fear porn might be false but it’s existence is fascinating!,39,0.97,nzhrn1,okboomer,https://i.redd.it/7udxbrs2v6571.jpg,2,2021-06-14 13:35:18,TwentyLettersAreFine,False
374,Found this on my local facebook marketplace,292,0.86,ny7aqg,okboomer,https://imgur.com/CZwNL2r.jpg,51,2021-06-12 19:25:52,proteininja,False
375,in walgreens,393,0.94,nxjk6j,okboomer,https://i.redd.it/acu2w05cun471.jpg,23,2021-06-11 21:37:28,jaredables,False
376,3 Stars,28,0.95,nxxmu7,okboomer,https://imgur.com/PJKyRde.jpg,1,2021-06-12 09:07:25,mbz321,False
377,Boomer Car Advice,704,0.99,nvthm5,okboomer,https://i.redd.it/1i7w028m68471.jpg,80,2021-06-09 16:57:36,VJJS,False
378,"Darn kids these days, taking precautions against preventable diseases, pathetic",58,0.99,nvtrmt,okboomer,https://i.redd.it/aafqqxw984471.jpg,1,2021-06-09 17:14:14,,False
379,This sub is a goldmine.,445,0.98,nv82e5,okboomer,https://i.redd.it/et3cnwas0x371.jpg,30,2021-06-08 21:55:24,ItzSh0ckerz,False
380,I mean my car has never kicked me. And I don’t have to put gas in it when I’m not using it. And it can go 132mph rather than 32mph.,66,0.98,nvjsu8,okboomer,https://i.redd.it/2gu1i3q365471.jpg,8,2021-06-09 06:49:21,alukard81x,False
381,Cancel culture strikes again!,56,0.98,nvhxiz,okboomer,https://i.redd.it/0acysiuco4471.jpg,8,2021-06-09 05:09:53,ConverseBriefly,False
382,Risk specialist is unaware of Millennial banking history,25,0.97,nuyp9l,okboomer,https://i.redd.it/0obumscqqz371.jpg,2,2021-06-08 12:34:32,BankshotMcG,False
383,Facebook boomer who is trying to make up the fact that they’re boring,570,0.98,ntljvj,okboomer,https://i.redd.it/wnl30vhhbn371.jpg,42,2021-06-06 18:47:29,willyoung12312,False
384,iNtErNeT bAd,97,0.97,nrxnle,okboomer,https://i.imgur.com/vOt4kvn.jpg,10,2021-06-04 11:09:12,reverendjesus,False
385,Totally why people hate the internet,631,0.99,nrl47h,okboomer,https://i.redd.it/vzrrnt8cm3371.jpg,28,2021-06-04 00:32:40,MetaHelvetica,False
386,It's the children who are wrong,245,0.99,nr1r92,okboomer,https://i.redd.it/co387qh6fy271.png,32,2021-06-03 07:03:39,thebobmannh,False
387,It's like you hit a certain age and just become incredibly guilible,521,0.97,np9z3d,okboomer,https://i.redd.it/z8swzskk1i271.jpg,8,2021-05-31 23:58:50,MetaHelvetica,False
388,“Grandpa what’s a wall calendar?” Ugh,602,0.99,nnxz6v,okboomer,https://i.redd.it/wa6hxuuf05271.jpg,105,2021-05-30 04:09:21,ConverseBriefly,False
389,What’s wrong with this generation? s/,42,0.96,nnbwhi,okboomer,https://i.redd.it/qtcvk9czou171.jpg,6,2021-05-29 06:20:39,OctavianV,False
390,"Because teenagers are ""horrible"", get it?",480,0.97,nmmf5z,okboomer,https://i.redd.it/oqhtup7bir171.jpg,17,2021-05-28 06:44:34,ihatesnoods,False
391,MUH RESTROOMS!!!!,30,1.0,nm3l34,okboomer,https://i.redd.it/agxbjao5tm171.jpg,2,2021-05-27 14:56:27,Caron9391,False
392,My friend's nan sent her this,471,0.97,nk919v,okboomer,https://i.redd.it/libgnfw0c3171.jpg,30,2021-05-25 03:04:10,ripjaw6442,False
393,Posted by my Trump-loving grandmother who’s never worked a day in her life and has always relied on a man,706,0.98,njdb6e,okboomer,https://i.redd.it/839p2v12uw071.jpg,37,2021-05-23 23:35:11,smancuso94,False
394,Chuckle.................liberals wtf?,523,1.0,niwtf9,okboomer,https://i.redd.it/fv1435fstr071.jpg,18,2021-05-23 06:44:47,ConverseBriefly,False
395,Tried to recommend an app to help find local independant pubs and bars after he posted about not eating at a weatherspoons (large pub chain in the UK run by an absolute twat) and these were his responses... frickin boomers.,27,0.97,nj27r3,okboomer,https://i.redd.it/murvuxtmjt071.jpg,1,2021-05-23 12:31:26,JubzAlmighty,False
396,"back in day, we watches MOVIES at the MOVIE THEATER",304,0.99,nhutyv,okboomer,https://i.redd.it/9g8laxj7ph071.png,27,2021-05-21 20:41:30,veiledits,False
397,Hypocrisy,735,0.99,nhhjjv,okboomer,https://i.redd.it/muoomac7td071.jpg,6,2021-05-21 07:38:06,ItzSh0ckerz,False
398,Found on a local Facebook group. Replying to a post about cyclists.,30,0.96,nhqapi,okboomer,https://i.redd.it/oc32br5amg071.jpg,1,2021-05-21 17:03:06,greatdane114,False
399,Idk if this has already been posted...,447,0.98,ngszxk,okboomer,https://i.redd.it/toy09m7c18071.jpg,38,2021-05-20 12:11:28,chantzyboy78,False
400,Just divorce so she can do better...Please.,163,0.97,ndpbow,okboomer,https://i.redd.it/dow2uj57rhz61.png,7,2021-05-16 19:50:00,ironmaidenfan92,False
401,Funee monkee,57,0.98,ndoee8,okboomer,https://i.redd.it/lc1q0lmtihz61.jpg,5,2021-05-16 19:01:22,,False
402,Another Survivor comment: Sexual assault is cool! (/s),43,0.98,ndj6hv,okboomer,https://i.redd.it/hw3hev1osfz61.jpg,1,2021-05-16 13:12:59,thatonelurkerorsmn,False
403,Found under a Survivor music video,374,0.98,ncrbkc,okboomer,https://i.redd.it/zvitgmkfw7z61.jpg,18,2021-05-15 10:39:49,thatonelurkerorsmn,False
404,"Welp, off to Guatemala...",550,1.0,nc600m,okboomer,https://i.redd.it/ys0sd1igeeh31.png,45,2021-05-14 16:35:44,RayBrower,False
405,“Cancel Culture is when I’m held accountable for cheating.”,777,0.99,na3yu0,okboomer,https://i.redd.it/689i6zvpbjy61.jpg,16,2021-05-12 00:00:58,Bobcatluv,False
406,Hurr hurr people are lazy.,38,0.92,nah73g,okboomer,https://i.redd.it/sd236cjwjmy61.jpg,1,2021-05-12 10:52:11,lisamariefan,False
407,McChicken Education,62,0.98,na87ul,okboomer,https://i.redd.it/lwabc0182jy61.jpg,1,2021-05-12 02:57:10,FurryIrishFury,False
408,I can't think of a better representation,553,0.99,n8dym8,okboomer,https://i.redd.it/e8k17egxsxx61.gif,12,2021-05-09 18:41:09,FurryIrishFury,False
409,"This patriot gets it. He's wearing his mask to protect himself against 5G mind control rays. Thanks to his mask, the Deep State won't be able to turn him into a wifi-controlled 5G zombie.",484,0.99,n726w8,okboomer,https://i.redd.it/0igk6aankmx61.jpg,11,2021-05-07 21:43:17,2020clusterfuck,False
410,Boomer at heart ♥️,349,0.98,n6emr2,okboomer,https://i.redd.it/7a21v1f9rjx61.jpg,31,2021-05-07 00:24:17,WonderChode,False
411,Posted unironically by my mom’s friend,45,0.97,n6nq92,okboomer,https://i.redd.it/fbwb214pvlx61.jpg,8,2021-05-07 07:32:23,songbird1681,False
412,Those darn X Boxes ect,245,1.0,n4jx4e,okboomer,https://i.redd.it/49mg782ol2x61.jpg,53,2021-05-04 14:42:19,ohitsmillie,False
413,Okay Potato,331,0.96,n482m7,okboomer,https://i.redd.it/pcxxil3j5zw61.jpg,12,2021-05-04 03:06:40,Rachet83,False
414,they always treat it like someone from the cdc posted it,691,0.99,n3kao6,okboomer,https://i.redd.it/j4ktia1ybpw61.jpg,5,2021-05-03 06:27:34,kxppathicc,False
415,Xbox Live,628,0.98,n226xp,okboomer,https://i.redd.it/hxwj2yjiadw61.png,14,2021-05-01 01:35:18,electro2007,False
416,Boomer review for a bowling game,209,0.97,n1ssgh,okboomer,https://i.redd.it/s3826yx31bw61.png,16,2021-04-30 17:59:00,dinglebopstrudle,False
417,Smack the special needs right out them!,30,0.98,n25rte,okboomer,https://i.redd.it/akqheqa07ew61.jpg,3,2021-05-01 04:37:31,lightofpolaris,False
418,Oh no it's happening,51,0.94,n1w6p5,okboomer,https://i.redd.it/29uk0r6nx9w61.jpg,2,2021-04-30 20:54:20,Poonker,False
419,That's why red states are funded by blue states,634,0.97,n1cxe5,okboomer,https://preview.redd.it/ex0pa3i305w61.jpg?width=1000&format=pjpg&auto=webp&s=695ba63c6c3595fb16eb9eb5f67537759b9992bb,68,2021-04-30 01:35:18,xxxSexMan69xxx,False
420,Haha alcoholism funny,32,0.94,n1ffti,okboomer,https://i.redd.it/0l2h0bogq6w61.jpg,2,2021-04-30 03:32:11,OkSurprise7755,False
421,Hella Boomer moment,169,0.98,n0pyin,okboomer,https://i.redd.it/mr6zt2jblzv61.jpg,27,2021-04-29 03:30:53,prussianwaifu,False
422,Can't fact check cursive,579,0.99,n0cvoi,okboomer,https://i.redd.it/3kc856gsgtv61.jpg,59,2021-04-28 17:10:07,RayBrower,False
423,"boomers don't get it, do they?",541,0.98,mz4csi,okboomer,https://i.redd.it/123b5fia9kv61.jpg,9,2021-04-26 23:56:46,Jin0304,False
424,Well time to post on ig about new generation is addicted to internet and then lets go to Facebook next 5 hours!,53,0.98,mz68sr,okboomer,https://i.redd.it/prh2hmavnkv61.jpg,0,2021-04-27 01:18:27,prkenko,False
425,I carried an M-16 and you...you carry that guitar!,666,0.99,my8yfq,okboomer,https://i.redd.it/ho71az913lo61.jpg,23,2021-04-25 19:35:14,RayBrower,False
426,"Jesus Christ, lady.",605,0.99,mvqp20,okboomer,https://i.redd.it/969uvr1znlu61.jpg,96,2021-04-22 03:36:41,Hollywizzle311,False
427,I reposted it because I was Russian myself,32,0.95,mux2dp,okboomer,https://i.redd.it/bfv7d831zcu61.png,4,2021-04-21 00:03:40,BucketSquid-,False
428,This is me every weekend.,27,0.93,mutmvs,okboomer,https://i.redd.it/onjxbtjxpcu61.jpg,1,2021-04-20 21:31:38,PSmith3000,False
429,He speaks the truth! 😳,16,0.91,muvlpm,okboomer,https://i.redd.it/4hphm3li2du61.jpg,1,2021-04-20 22:59:01,Throwawayunknown55,False
430,"Good little facebook find shared from a boomer neighbor. The page that had posted it was ""it is what it is"".",479,0.98,mtywk0,okboomer,https://i.redd.it/fqtb8mscc4u61.png,39,2021-04-19 17:21:20,brownnc4,False
431,This will get through to those text addicted youths!,50,0.93,mubz5j,okboomer,https://i.redd.it/tsbqaxl7f7u61.jpg,11,2021-04-20 03:42:38,graspingwind,False
432,Found on Insta... Yes because living a substance-fueled self destructive lifestyle is sooo superior,763,0.99,mtjs23,okboomer,https://i.redd.it/9pmz8l5pizt61.png,41,2021-04-19 01:07:56,aroused_yoda,False
433,Little find in a Facebook community.,710,0.99,msnx48,okboomer,https://i.redd.it/0zslrgl7hpt61.jpg,43,2021-04-17 15:21:46,halfeb,False
434,"Seen this on one of my friends mother's Facebook page, I love her to bits but this just screams boomer",34,0.94,msqaum,okboomer,https://i.redd.it/c6alrkkzeqt61.jpg,1,2021-04-17 18:31:06,AgingChris,False
435,What happened to the backround??,564,0.99,mrzlrh,okboomer,https://i.redd.it/j34q39948it61.png,32,2021-04-16 14:58:22,Stilljetra-gacha,False
436,Because childhood doesn't exist anymore,429,0.98,mrgh2g,okboomer,https://i.redd.it/mhbu1emhqct61.jpg,31,2021-04-15 20:30:37,chuckwillie,False
437,At last,761,0.98,mr3utd,okboomer,https://i.redd.it/31l46gvrf8t61.jpg,18,2021-04-15 06:03:27,bitchy-cryptid,False
438,Textbook Boomer,40,0.9,mr4sj8,okboomer,https://i.redd.it/qk9i8n39q8t61.jpg,11,2021-04-15 07:02:13,SpottyDoo,False
439,Condescending Boomer found on FB,40,0.91,mr3h0p,okboomer,https://i.redd.it/8lpzxwfob8t61.jpg,16,2021-04-15 05:40:31,Hypnomoose,False
440,As technically a millennial (born 1985) My first car was a standard.,105,1.0,mq8yia,okboomer,https://i.redd.it/5cst10aqmzs61.jpg,32,2021-04-14 00:26:23,Turronno,False
441,My brother's out of touch whatsapp abbreviations,478,0.99,mpyxro,okboomer,https://i.redd.it/b6ebu5mxvws61.jpg,56,2021-04-13 15:12:42,peleg462,False
442,Begins to list 50 things millennials have heard of.,538,1.0,mpczdj,okboomer,https://i.redd.it/lo5e7k4mmqs61.jpg,67,2021-04-12 18:09:42,nsims92,False
443,The passing of the DoE has got British boomers riled on the dailymail,20,0.95,momec6,okboomer,https://i.redd.it/kpzwoak4whs61.jpg,3,2021-04-11 12:47:02,,False
444,Just a slap in the face from 1995.,18,0.86,moka8v,okboomer,https://i.redd.it/nuw6qtx02hs61.png,1,2021-04-11 09:58:19,Deadlapse,False
445,"Haha, payday bad, youth lazy",38,0.88,moa5l5,okboomer,https://i.redd.it/eh22i6yq2es61.jpg,2,2021-04-10 23:57:00,chuckinalicious543,False
446,My mom just sent me this.,613,0.98,mn457e,okboomer,https://i.redd.it/7rdikcjf81s61.jpg,108,2021-04-09 04:45:40,piano_043,False
447,I’ve never heard a boomer say this,878,0.98,mmiuj8,okboomer,https://i.redd.it/hv8xdbyravr61.jpg,28,2021-04-08 08:48:08,Turronno,False
448,Outdated image of teens by boomers starterpack,29,0.96,mmxdk1,okboomer,https://i.redd.it/3yy25b60znr61.png,1,2021-04-08 23:23:01,RayBrower,False
449,Posted on a Boomer's facebook,655,0.99,mlzyub,okboomer,https://i.redd.it/d3ngttwclqr61.jpg,37,2021-04-07 16:58:32,JediJamie303,False
450,Facebook strikes again,640,0.99,mlhqvj,okboomer,https://i.redd.it/u241qt9yelr61.jpg,52,2021-04-06 23:34:03,MrLion626,False
451,"The fact that 68,000 people liked this..",648,0.97,mkn9ly,okboomer,https://i.redd.it/cg1t1yvwhdr61.png,69,2021-04-05 20:56:10,TheAlmightyZach,False
452,"Posted to Facebook by my grandfather. There’s so many reasons why this doesn’t make sense, but he’s adamant that cars from his day were perfect.",634,0.99,mivcvj,okboomer,https://i.redd.it/q1dn4pkx6uq61.jpg,58,2021-04-03 04:00:40,OATML,False
453,A downs syndrome boy has gone missing in NSW. Had to fix this boomers comment.,514,1.0,mhr3se,okboomer,https://i.redd.it/6xx521dlziq61.jpg,15,2021-04-01 14:19:57,sootymay,False
454,The tough generation,41,0.97,mhz540,okboomer,https://i.redd.it/gsr0vuaighq61.jpg,6,2021-04-01 22:03:16,PA-Beemer-rider,False
455,Damn Millennials are killing the bread industry!,888,0.99,mh6bjw,okboomer,https://i.imgur.com/Gg0sMDS.jpg,52,2021-03-31 19:09:20,RayBrower,False
456,Someone posted this on Facebook yesterday and I thought it belonged here,29,0.94,mha8zt,okboomer,https://i.imgur.com/EW2AQo9.jpg,6,2021-03-31 22:17:11,BeckTech,False
457,Thought this belongs here with you guys,24,0.95,mhausq,okboomer,https://i.redd.it/t9m500fsceq61.jpg,8,2021-03-31 22:45:01,Splitspoon76,False
458,“I am not on the internet”,25,1.0,mhayly,okboomer,https://i.redd.it/ysdffpiodeq61.jpg,1,2021-03-31 22:50:00,Venomenon-,False
459,Not even a discussion.,639,0.96,mgcrj0,okboomer,https://i.redd.it/35yvstkz55q61.jpg,26,2021-03-30 15:51:06,parking_pataweyo,False
460,Kids r so lazee!,627,0.99,mfq4g2,okboomer,https://i.redd.it/7qqzorlr3zp61.jpg,62,2021-03-29 19:27:42,songbird1681,False
461,Young people don't work! Long hours at soul-crushing jobs destroying our mental health will say otherwise.,52,0.98,mfx8w3,okboomer,https://i.redd.it/zcylqh38p0q61.jpg,1,2021-03-30 00:51:22,smalltowngoth,False
462,The Democrats are also taking away our punctuation,42,0.92,mfg2e6,okboomer,https://i.redd.it/sqkic2cwrvp61.jpg,7,2021-03-29 08:15:50,Hope-u-guess-my-name,False
463,Ok,45,0.9,mfdrgb,okboomer,https://i.redd.it/nj522j8c3vp61.jpg,9,2021-03-29 05:58:10,Jimmyplays_22,False
464,This was in r/memes,785,0.97,mdvpwm,okboomer,https://i.redd.it/xni0tzun6fp61.png,28,2021-03-27 00:28:34,ToxicVarian,False
465,Boomer in Missouri...,37,1.0,me0frd,okboomer,https://i.redd.it/8fvpnx6ragp61.png,2,2021-03-27 04:13:25,,False
466,Back in my day,271,0.99,md8h65,okboomer,https://i.redd.it/ot069dvyo8p61.jpg,5,2021-03-26 02:38:26,4reddityo,False
467,A post from my aunt 🙄,521,0.99,md2dqr,okboomer,https://i.redd.it/w90hod81c7p61.jpg,58,2021-03-25 22:04:10,baileythekiller,False
468,"""Did you pay ExTrA for all the HoLeS in those JeAns!?""",43,0.94,mdficb,okboomer,https://i.redd.it/vjbrvpviiap61.jpg,5,2021-03-26 08:45:52,tkmbsf,False
469,Boomer calendar,34,0.83,mczkuo,okboomer,https://i.redd.it/ke9idsj2q6p61.jpg,6,2021-03-25 20:01:15,The-Heether,False
470,Wtf happened to them ?,882,0.99,mcfpai,okboomer,https://i.redd.it/zhct0eicc1p61.jpg,47,2021-03-25 01:55:15,,False
471,Who loves cancel culture again?,43,0.93,mcm7rk,okboomer,https://i.redd.it/ccno3fn3f1p61.jpg,4,2021-03-25 06:46:48,sh17s7o7m,False
472,"Proud to find colour coded AV cables a ""struggle""...",921,0.99,mbsvcj,okboomer,https://i.redd.it/clly57f22vo61.jpg,35,2021-03-24 05:47:48,fa5878,False
473,"Ahhh yes the good old days, when children dreamed of being insurance agents.",36,0.95,mc1lto,okboomer,https://i.redd.it/nuai3in44yo61.jpg,8,2021-03-24 15:03:49,biancastolemyname,False
474,Making life more convenient = BAD,35,0.97,mbx5rl,okboomer,https://i.redd.it/u8pg9zjniwo61.jpg,5,2021-03-24 09:41:40,SequoiaBoi,False
475,"Oh look, the experts of r/conservative are back at it again.",656,0.98,mb2saf,okboomer,https://i.redd.it/j69hoyilddo61.jpg,36,2021-03-23 06:31:38,ItzSh0ckerz,False
476,"Ok, millenial",458,0.98,m9iyj3,okboomer,https://i.redd.it/qiaxxcw5p9o61.jpg,16,2021-03-21 04:57:13,TOCMT0CM,False
477,You're goddamn right we are!,1067,0.99,m8we39,okboomer,https://i.imgur.com/bN3t6uK.jpg,111,2021-03-20 06:57:16,RayBrower,False
478,Saw this gem on a Swat Kats intro video.... other comments were saying how 90s were the best times of all,239,0.97,m7z46f,okboomer,https://i.redd.it/4f3vepalcun61.jpg,12,2021-03-19 01:20:00,Movieparodist,False
479,Yes yes,830,0.98,m73hn3,okboomer,https://i.redd.it/k10421je1mn61.jpg,22,2021-03-17 21:23:04,ToxicVarian,False
480,I'm back. Thats it.,41,1.0,m6raua,okboomer,https://i.redd.it/lconv7tgein61.png,2,2021-03-17 09:09:15,Stilljetra-gacha,False
481,"I can't swipe the book, dad",704,1.0,m5ktxu,okboomer,https://i.imgur.com/X8cpPem.jpg,20,2021-03-15 19:06:05,look4alec,False
482,Watch out for my clackers.,49,0.9,m5v12m,okboomer,https://i.redd.it/i1p90onnc9n61.jpg,9,2021-03-16 02:42:56,MrsMozely,False
483,"Something I see boomers share quite often. Do people actually hate truckers? Because I've never seen anybody express any hatred of truckers 🤔 also, ""truckers lives matter"", 🥴🥴",321,0.96,m5afbb,okboomer,https://i.redd.it/39x0zk91q3n61.jpg,92,2021-03-15 07:47:23,mangohoe24,False
484,Boomer as fuck.,535,0.97,m4kpd4,okboomer,https://i.redd.it/3p7ja8uucwm61.jpg,27,2021-03-14 07:00:55,lisamariefan,False
485,Millennial stands up to boomer,596,0.99,m3g1m7,okboomer,https://i.redd.it/kng6cb5i1jm61.jpg,22,2021-03-12 17:26:14,RayBrower,False
486,A boomer I can get behind.,428,0.98,m2p323,okboomer,https://i.redd.it/arvt6mtycbm61.jpg,27,2021-03-11 18:02:58,AlphaO4,False
487,You can't see anything if you are only looking at your phone,39,0.97,m311q2,okboomer,https://i.redd.it/emtxvjc5ugm61.jpg,12,2021-03-12 02:49:19,medicinalfriedchckn,False
488,Fleetwood Mac > Taytay Swift,45,1.0,m2q46m,okboomer,https://i.redd.it/2k9rwtol39m61.jpg,7,2021-03-11 19:01:46,look4alec,False
489,BoomerStars vs MillennialFlakes,41,0.94,m2e7kp,okboomer,https://i.redd.it/sjvfrev4uam61.jpg,8,2021-03-11 06:38:33,SequoiaBoi,False
490,Boomer eyes,907,0.99,m128jw,okboomer,https://i.redd.it/dkpnm8q16xl61.gif,13,2021-03-09 13:58:55,SequoiaBoi,False
491,"Wait, where's his animated penis then?",38,0.95,m16lyp,okboomer,https://i.redd.it/unq6ig5ma0m61.jpg,0,2021-03-09 19:11:20,sleepingkight,False
492,Bigfoot is safe due to mobile technology,32,0.95,m16b9d,okboomer,https://i.redd.it/8xdhpvmo70m61.png,1,2021-03-09 18:54:55,thesluggard12,False
493,"the ""get off my lawn"" of 2021",656,0.99,lzq2r4,okboomer,https://i.redd.it/yvcqlg4urll61.jpg,22,2021-03-07 18:21:10,zerokillingtime,False
494,Hmmmmm...,36,0.97,lztfjv,okboomer,https://i.redd.it/0bazmjvgpml61.jpg,9,2021-03-07 21:29:39,PrayingDangerously,False
495,Phone bad moment,148,0.99,lzjm5i,okboomer,https://i.redd.it/2koy9i15gjl61.jpg,39,2021-03-07 10:32:01,Suurpe,False
496,It’s fun tho,59,0.98,lzmoya,okboomer,https://i.redd.it/nx9m7vjtgjl61.jpg,2,2021-03-07 14:13:59,Patatostrike,False
497,Ok cool but that America really sucked for a lot of people,700,0.98,lz0q31,okboomer,https://i.redd.it/k46kzqh8kel61.jpg,58,2021-03-06 18:06:03,ConverseBriefly,False
498,Found on facebook,493,0.98,lyfubi,okboomer,https://i.redd.it/yerx4tqpm8l61.jpg,31,2021-03-05 22:09:15,Ender_assassin6,False
499,Pregnancy Q&A,8,1.0,lz0wg0,okboomer,https://i.redd.it/tt9kill3adl61.jpg,0,2021-03-06 18:17:21,RayBrower,False
500,Obvious boomer,32,0.95,lypa4p,okboomer,https://i.redd.it/33h6xg2ysal61.png,6,2021-03-06 05:27:57,BeatingHattedWhores,False
501,(sigh)... ok boomer.,449,0.94,ly1zyy,okboomer,https://i.redd.it/2ix8jzfkg4l61.jpg,50,2021-03-05 08:08:06,tbgmdhc278,False
502,всем русским привет остальным соболезную,14,0.95,lybcil,okboomer,https://i.redd.it/o5wje6u5r6l61.jpg,0,2021-03-05 18:31:58,AlphaO4,False
503,That boomer as ducks,245,0.98,lxda76,okboomer,https://i.redd.it/ff9i1lui8wk61.jpg,0,2021-03-04 10:42:09,Nocaketotake,False
504,This made me psychically cringe.,371,0.97,lw3pvv,okboomer,https://i.redd.it/4fjb8iftomk61.jpg,17,2021-03-02 20:21:51,edgyborbo,False
505,Found this gem on Instagram,75,0.94,lw7pdc,okboomer,https://i.redd.it/qwpudp50ink61.jpg,17,2021-03-02 23:05:27,SequoiaBoi,False
506,Illinois State Police Social Media + Boomer Humor..,30,0.98,lw8dq1,okboomer,https://i.imgur.com/rKRx8iP.jpg,3,2021-03-02 23:33:36,TheAlmightyZach,False
507,All millennials and Gen Z are incapable of naming any legendary guitarists,531,0.99,lvglh1,okboomer,https://i.redd.it/giocdp5dngk61.jpg,80,2021-03-02 00:03:02,dmortimer93,False
508,Ok Boomer,18,0.93,lvp198,okboomer,https://i.redd.it/67qk8m8d5ek61.jpg,0,2021-03-02 05:46:37,Darkshreaders3,False
509,“tHe lAsT gReAt gEnErAtIoN”,736,0.98,luix7d,okboomer,https://i.redd.it/jw4100z4o8k61.jpg,54,2021-02-28 21:13:06,jontheeditor,False
510,"Phone Bad, Book Good",30,0.88,lv1hn8,okboomer,https://i.redd.it/j926kfylzbk61.jpg,0,2021-03-01 11:24:06,CasinoKitten,False
511,Shut up boomer,0,0.47,lvla4s,okboomer,https://i.redd.it/ng4ooeo2khk61.jpg,3,2021-03-02 03:06:38,XxNotJohnyJoestarxX,False
512,"the ""definng"" difference",23,0.88,luutgf,okboomer,https://i.redd.it/4yx9k4fx7bk61.jpg,1,2021-03-01 05:47:36,bedtime_ham,False
513,"The old ""what is it with men and asking directions?""",22,1.0,luq2h7,okboomer,https://i.redd.it/wvpcfpyk6ak61.jpg,0,2021-03-01 02:18:45,smalltowngoth,False
514,Millennials will destroy the economy,359,0.99,ltp9b7,okboomer,https://i.redd.it/bjqn1rlzb0k61.jpg,13,2021-02-27 19:59:51,Guilhermitonoob,False
515,And you’re Stallone? Okay Boomer,503,0.97,lsz30x,okboomer,https://i.redd.it/i5z18zdv3uj61.jpg,35,2021-02-26 20:14:52,71nobody,False
