,title,score,upvote-ratio,id,subreddit,url,num_comments,created,author,over18
516,And yet we’re the only one cursed with knowledge,84,0.98,lt7lgv,okboomer,https://i.imgur.com/APkkP5s.jpg,1,2021-02-27 02:25:18,sbemail_from_space,False
517,"I do usually like this man but “Video game bad, book good.”",26,0.95,ltbaxt,okboomer,https://i.redd.it/uwka44x3uwj61.jpg,2,2021-02-27 05:25:12,Ravenqueen2001,False
518,Sprained my eyes I rolled them so hard,28,0.93,lt5ktx,okboomer,https://i.redd.it/i4gh8unthvj61.jpg,2,2021-02-27 00:54:33,loyalbeagle,False
519,"Back then: ""Please mom, 5 more minutes"" Today:",613,0.98,ls7t7o,okboomer,https://i.redd.it/hq1tagxpwmj61.jpg,24,2021-02-25 20:02:01,Lothken,False
520,"Women can’t like beer, I guess...",46,0.96,lskvh1,okboomer,https://i.redd.it/unwa9kxirpj61.jpg,1,2021-02-26 05:38:18,LivinginthePit,False
521,Dark mode sky,360,0.99,lr85d2,okboomer,https://i.redd.it/kglriznjpbj61.jpg,18,2021-02-24 14:29:27,AlphaO4,False
522,How am supposed to know if I was never taught?,632,0.98,lqsnku,okboomer,https://i.redd.it/5lyuvnw3iaj61.jpg,35,2021-02-24 02:19:08,ShipperWithNoMister,False
523,She clearly works there and it’s a step of service but sure..,53,0.99,lqy7ym,okboomer,https://i.redd.it/7d3hgfw0mbj61.jpg,3,2021-02-24 06:02:30,Turronno,False
524,Ok boomer. This makes no sense.,654,0.97,lpyb1y,okboomer,https://i.imgur.com/Heg6WpO.jpg,51,2021-02-23 01:33:26,RayBrower,False
525,Lil creamers,18,1.0,lpzzcv,okboomer,https://i.redd.it/3uli9patg3j61.jpg,0,2021-02-23 02:39:02,BearOnTheToilet,False
526,They're just that cool.,50,0.94,lodb3a,okboomer,https://i.redd.it/u0pev73feoi61.png,13,2021-02-20 23:59:02,thesluggard12,False
527,"Whether it's book bad, or phone bad, nothing has changed.",921,0.99,lnufdd,okboomer,https://i.redd.it/of49xll7zii61.jpg,27,2021-02-20 05:45:32,smalltowngoth,False
528,How dare men not want to be covered in oil,65,0.98,lntsna,okboomer,https://i.redd.it/19462evxtii61.jpg,14,2021-02-20 05:15:17,Ravenqueen2001,False
529,HAHAHAH guys isn't my english book so fun and quirky,554,0.99,ln6hif,okboomer,https://i.redd.it/e2xdjwd4j7i61.jpg,5,2021-02-19 09:48:16,pradyumnv,False
530,wow what is that????,241,0.99,lmwkfc,okboomer,https://i.redd.it/6p06pin6h9i61.jpg,11,2021-02-19 02:07:32,Nocaketotake,False
531,Can we irresponsible folk roast this a little?,539,0.98,lmh74f,okboomer,https://i.redd.it/xhvseqh1y6i61.jpg,50,2021-02-18 13:16:47,Miss_Cafecito,False
532,Like I’ve never noticed the box on a pole at the end of my driveway,29,0.92,lmqrsi,okboomer,https://i.redd.it/i1ab5mn5k9i61.jpg,1,2021-02-18 22:04:19,Thiccboijones114,False
533,Young man!!,397,0.99,llkyo1,okboomer,https://i.redd.it/viobf37tiyh61.jpg,6,2021-02-17 08:57:09,ebudd08,False
534,That will pay the medical bills,830,0.99,ll6kxt,okboomer,https://i.redd.it/xrlbiyv02vh61.jpg,26,2021-02-16 21:17:43,Retrocomparisons,False
535,The generation raised on South Park and Family Guy would be so shocked at their humor,160,0.99,ll6dha,okboomer,https://i.redd.it/8mo23k6e0vh61.jpg,24,2021-02-16 21:08:35,Retrocomparisons,False
536,bruh.,64,0.94,lkliz2,okboomer,https://i.redd.it/8qmc456n4ph61.jpg,16,2021-02-16 01:21:43,Szeventeen,False
537,Ok boomer,832,0.99,lk03pv,okboomer,https://i.redd.it/dn4dubyn1jh61.jpg,7,2021-02-15 04:54:21,TheRealBigDaddy99,False
538,I'll literally never understand these. Boomers always told me being 'cool' wasn't important...,160,0.99,ljrvme,okboomer,https://i.redd.it/whb3igw62hh61.png,18,2021-02-14 22:14:07,Porterjoh,False
539,So Oppressed,844,0.98,ljh453,okboomer,https://i.redd.it/35utgrv4ddh61.jpg,51,2021-02-14 09:47:56,Heli417,False
540,Fidget spinner bad,34,0.94,ljunzh,okboomer,https://i.redd.it/mje1d32rphh61.jpg,3,2021-02-15 00:26:11,Cheesus_Crust1,False
541,"Phone bad, read book...or something.",61,0.99,ljl8s1,okboomer,https://i.redd.it/1axwbhd3ueh61.jpg,3,2021-02-14 14:44:47,LX_Emergency,False
542,App bad phone bad brain good,573,0.99,lis9sc,okboomer,https://i.redd.it/691hqyuhq4h61.jpg,9,2021-02-13 09:05:26,jimmyl_82104,False
543,Boomer is a state of mind,494,0.99,lh1ew1,okboomer,https://i.redd.it/xv1dgylhapg61.jpg,12,2021-02-11 00:52:21,Xoloj,False
544,This screams ok boomer.,346,0.91,lgm8cq,okboomer,https://i.redd.it/m4iblt0gzkg61.jpg,27,2021-02-10 10:21:28,FuhrerGirthWorm,False
545,Sorta fits here,555,0.98,lfneiq,okboomer,https://i.redd.it/hpus8zbvvbg61.jpg,14,2021-02-09 03:45:16,ChapterMedium,False
546,Boomer vibes,42,0.9,lfkh4z,okboomer,https://i.redd.it/fvin3z9c47g61.jpg,2,2021-02-09 01:36:27,WEEGEETIME,False
547,Not at all dramatic,460,0.98,lf6cgh,okboomer,https://i.redd.it/ohz0crr4d7g61.jpg,9,2021-02-08 12:33:06,__Booker__Dewitt__,False
548,The effort,721,0.97,ldxk9o,okboomer,https://i.redd.it/u1gygxhyyuf61.jpg,79,2021-02-06 18:52:17,moonshineofyourlove,False
549,This guy and his rant.,61,0.96,le9p33,okboomer,https://i.redd.it/tqba59tnyxf61.jpg,11,2021-02-07 04:55:59,Pix3lle,False
550,iPhone Bad,225,0.99,lddaz6,okboomer,https://i.redd.it/fdgftj272pf61.jpg,13,2021-02-05 23:41:47,udo-,False
551,"His profile picture was him, a grey haired gentleman in lycra, standing with his bicycle.",544,0.99,ld19tm,okboomer,https://i.redd.it/bfhhg43jslf61.jpg,21,2021-02-05 12:00:14,ktayyy,False
552,Put your phone down and pull your pants up.,726,0.99,lcgjz8,okboomer,https://i.redd.it/8s736k3wygf61.jpg,69,2021-02-04 19:46:57,smokeandmirrors1983,False
553,On reviews about the Lego UCS Millennium Falcon,19,0.9,lcnayg,okboomer,https://i.redd.it/ninqs4pxeif61.jpg,4,2021-02-05 00:38:45,SantanaSongwithoutB,False
554,hahaha vr make people kill other people because technology bad,740,0.99,lbghbr,okboomer,https://i.redd.it/p0ykssty67f61.jpg,37,2021-02-03 10:54:25,fynn_is_on_reddit,False
555,Bucking Foomers,803,0.98,laz4r5,okboomer,https://i.redd.it/m054sfyo83f61.jpg,34,2021-02-02 21:36:57,jdwright1989,False
556,There’s always something called a charging cable.,35,0.93,lbepaf,okboomer,https://i.redd.it/x4rthyfuo6f61.jpg,8,2021-02-03 09:13:00,Turronno,False
557,Kids these days...,36,0.97,lbbpj9,okboomer,https://i.redd.it/q11eju6sw5f61.jpg,2,2021-02-03 06:35:33,sheworksforfudge,False
558,"Oh yes, let me put my “printer” into my “refresher”",646,0.99,lafpb5,okboomer,https://i.redd.it/w0iyhg8efwe61.jpg,24,2021-02-02 03:40:22,SequoiaBoi,False
559,Guess I’m dumb,41,0.97,l9k5r3,okboomer,https://i.redd.it/xyb6ie0j1qe61.jpg,9,2021-02-01 01:13:38,That-69th-guy,False
560,German boomer - it says 90s cellphone and 90s WhatsApp,33,0.98,l8ycak,okboomer,https://i.redd.it/mvwgqj0axje61.jpg,2,2021-01-31 04:39:11,EmmaLately,False
561,Yes my aunt posted it on Facebook,35,1.0,l8mr52,okboomer,https://i.redd.it/2zhxrqvxbhe61.jpg,7,2021-01-30 19:55:59,HotRabbit999,False
562,FB “friend” posted this shortly after I posted about my first stream on Twitch. Coincidence? I think not.,641,0.98,l8521j,okboomer,https://i.redd.it/q10viqkccce61.jpg,29,2021-01-30 03:09:21,jeralldoh,False
563,was posted on cringetopia and daaaamn bommer humour is weird,581,1.0,l6yxcr,okboomer,https://i.redd.it/7xp0nnfzaud61.png,21,2021-01-28 20:32:28,fynn_is_on_reddit,False
564,Is expecting respect as a professional because of a clothing item not a form of entitlement?,120,0.98,l628c6,okboomer,https://i.redd.it/6af7vmn7xud61.png,13,2021-01-27 16:34:16,fly_the_coop,False
565,"Posted by my husband's 60 year old aunt today with the caption, ""This is so true!!!!"" 👌 boomer",426,0.97,l516a1,okboomer,https://i.redd.it/nuwybm3dhkd61.jpg,32,2021-01-26 05:27:36,pru13,False
566,I am looking at a nice cutscenes thing from ty the tasmanian tiger and saw this,426,0.99,l4da99,okboomer,https://i.redd.it/4aa9uoz4ydd61.png,7,2021-01-25 07:29:11,Darkshreaders3,False
567,Boomer T-shirt,66,0.94,l4c6vg,okboomer,https://i.redd.it/m6xqattdndd61.jpg,2,2021-01-25 06:28:51,A-Long-December,False
568,We all have that one relative on Facebook that has shared this at least once 😂😂😂,853,0.98,l3vyfi,okboomer,https://i.redd.it/la5daa69v8d61.jpg,27,2021-01-24 14:24:03,Caron9391,False
569,Gatekeeping someones career,30,0.93,l2u7ok,okboomer,https://i.redd.it/k0v52fi2cwc61.jpg,1,2021-01-23 00:19:47,ItzSh0ckerz,False
570,Obligatory facebook post.,546,0.98,l12n71,okboomer,https://i.redd.it/jf1wgewsafc61.jpg,95,2021-01-20 10:58:03,mman14876,False
571,“Kids today are snowflakes”- the people who had racially divided water fountains,701,0.98,l0q7nn,okboomer,https://i.redd.it/6it25iey3cc61.jpg,53,2021-01-20 00:14:02,Ravenqueen2001,False
572,why bother am i right,698,0.99,l0amba,okboomer,https://i.redd.it/9z8k49klf7c61.jpg,61,2021-01-19 08:30:24,lemonadestrings,False
573,Kidz today no spell gud,44,0.99,l0emtr,okboomer,https://i.redd.it/4o3hz7v2o8c61.jpg,5,2021-01-19 12:39:44,CaffeineAndCrazy,False
574,Wife === bad,184,0.99,kz40bj,okboomer,https://i.redd.it/0qsxqw84cvb61.jpg,5,2021-01-17 15:49:30,Amoeba_Highlander,False
575,Trump University perhaps,1147,0.98,kysppv,okboomer,https://i.redd.it/pctyttj32qb61.jpg,21,2021-01-17 03:45:40,Mr__O__,False
576,Do you think they don't notice?,86,0.98,kz2hwp,okboomer,https://i.redd.it/3wfbc5i0lib61.jpg,0,2021-01-17 13:38:57,zankoku1,False
577,"Alexa, play IDGAF",762,0.99,kycdhj,okboomer,https://i.redd.it/wsnwgqqrlmb61.jpg,32,2021-01-16 10:27:34,ewwafaggot,False
578,Boomers invading the local Facebook group.,40,0.99,kym8on,okboomer,https://i.redd.it/l3rc2wdm3qb61.jpg,5,2021-01-16 22:12:58,Crizack101,False
579,"Not a boomer but I remember this too, and it sucked. Happy we got rid of it.",39,0.96,kyjwn7,okboomer,https://i.redd.it/nxqstbh9gpb61.jpg,4,2021-01-16 20:02:03,,False
580,(Not mine),475,0.99,kxy67f,okboomer,https://i.redd.it/4vfrcqmuxib61.jpg,24,2021-01-15 22:08:09,secret_squirrel2017,False
581,Ah yes. Spank the children!! No spank = spooky spooky.,549,0.99,kxp94s,okboomer,https://i.redd.it/j97zozeq2gb61.jpg,45,2021-01-15 12:30:12,ayyitsv,False
582,why are their humor so cringe,39,0.93,ky1m8e,okboomer,https://i.redd.it/7zcycljw3za61.jpg,7,2021-01-16 00:48:21,Nocaketotake,False
583,Clever title here,1176,0.99,kw3akk,okboomer,https://i.redd.it/4rwf1rfjfwa61.png,24,2021-01-13 04:42:19,greatdane114,False
584,xPost from r/mildlyinfuriating (more than mildly IMO),533,0.99,kvoqwb,okboomer,https://i.imgur.com/UjYWGr0.jpg,41,2021-01-12 15:23:44,Scruffynerffherder,False
585,My home town has an average population age of 60,26,0.95,kw3xou,okboomer,https://i.redd.it/pvqhhxrcnza61.jpg,0,2021-01-13 05:15:32,Blondemaple11,False
586,"Shared by the same lady who posted ""the silent majority has spoken"" on Facebook after the Capitol riots",584,0.99,kvcgbn,okboomer,https://i.redd.it/nstfiqtssra61.jpg,13,2021-01-12 02:51:48,swedishshortsnout,False
587,"Haha, technology bad; boomer good",46,0.98,kvhzbn,okboomer,https://i.redd.it/5haeajuu8ta61.jpg,14,2021-01-12 07:43:31,songbird1681,False
588,No room for nuance on gender,49,0.96,kvg33c,okboomer,https://i.redd.it/krvit77npsa61.jpg,8,2021-01-12 05:55:55,grinch337,False
589,ah yes the boomers are still at it,56,0.93,kv9bhm,okboomer,https://i.redd.it/24wfmjfztfa61.jpg,6,2021-01-12 00:30:01,Nocaketotake,False
590,Not everyone who went to Parler is a racist.,324,0.95,kuxlfy,okboomer,https://i.redd.it/kg0olmxhkna61.png,27,2021-01-11 12:38:07,RangoTheMerc,False
591,"We get it, kids are addicted to technology. For the love of God, make other jokes",28,0.97,kv3cnx,okboomer,https://i.redd.it/0esh5p8re6961.jpg,3,2021-01-11 19:40:13,Toku-Nation,False
592,Ok Boomer,893,0.99,ktoem4,okboomer,https://i.redd.it/f8jpyk568aa61.jpg,32,2021-01-09 15:45:51,itzme89,False
593,But you weren’t born during the war or the revolutions??? (My dad posted this on FB),38,0.95,ktr955,okboomer,https://i.redd.it/rmb3sdeoaba61.jpg,7,2021-01-09 19:21:42,Cutiejea,False
594,TECHNOLOGY BAD. An elderly person is good and wise just because they don't use phone. Kid bad. Whats also funny is the amount of folks defending this.,177,0.89,ktbjct,okboomer,https://i.redd.it/86o2bi3596a61.jpg,45,2021-01-09 02:24:11,ayyitsv,False
595,This was in my teacher's geography slide,870,0.99,kssjal,okboomer,https://i.redd.it/6fymfblsm0a61.png,26,2021-01-08 07:30:03,TerrariaFail_Reborn,False
596,The boomer are at it again!,382,0.96,krrxo4,okboomer,https://i.redd.it/775k4x8lrp961.jpg,11,2021-01-06 22:31:19,Nocaketotake,False
597,Yep.... just gonna leave this right here,68,0.95,kryjxw,okboomer,https://i.redd.it/6ebak78eds961.jpg,14,2021-01-07 03:43:18,qbicle14,False
598,phone bad tv good,144,0.99,kri2zq,okboomer,https://i.redd.it/luazlu7pqi961.jpg,3,2021-01-06 11:52:01,MrLion626,False
599,Ok boomer,854,0.98,kqyi3t,okboomer,https://i.redd.it/2s3s4csdni961.jpg,44,2021-01-05 19:01:13,Domagoj994,False
600,Love you too Nana,60,0.97,krajxx,okboomer,https://i.redd.it/iyr836rdkl961.jpg,13,2021-01-06 04:49:44,VincyThePrincy,False
601,I’m a goofy boomer yeah!,29,0.95,krcfa6,okboomer,https://i.redd.it/s68e8vcb1m961.jpg,1,2021-01-06 06:24:39,,False
602,Shoes bad? Holy shit that's boomer as fuck!,1082,0.99,kq9lbs,okboomer,https://i.redd.it/0lih3xmji5q31.jpg,61,2021-01-04 19:48:43,RayBrower,False
603,Facebook Find,39,0.95,kqckg6,okboomer,https://i.redd.it/plmdmeldic961.jpg,8,2021-01-04 22:22:30,NoWayTomato,False
604,Streamers bad!!,33,0.93,kqct1p,okboomer,https://i.redd.it/4ci839sfkc961.jpg,10,2021-01-04 22:34:01,sniperpandas,False
605,"New times bad, old times good",32,0.98,kqdkoq,okboomer,https://i.redd.it/ngr8sre3rc961.jpg,2,2021-01-04 23:11:23,Nourishedcar611,False
606,"I don't know if this counts, but it's pretty close.",1020,0.98,kp37nj,okboomer,https://i.redd.it/qwx6j3cluy861.jpg,76,2021-01-03 00:25:59,TigerlordZ59900,False
607,Sigh,776,0.97,kof4js,okboomer,https://i.redd.it/kc7g24g8ar861.jpg,51,2021-01-01 22:59:24,MyopiaPod,False
608,I wish I could talk with my mouth parts,52,0.96,koncvf,okboomer,https://i.redd.it/rd3v0epsit861.jpg,1,2021-01-02 06:30:58,MyopiaPod,False
609,On my hometown Facebook noticeboard,461,0.99,ko601b,okboomer,https://i.redd.it/1e039t7esn861.jpg,26,2021-01-01 11:14:10,prier,False
610,What an original joke,358,0.97,ko2068,okboomer,https://i.redd.it/l7nbbh9sdm861.jpg,10,2021-01-01 06:30:28,bee5sea6,False
611,"Really, mice fear technology, really",12,0.68,koc60a,okboomer,https://i.redd.it/9d1p5tqmsm861.jpg,4,2021-01-01 20:02:04,SuchLimeMemes,False
612,Found this on a Instagram,44,0.92,ko6jkt,okboomer,https://i.redd.it/1p6bkwbhzn861.jpg,7,2021-01-01 11:53:48,Ahonamedsway,False
613,Well yes but,558,0.99,kno6p8,okboomer,https://i.redd.it/nt16vl8f9i861.png,14,2020-12-31 16:38:51,FUNKOPUPPET,False
614,An ok boomer that may happen. Maybe she was looking for something to show him,33,0.95,knd9br,okboomer,https://i.redd.it/tk2lbhilpe861.jpg,1,2020-12-31 04:42:22,Ravenqueen2001,False
615,Litchrally a sentient boomer comic,26,0.89,knacp3,okboomer,https://i.redd.it/xwiyqoyxxd861.png,2,2020-12-31 02:12:09,AlienUtterings,False
616,You youngsters are so entitled for expecting a modern feature in a modern rerelease!!!,170,0.96,kmxts9,okboomer,https://i.redd.it/6mkj0fc43a861.jpg,18,2020-12-30 13:09:17,-Some-Internet-Guy-,False
617,Right like this would totally happen,301,0.98,kmtcku,okboomer,https://i.redd.it/giza9sdsn8861.png,33,2020-12-30 08:21:33,neatguy500,False
618,"It seems my great uncle expects people (probably kids) to shovel his driveway for less than $10. Sorry boomer, nobody wants to do your labor for a quarter like it's the 50s.",547,0.97,kmhwx0,okboomer,https://i.redd.it/gxsbj13cn5861.png,51,2020-12-29 22:18:36,smalltowngoth,False
619,Ok boomer,18,0.96,kmsucb,okboomer,https://i.redd.it/zxmuvwik18861.jpg,1,2020-12-30 07:51:27,Invaliduser12311,False
620,Saw this on Instagram. Thoughts?,1032,0.99,kleuf5,okboomer,https://i.redd.it/x7k1fdqllt761.jpg,74,2020-12-28 05:42:35,,False
621,This is some boomer shit if I ever saw it,542,0.96,kl1fr4,okboomer,https://i.redd.it/uxh1h2afpm761.jpg,58,2020-12-27 15:51:15,embb97,False
622,"Apparently a troll account, but irked me nonetheless.",38,1.0,klduj9,okboomer,https://i.redd.it/553b6jsgbt761.jpg,0,2020-12-28 04:45:50,AjianAja,False
623,Kids these days with their not playing outside,34,0.98,klc4ls,okboomer,https://i.redd.it/ljjho1khus761.png,8,2020-12-28 03:10:36,izzyalyssa,False
624,Found on facebook..,27,0.89,kk2k7s,okboomer,https://i.redd.it/5rmws3n6bd761.jpg,3,2020-12-25 22:55:41,RethaG,False
625,Ok Diply,746,0.99,kiw8zm,okboomer,https://i.redd.it/j9n7znyasy661.jpg,86,2020-12-23 22:04:55,RethaG,False
626,Frosty The Strawman,55,0.94,kj8v62,okboomer,https://i.redd.it/8vmjw17dd2761.jpg,4,2020-12-24 10:08:17,Retrocomparisons,False
627,Ah yes. God have his Archangels AR-15’s and since you own one that must mean you’re one too!,30,0.93,kj54kn,okboomer,https://i.redd.it/ygpkyfho61761.jpg,3,2020-12-24 06:09:03,Str8kush,False
628,Why can’t I just listen to good music while scrolling through the comments and not have something like this appear,29,0.92,kit6jx,okboomer,https://i.redd.it/o223uks7wx661.jpg,2,2020-12-23 19:05:03,brazilliongenesis,False
629,Kids with these wounds. Am i a joke to you?,789,0.98,ki6gwf,okboomer,https://i.redd.it/yzvjvm432r661.jpg,56,2020-12-22 20:05:29,EdgyGuy69420,False
630,"Am I wrong, or is this boomer as fuck?",17,0.8,ki9nkl,okboomer,https://i.redd.it/bztgtsxqvr661.jpg,2,2020-12-22 22:51:44,wjm1101,False
631,"Found on Instagram, will take down if repost",872,0.98,khitfo,okboomer,https://i.redd.it/yni66r0tzj661.jpg,32,2020-12-21 20:20:13,Violas_Blade,False
632,"Literal Translation: 400 years ago, between 21st of December and 27th of December, Guru Govind Singh's (An important historical figure in India) family died for the country and Hinduism, but We only remember Christmas. Posted on my friend's father's Facebook story. India is a 'Secular' State",14,0.73,khz0va,okboomer,https://i.redd.it/22100wu0do661.jpg,0,2020-12-22 11:01:28,shreshthns806,False
633,Get it... because kids don’t know about books today,45,0.94,khs5lh,okboomer,https://i.redd.it/u7ppmsv6cm661.jpg,0,2020-12-22 04:13:12,harrygj18,False
634,Ok Debra,74,0.98,khl5pt,okboomer,https://i.redd.it/xbd0d6nwlk661.jpg,0,2020-12-21 22:24:06,brt_k,False
635,If I had a penny for every complaint about my handwriting I’d be rich,192,0.99,khb49m,okboomer,https://i.redd.it/n352po5p9h661.jpg,18,2020-12-21 11:10:20,kkyle1521,False
636,Saw this in my hometown,650,0.99,kgyz82,okboomer,https://i.redd.it/zka6p8edvd661.jpg,18,2020-12-20 23:44:42,classicjondor,False
637,Maybe there's a smartphone inside,665,0.98,kgpyl6,okboomer,https://i.redd.it/n94jnceqoa661.jpg,27,2020-12-20 13:02:07,Retrocomparisons,False
638,HE COULD HACK THE CIA,719,0.99,kg5bva,okboomer,https://i.redd.it/2lut1e67c4661.png,86,2020-12-19 15:41:12,,False
639,Would I have to download Facebook and then delete it then?,1168,0.99,jxvu3y,okboomer,https://i.redd.it/5fi8gskl6g061.jpg,90,2020-11-21 01:06:23,reallylazyperson,False
640,Ok Boomer,1100,0.99,ecthc8,okboomer,https://i.redd.it/d46uixeail541.jpg,22,2019-12-19 19:23:53,shredder5Collin,False
