,title,score,upvote-ratio,id,subreddit,url,num_comments,created,author,over18
168,So proud…,173,0.99,rzvbn4,okboomer,https://i.redd.it/vty53a0fvoa81.jpg,36,2022-01-09 21:58:43,JoeBaggoDonuts,False
169,"14 inches of snow fell overnight, and the boomers are upset school is closed",210,1.0,rz6jra,okboomer,https://i.redd.it/mzvom2j7dia81.jpg,40,2022-01-09 00:05:59,PorgCT,False
170,This had me laughing maniacally for 200 minutes,10,0.86,rzd59j,okboomer,https://i.redd.it/xduqb96hsja81.jpg,0,2022-01-09 04:53:21,Bahama_Lloyd,False
171,.,53,0.96,ryvapv,okboomer,https://i.redd.it/194btypzdfa81.png,7,2022-01-08 14:05:06,Traditional_Use3718,False
172,"Unalienable, except when they're alienable",153,0.97,ryjsgl,okboomer,https://i.redd.it/8wwjx6k2dca81.png,20,2022-01-08 03:55:27,Quibilia,False
173,Looking for ambitious young adults with shovels,30,0.9,ryoeet,okboomer,https://i.redd.it/nnt7hpsokaa81.jpg,12,2022-01-08 07:28:02,,False
174,I also thought that.,623,0.99,rvhcu1,okboomer,https://i.redd.it/uqlpzth5mk981.jpg,17,2022-01-04 06:35:32,DoctorTurkelton,False
175,Ok Bev,89,0.99,rvl69w,okboomer,https://i.redd.it/838pqn4sil981.jpg,7,2022-01-04 09:38:25,GuerrillaTradio,False
176,What millennials believe according to the Star (UK),13,0.89,ruikpd,okboomer,https://i.imgur.com/u0WmZrC.jpg,0,2022-01-03 01:58:58,Local_Surround8686,False
177,Ok Boomer!,107,0.98,rsitfh,okboomer,https://i.redd.it/ticevihxes881.jpg,17,2021-12-31 07:45:11,Suurpe,False
178,Damn so you’re telling me it’s physically impossible to drive a stick?,162,0.98,rr3m0k,okboomer,https://i.redd.it/cs64f20i3g881.jpg,9,2021-12-29 14:19:45,JonHenryTheGravvite,False
179,*sighs*,258,0.99,rqnugz,okboomer,https://i.redd.it/i8jfo1zy6c881.jpg,21,2021-12-29 01:12:04,ChickenTender-Chips,False
180,"This is like, peak boomer",217,0.98,rpzcbv,okboomer,https://i.redd.it/epysp54kx3881.jpg,15,2021-12-28 04:06:08,DoctorTurkelton,False
181,ALL THEY KNOW IS PHONE,131,0.99,rmbl33,okboomer,https://i.redd.it/axw964jc15781.jpg,4,2021-12-23 00:04:27,eastcoastitnotes,False
182,WhoreTok,234,0.96,rm3btm,okboomer,https://i.redd.it/mqr8g7e3o2781.jpg,2,2021-12-22 16:59:31,Noriaki_Kakyoin_OwO,False
183,Indian child development minister,235,0.99,rljm3z,okboomer,https://i.redd.it/ck2qudyszu681.jpg,11,2021-12-21 22:59:25,,False
184,"Sounds Pretty Communism To Me, Red",370,0.97,rkrqle,okboomer,https://i.imgur.com/njb5UvU.jpg,43,2021-12-20 22:27:32,Longjumping_Base_611,False
185,Pretty much sums up every Baby Boomer's response when you talk about anything they disagree with.,97,1.0,rkwr5b,okboomer,https://i.redd.it/5p0cqup9fr681.jpg,1,2021-12-21 02:17:02,RevolutionaryTalk315,False
186,the emojis,204,0.98,rk7efi,okboomer,https://i.redd.it/4o123cqe9f681.jpg,10,2021-12-20 03:52:47,DOVARKX,False
187,This just screams boomer,207,0.98,rj30ag,okboomer,https://i.redd.it/2uc39rshg9681.jpg,3,2021-12-18 13:51:49,Sh0ck3dd,False
188,Gatekeeping parties,178,0.99,ritkxx,okboomer,https://i.redd.it/2eszliwpccf71.jpg,15,2021-12-18 04:50:19,just_some_troglodyte,False
189,Just pay your student loan...,451,0.98,rhw5zj,okboomer,https://i.redd.it/h4ggzrk2ix581.png,19,2021-12-16 23:27:23,Mr__O__,False
190,My coworker printed out a Yahoo homepage to bring into work because he thought this headline was so funny.,71,0.97,ri05bk,okboomer,https://i.redd.it/sd5orb3byy581.jpg,7,2021-12-17 02:32:28,DannySorensen,False
191,Found in the wild,10,0.86,rhrfdq,okboomer,https://i.redd.it/spquuav0ww581.png,5,2021-12-16 19:35:44,EatPrayShit,False
192,Boomer upset because you can get gems in mobile game,46,0.72,rgvlg5,okboomer,https://i.redd.it/kpg2hrbxho581.jpg,24,2021-12-15 15:22:27,KR1735,False
193,"Oh no, I raised my children differently from how I was raised",199,0.99,rffu01,okboomer,https://i.redd.it/c7ressikbb581.jpg,43,2021-12-13 19:03:39,dona_eis_requiem_,False
194,"The older your kids become, the less they need you. Just saying",713,0.98,ren0hg,okboomer,https://i.redd.it/hf27avf1i3581.jpg,27,2021-12-12 16:45:41,springheeledjack69,False
195,C'mon seniors! Sharon looks forward to working only with her peers.,199,0.99,rdgkq5,okboomer,https://i.redd.it/xkstkqh30r481.jpg,6,2021-12-11 01:04:24,,False
196,Hell no boomer,71,0.81,rcd7s9,okboomer,https://i.imgur.com/RSbo1op.jpg,15,2021-12-09 13:48:37,00010101,False
197,How to Shut Down Boomers,429,0.99,rbu30b,okboomer,https://i.redd.it/cnl5g6yp2a481.jpg,34,2021-12-08 21:13:31,RayBrower,False
198,Found this in Facebook,17,0.92,rc0wbs,okboomer,https://i.redd.it/99099i5zud481.jpg,15,2021-12-09 02:31:51,asianteminator1,False
199,No way this isn’t a boomer over sharing here,5,0.65,rc4wkx,okboomer,https://i.imgur.com/w8ic6cx.jpg,1,2021-12-09 05:48:36,muppetcrayz,False
200,more or less please,44,0.95,rb5whf,okboomer,https://i.redd.it/9wajjis3i5481.jpg,3,2021-12-08 00:05:00,eastcoastitnotes,False
201,All millennials do is eat ass and text too much.,360,0.98,r9zvvy,okboomer,https://i.redd.it/easmxo8d1v381.png,14,2021-12-06 11:13:52,Invet69,False
202,ok boomer,337,0.98,r85lqp,okboomer,https://i.redd.it/p0dys6jbed381.jpg,17,2021-12-03 23:54:24,JoeBaggoDonuts,False
203,Not a bumper sticker. But a vanifesto!!!!,295,0.97,r70b76,okboomer,https://i.redd.it/wlmx0t65j2381.jpg,22,2021-12-02 11:21:52,Invet69,False
204,first reply on my spotify wrapped thread:,52,0.9,r6qnei,okboomer,https://i.redd.it/y7qzf97f80381.png,11,2021-12-02 03:38:30,DoctorowWho42,False
205,A boomer flex.,172,1.0,r65p4x,okboomer,https://i.redd.it/j92ilwn2tu281.jpg,22,2021-12-01 09:23:13,survivorsof815,True
206,Found on LinkedIn,308,0.99,r5srcy,okboomer,https://i.redd.it/9qevtg2zrr281.jpg,37,2021-11-30 23:11:42,PullMyGoalie,False
207,Found one in the wild,261,0.98,r51euk,okboomer,https://i.redd.it/mgfbnkzapk281.jpg,14,2021-11-29 23:24:16,sgt_redankulous,False
208,Surprised it wasn’t an 8-track,195,0.96,r4da3l,okboomer,https://i.redd.it/7jju2srv9e281.jpg,12,2021-11-29 01:47:09,JoeBaggoDonuts,False
209,I'm so tired of hearing that damn word.,27,0.89,r3tk9k,okboomer,https://i.redd.it/eolxqjcfz8281.jpg,8,2021-11-28 07:59:53,CamilaCazzy,False
210,Old straight couples stop hating each other challenge,348,0.99,r2lq3s,okboomer,https://i.redd.it/wiaintrrkx181.jpg,10,2021-11-26 17:37:53,bitchy-cryptid,False
211,A nice list until you get to the bottom and realize electronics bad,197,0.96,r0rwee,okboomer,https://i.redd.it/aevmbpx6wf181.jpg,23,2021-11-24 06:12:10,DizzzyDazzle,False
212,Kids and thier cell phones! Bah!,42,0.97,r0t1u2,okboomer,https://i.redd.it/apob2l8ppd181.png,4,2021-11-24 07:09:07,FurryIrishFury,False
213,Gatekeeping Revolution,222,0.96,r0bmem,okboomer,https://i.redd.it/7xcchat8phj71.png,37,2021-11-23 17:27:26,AutoCrosspostBot,False
214,A ... film ... bombs.,62,0.95,r02sen,okboomer,https://i.redd.it/6y1k5rngc9181.jpg,13,2021-11-23 08:08:33,disconaldo,False
215,ok boomer,231,0.99,qzqkwk,okboomer,https://i.redd.it/j3fa2wl5u2181.jpg,16,2021-11-22 22:54:02,TheRealJacobi_,False
216,Apparently only boomers know how to kiss,330,0.99,qypvp4,okboomer,https://i.redd.it/hkgk8287jw081.jpg,21,2021-11-21 13:03:11,Aquos18,False
217,Medical sensation: Surgeon separating teenager from smartphones for the first time,218,0.99,qw3fs4,okboomer,https://i.imgur.com/3DGRRi0.jpg,4,2021-11-17 22:18:22,Fleshe-Nino,False
218,Proud grandma.,20,0.8,qvpi8b,okboomer,https://i.redd.it/qbl5xj9go2081.jpg,2,2021-11-17 08:39:10,SilentLunchTable,False
219,Lucille Bluth moment,453,0.98,qum566,okboomer,https://i.redd.it/v4f0gct7ssz71.png,6,2021-11-15 23:22:50,,False
220,This says a lot about society,169,0.97,qucbja,okboomer,https://i.redd.it/z6lizebj6qz71.jpg,7,2021-11-15 14:37:22,SignificantAd7603,False
221,Kind of ironic to complain about since they are the ones in charge and who decide to make us work on holidays when we should be with our family,116,0.98,qu4zb8,okboomer,https://i.redd.it/61yu0y8vwnz71.jpg,5,2021-11-15 07:12:18,,False
222,Pen,262,0.97,qrxpf9,okboomer,https://i.redd.it/gkmbit7dovy71.jpg,15,2021-11-12 04:44:25,Local_Surround8686,False
223,Literally just for the last line,359,0.85,qq2jgl,okboomer,https://i.redd.it/w23npxe5cky71.jpg,20,2021-11-09 17:54:01,Ravenqueen2001,False
224,Truth 😂,682,0.99,qpcqem,okboomer,https://i.redd.it/4og4vwhs9dy71.jpg,5,2021-11-08 18:08:18,Revolutionary-Ad6512,False
225,Might be a bit meta but sincerely and from the bottom of my cold entitled millennial heart “ok boomer”,19,0.96,qpjykx,okboomer,https://i.redd.it/bldazctk1fy71.jpg,10,2021-11-09 00:05:52,MandoLakes,False
226,Found in the wild,180,0.79,qnvsmz,okboomer,https://i.redd.it/8nszpnm2fpx71.gif,10,2021-11-06 13:39:00,AXBRAX,False
227,Hur durr,59,1.0,qnqp7z,okboomer,https://i.imgur.com/Y32fzn8.jpg,2,2021-11-06 07:54:17,00010101,False
228,The only true way to make memories with friends,291,0.97,qnbjfk,okboomer,https://i.redd.it/txlbwh0n7sx71.jpg,38,2021-11-05 19:18:50,Retrocomparisons,False
229,"Ok, Boomer",35,0.97,qnpvyx,okboomer,https://i.redd.it/qfadxrh9qvx71.jpg,6,2021-11-06 07:08:34,MetaHelvetica114,False
230,The previous generation can't think twice before speaking apparently,29,0.91,qnb9yg,okboomer,https://i.redd.it/vzda2in85sx71.jpg,14,2021-11-05 19:05:25,,False
231,Sounds like some real Halloween Boomer Vibes.,230,0.99,qjuv9n,okboomer,https://i.imgur.com/SmIGpHu.jpg,37,2021-10-31 23:26:14,RevolutionaryTalk315,False
232,Response to the Gen Y&Z are lazy trope,107,0.99,qjzfc6,okboomer,https://i.redd.it/3n56zqzbvuw71.png,4,2021-11-01 03:11:19,sober2ndthought,False
233,“Kids are all scared of my costume”,435,0.98,qjc3n7,okboomer,https://i.redd.it/5ah6iyoeynw71.jpg,47,2021-10-31 03:55:50,beerfridge911,False
234,"My uncle shared this, you’ve gotta love the persecution complex",38,0.91,qjexge,okboomer,https://i.redd.it/yyj0ufw52nw71.jpg,14,2021-10-31 06:40:28,rs16,False
235,Saw this on a drive thru window. Feel like it's got some boomer vibes to it. What do you think?,270,0.98,qiq08y,okboomer,https://i.redd.it/5frmqi9jehw71.jpg,19,2021-10-30 05:53:53,Safe_Milk8415,False
236,"Profound, to compare an infant without Object-Permanence to a 60 year old that refuses to remember what a PDF is.",229,0.96,qic640,okboomer,https://i.redd.it/0vrgxpeezdw71.jpg,20,2021-10-29 18:24:44,MrNerdy,False
237,TikTok Simply Can't Compare,26,0.97,qiiso3,okboomer,https://i.redd.it/vlog3ijnjfw71.png,6,2021-10-29 23:39:56,ResidentSmartass,False
238,Somehow I refuse to believe this is real but it actually is bruh 🤦🏻‍♂️,392,0.98,qgw3d0,okboomer,https://i.redd.it/d315r3g9qzv71.jpg,39,2021-10-27 18:27:26,,False
239,Barb is gonna take your cell phone!,20,0.95,qh4y46,okboomer,https://i.redd.it/on6uoc514qv71.jpg,5,2021-10-28 01:19:15,,False
240,Seriously?! They get to pay $10 while I'm still stuck with student loans?!,299,0.98,qfwd66,okboomer,https://i.redd.it/qisqfhthjov71.jpg,21,2021-10-26 07:47:25,,False
241,What if?,25,0.93,qfy464,okboomer,https://i.redd.it/b0utfdm9xpv71.jpg,21,2021-10-26 09:28:51,MetaHelvetica114,False
242,Boomer companies think kids wont like etch a sketch without wifi.,257,0.97,qf4nic,okboomer,https://i.redd.it/n6wjgttknhv71.jpg,4,2021-10-25 05:40:20,CaptGreyFolf,False
243,Epic boomer rant,202,1.0,qef02x,okboomer,https://i.redd.it/8dxl9n1izyu71.jpg,14,2021-10-24 03:55:15,,False
244,Boomer tipper 😂,235,0.99,qd6yli,okboomer,https://i.redd.it/a4petb8utwu71.jpg,42,2021-10-22 07:37:59,Revolutionary-Ad6512,False
245,Old timer GPS... Got this from dear old ma,129,0.97,qd144v,okboomer,https://i.redd.it/givf81u59vu71.jpg,15,2021-10-22 02:20:18,FurryIrishFury,False
246,Pizza,19,0.83,qd0m44,okboomer,https://i.redd.it/s5mmi1b3msu71.jpg,3,2021-10-22 01:55:32,Local_Surround8686,False
247,This “thought provoking” art won a competition in my city,11,0.93,qcx9bd,okboomer,https://i.redd.it/v42i43u9cuu71.jpg,5,2021-10-21 23:16:04,NicolBolassy,False
248,"i work with computers and yes i take notes with a pencil, crazy i know",221,0.95,qbojdj,okboomer,https://i.redd.it/zuwsdh8zigu71.jpg,3,2021-10-20 05:39:51,vodkaffee,False
249,Jobs,545,0.98,qb0oav,okboomer,https://i.redd.it/dkp3fh6ix8u71.jpg,40,2021-10-19 06:46:29,RayBrower,False
250,Yup,450,1.0,qa2uze,okboomer,https://i.redd.it/13wh943bl1u71.jpg,13,2021-10-17 22:34:56,Revolutionary-Ad6512,False
251,Amen,79,1.0,qa4l30,okboomer,https://i.redd.it/rgy6ymmi02u71.jpg,0,2021-10-18 00:00:11,Revolutionary-Ad6512,False
252,HURR DURR MILLENNIAL BAD,270,0.96,q9rnck,okboomer,https://i.redd.it/iqxizp6gtxt71.jpg,37,2021-10-17 09:53:27,Revolutionary-Ad6512,False
253,"Ooga booga, books good tv bad",264,0.98,q78l32,okboomer,https://i.redd.it/zxveci4g77t71.jpg,26,2021-10-13 16:23:49,erenozata,False
254,This is why “for profit” colleges exist,405,0.98,q6upgp,okboomer,https://i.redd.it/vx0gi1qzu2t71.jpg,6,2021-10-13 01:46:52,averagebloodloss,False
255,All women are blue-haired ogres and unhygienic unladylike prostitutes. R/conspiracy has devolved mostly into antivaxxers but sometimes you get some ripe incels.,7,0.9,q7bptv,okboomer,https://i.redd.it/h3i336ys08t71.jpg,0,2021-10-13 19:27:35,Eliteguard999,True
256,Same crazy uncle ranting about indigenous peoples' day. Ok boomer.,25,0.96,q72ybp,okboomer,https://i.imgur.com/I72VWhh.jpg,11,2021-10-13 09:24:17,00010101,False
257,The English in this is hurting my head,256,0.97,q5uiyo,okboomer,https://i.redd.it/ztxb6v2trss71.png,9,2021-10-11 17:43:52,ShadowMewtwoLover69,False
258,"BOOMER AS FUCK(stolen from instagram, DO NOT follow this account i know its boomer gold but dont encourage them)",218,0.98,q57qv9,okboomer,https://i.redd.it/o15iutuxgms71.jpg,11,2021-10-10 18:39:37,Domagoj994,False
259,How to frighten a boomer. The more young-person tactic the better. Go!,149,0.99,q4z78s,okboomer,https://i.redd.it/6tukrwy6phs71.jpg,51,2021-10-10 07:49:20,Equal-Bus-557,False
260,"Godspeed, old man",150,0.96,q4jv9t,okboomer,https://i.redd.it/f5m3sud3zes71.jpg,4,2021-10-09 17:27:06,ChuckieOrLaw,False
261,"Video games cause cancer, aids, and violence.",158,0.96,q40fa4,okboomer,https://i.redd.it/u4zn9em5z8s71.jpg,7,2021-10-08 21:16:46,2plash6,False
262,That's totally how it works. Does anyone else have an uncle boomer that shares this kind of stuff?,202,0.98,q3kne2,okboomer,https://i.imgur.com/EXui0Cr.jpg,11,2021-10-08 04:17:35,00010101,False
263,"Happy birthday to me. Worst part is, he’s 32",56,0.9,q3hff0,okboomer,https://i.redd.it/fxp9l7xi43s71.jpg,3,2021-10-08 01:36:10,Thejuiceis_loose,False
264,This was sent today to a listserv I'm on,7,0.77,q3jy5g,okboomer,https://imgur.com/Zqa2NT7.jpg,1,2021-10-08 03:39:39,VTJedi,False
265,"My uncle usually likes his own posts (which is kinda like high fiving yourself), but even after a day none of his friends have reacted. Ok boomer.",165,0.91,q2zsjv,okboomer,https://i.imgur.com/wMaeQ4J.jpg,40,2021-10-07 08:29:42,00010101,False
266,On a Tiktok re-upload on YT of a young girl dancing,153,0.94,q20bnb,okboomer,https://i.redd.it/6c3n6eu8unr71.jpg,10,2021-10-05 22:11:50,Herobrine_20a,False
267,Zuck's looking for a paddling,375,0.99,q1ghyq,okboomer,https://i.redd.it/dkwuyrfrair71.jpg,3,2021-10-05 03:33:43,MetaHelvetica114,False
268,Classic boomer,19,0.93,q1l4is,okboomer,https://i.redd.it/zx842zb2fhr71.jpg,0,2021-10-05 07:42:18,RayBrower,False
269,Guess Mario really was a boomer,16,0.88,q06zsw,okboomer,https://i.redd.it/zh741thkx2r71.jpg,6,2021-10-03 06:01:29,IThinkImNateDogg,False
270,I am going to push my face into a belt grinder,289,0.98,pyo6v2,okboomer,https://i.redd.it/k4eah0biaoq71.jpg,10,2021-09-30 22:38:51,Moffpro,False
271,"wow, ok boomer",440,0.99,pxzgz1,okboomer,https://i.redd.it/dhnd8ntv1hq71.png,62,2021-09-29 22:18:53,Aaladorn,False
272,God bloody dammit,195,0.98,pxuraa,okboomer,https://i.redd.it/40jppt40wfq71.jpg,14,2021-09-29 18:23:41,XxOneWithSlimesxX,False
273,Beating kids + bashing millennials = boomer humor gold,489,0.99,psld69,okboomer,https://i.redd.it/u7w2jnkumvo71.png,26,2021-09-21 21:12:50,DucksOnALake,False
274,BoomerBook,245,1.0,pqkepw,okboomer,https://i.redd.it/quyai54cq8o71.png,14,2021-09-18 16:32:24,picboi,False
275,Violence soothes the fragile ego,149,1.0,pqlpoz,okboomer,https://i.redd.it/l1cqq5txq5o71.jpg,36,2021-09-18 18:11:18,FurryIrishFury,False
276,Getting Boomer vibes from this pic. The Generation Who Still Cant Get Over The Civil War.,19,0.91,pqqcuk,okboomer,https://i.redd.it/u2oh6463r2o71.jpg,5,2021-09-18 22:41:14,RevolutionaryTalk315,False
277,"Boomer aunt posted this, had to exercise self control.",254,0.98,pp0bbg,okboomer,https://i.redd.it/u3xw8u4mrqn71.jpg,31,2021-09-16 03:45:54,Ravenqueen2001,False
278,"back in my day, people had different personalities!!",129,0.97,pn9elk,okboomer,https://i.redd.it/jsaqdlhtk7n71.jpg,15,2021-09-13 11:13:57,rensmt,False
279,Can believe Facebook advertises this shit. Guess that’s their man demographic,244,0.99,pn562d,okboomer,https://i.redd.it/1to11v6n66n71.jpg,57,2021-09-13 06:32:43,IThinkImNateDogg,False
280,Found this on a boomers page,337,0.98,pme7ar,okboomer,https://i.redd.it/y4d5yw2nixm71.jpg,38,2021-09-12 01:23:56,,False
281,Someone gets it,443,0.98,pl6cc3,okboomer,https://i.redd.it/jkqu8ktsijm71.png,25,2021-09-10 02:19:58,PorgCT,False
282,Kids these days...,174,0.98,pjmu78,okboomer,https://i.redd.it/mqn2gwmf10m71.jpg,18,2021-09-07 18:44:59,RayBrower,False
283,Coming from those who desperately depend on young people to fix all their tech problems lol,148,0.98,pip3q7,okboomer,https://i.redd.it/4r03kurm6sl71.jpg,18,2021-09-06 06:23:35,Litty-Jimmy,False
284,Don't kids today have to do school online if there's a snow day now?,219,0.94,pidx4c,okboomer,https://i.redd.it/ejwf00sf1pl71.jpg,28,2021-09-05 19:49:35,smalltowngoth,False
285,Lil Nas X,371,0.97,phy2qn,okboomer,https://i.redd.it/by8gbinefjl71.png,10,2021-09-05 01:04:09,ItzSh0ckerz,True
286,hmm,32,0.98,phzzxc,okboomer,https://i.redd.it/fjz9y2gc0kl71.png,4,2021-09-05 02:54:13,_ermest,False
287,"Good for you, bro",342,0.98,ph54by,okboomer,https://i.redd.it/3xqsxt36ial71.jpg,40,2021-09-03 18:56:10,MetaHelvetica,False
288,Mask bad,391,0.95,pgjkkb,okboomer,https://i.redd.it/mi7xl0xrt3l71.jpg,36,2021-09-02 20:28:45,,False
289,This Billboard gives off unlimited Boomer vibes. I swear that this is literally the same unhelpful advice I get when ever I ask a Boomer how to get out of financial difficulty.,309,0.98,pfksni,okboomer,https://i.imgur.com/QmyEdw9.jpg,41,2021-09-01 08:12:13,RevolutionaryTalk315,False
290,"You dumb cuz you think you smarter than old. Haha, you drink battery!",364,0.97,penm0s,okboomer,https://i.redd.it/bttv0h4bcjk71.png,43,2021-08-30 23:38:18,smalltowngoth,False
291,‘Share’ the ‘Link’ to life beyond Facebook,396,0.98,pe25rw,okboomer,https://i.redd.it/bitumb7mock71.jpg,28,2021-08-30 01:11:45,VJJS,False
292,The one time boomers pretended to care about COVID in their desperate attempts to own the zoomers.,307,0.98,pdhtx8,okboomer,https://i.redd.it/32gh99w2w5k71.png,12,2021-08-29 02:29:44,ItzSh0ckerz,False
293,Ok Betty,323,1.0,pcn5e8,okboomer,https://i.redd.it/r2sbflj19sj71.jpg,17,2021-08-27 18:46:16,RayBrower,False
294,Good old Facebook boomers,301,0.96,pc7q6z,okboomer,https://i.redd.it/ouzxk5fehrj71.jpg,10,2021-08-27 01:53:53,Equal-Bus-557,False
295,F*ck bicycle helmet and all kind of safety protections! Kids these days are way too spoiled and needs to feel pain like we did back in my days!,242,0.99,pb6ubz,okboomer,https://i.redd.it/pazta9uqpgj71.jpg,37,2021-08-25 13:41:10,,False
296,Maturity on LinkedIn,277,0.99,pantyz,okboomer,https://i.redd.it/ox3m03cmgaj71.jpg,20,2021-08-24 19:26:06,SavannahllThellCat,False
297,When you haven't listened to new music since the 1980s,23,1.0,paowa1,okboomer,https://i.redd.it/252xj4ackbj71.jpg,4,2021-08-24 20:21:52,supernintendo128,False
298,Boomer thinks free college devalues a degree,132,0.97,pa8g4z,okboomer,https://i.redd.it/g6usqjwe66j71.jpg,14,2021-08-24 02:15:15,jordanissport,False
299,Phone bad,248,0.97,pa23kn,okboomer,https://i.redd.it/m119361ll4j71.jpg,27,2021-08-23 20:56:22,jussbethesdagirl,False
300,This art style...,82,1.0,pa4wo4,okboomer,https://i.redd.it/8wcmzfhsh3j71.jpg,6,2021-08-23 23:15:02,A_Random_Sith,False
301,haha marriage bad joke go brr,42,1.0,p9t24a,okboomer,https://i.redd.it/56m0m8twj1j71.jpg,3,2021-08-23 10:41:39,AtomicTurtle2,False
302,Ok Boomer,86,0.99,p9ge3j,okboomer,https://i.redd.it/jhler5b5ksi71.jpg,15,2021-08-22 22:40:13,A_Random_Sith,False
303,Second sentence of the original post title. Why?,61,0.96,p9dz89,okboomer,https://i.redd.it/cyqivfbfcwi71.jpg,7,2021-08-22 20:32:08,A_Random_Sith,False
304,Kids don't use Facebook,272,0.98,p8r7ll,okboomer,https://i.redd.it/s9sfrvjsnpi71.jpg,26,2021-08-21 18:42:03,chuckunbob,False
305,Kids now can’t be themselves on an “app”,358,0.98,p7re8y,okboomer,https://i.redd.it/zvxfjnzvi9i71.jpg,55,2021-08-20 06:05:35,huntercolej,False
306,"Old stuff is ""frightening "".",254,0.96,p70g56,okboomer,https://i.redd.it/x16jq9zfn6i71.jpg,39,2021-08-19 02:46:13,ihatesnoods,False
307,Facebook marketplace is fun.,305,0.98,p6qx32,okboomer,https://i.redd.it/wkjbmmti94i71.jpg,12,2021-08-18 18:44:37,TheRealSoloSickness,False
308,Too Bad We Don't Want to Abuse Children Anymore 🥴,481,0.98,p64jui,okboomer,https://i.redd.it/n525pgnjexh71.jpg,36,2021-08-17 19:40:18,Heli417,False
309,<sigh>,296,0.99,p54g7h,okboomer,https://i.redd.it/jfxo62vcylh71.jpg,32,2021-08-16 05:09:58,220221WhatevrItTakes,False
310,wHaT iS nOrTH?!?,279,0.97,p4spof,okboomer,https://i.imgur.com/7nSTpEl.png,19,2021-08-15 18:11:46,Kapitan_eXtreme,False
311,Nextdoor is a dark place…,50,0.97,p4q6mm,okboomer,https://i.redd.it/9m7yzp09nhh71.jpg,13,2021-08-15 14:40:36,PMSMediumPurple,False
312,Is it possible to lose your eyesight from rolling your eyes too hard?,283,0.99,p4ec32,okboomer,https://i.redd.it/iuzyjngmjdh71.png,9,2021-08-15 00:53:11,izzyalyssa,False
313,Oh boy I’m so deeply offended!,52,0.96,p4k446,okboomer,https://i.redd.it/sdio4m9y9fh71.jpg,11,2021-08-15 06:42:29,ConverseBriefly,False
314,No explanation necessary...,352,1.0,p33kei,okboomer,https://i.redd.it/xa289h3cgyg71.jpg,15,2021-08-12 22:08:01,pts1354,False
315,"Ahh, Facebook. The home of the boomer meme.",513,0.96,p2yyaf,okboomer,https://i.redd.it/ttrl4tm99xg71.jpg,66,2021-08-12 18:06:36,Equal-Bus-557,False
316,"How do you do, fellow kids…",351,0.98,p1rc8g,okboomer,https://i.redd.it/y1flvh9bejg71.jpg,20,2021-08-10 20:51:06,TitsMcGrits,False
317,Grandpa's off his meds again,58,0.98,p1tel6,okboomer,https://i.redd.it/il1qryumakg71.png,3,2021-08-10 22:31:07,BeenEatinBeans,False
318,Sorry for washing,368,0.98,ozja5b,okboomer,https://i.redd.it/cd41vq8v0uf71.jpg,38,2021-08-07 06:10:02,Dukethekitten,False
319,i cannot roll my eyes any harder,109,0.97,ozmb1x,okboomer,https://i.redd.it/aal0ssb91vf71.jpg,26,2021-08-07 09:34:34,Satanic_Nun1,False
320,Ok fellow boomer,471,0.97,oyvhet,okboomer,https://i.redd.it/y23mv9jgsmf71.jpg,31,2021-08-06 05:50:26,Poonker,False
321,"I frankly find more people complaining about PC than people preaching PC. And of course, there's China to blame",28,0.95,oyzln3,okboomer,https://i.redd.it/h8bep2cl1of71.png,2,2021-08-06 10:04:52,spherical_cow314,False
322,The fact that 90% of the artists in the top where trash people tho...💀,409,0.96,oxxopu,okboomer,https://i.redd.it/td1m397xldf71.jpg,143,2021-08-04 22:57:47,,False
323,Wife bad.,424,0.98,ow5ofr,okboomer,https://i.redd.it/4s262n6qvue71.jpg,15,2021-08-02 07:59:04,Satanic_Nun1,False
324,Smartphones bad,10,0.86,owd0zk,okboomer,https://i.redd.it/4vi2y86qpxe71.jpg,1,2021-08-02 17:30:35,Movieparodist,False
325,Boomer tries to negate the work caddies do in golf,38,0.95,ovzqk1,okboomer,https://i.redd.it/79x0ihe34te71.jpg,5,2021-08-02 02:02:12,bearzbeetzbattles,False
326,Confounded technology!,302,0.99,ovb8f1,okboomer,https://i.redd.it/4b5rq1hryje71.jpg,9,2021-07-31 22:57:09,FurryIrishFury,False
327,"It's a long photo, but a good snapshot of how boomers view millennials",432,0.99,ounjbr,okboomer,https://i.redd.it/6fg1psbyide71.jpg,94,2021-07-30 21:37:00,MrsMozely,False
328,Really?? Not even being a little Sarcastic???,149,0.98,otnk6z,okboomer,https://i.redd.it/6ezfxcrxz1e71.jpg,11,2021-07-29 06:50:48,Heli417,False
329,My Grandma keeps trying to start arguments she can't win,637,0.97,ot03ff,okboomer,https://i.redd.it/e1exdd0fyud71.jpg,41,2021-07-28 07:09:48,Whiterabbit48,False
330,Remember when we had no choice in anything and no culture?,392,0.99,os0amd,okboomer,https://i.redd.it/t07y6xb4cjd71.jpg,90,2021-07-26 20:22:33,ripjaw6442,False
331,Even has a boomer profile pic,433,0.98,oqxj4v,okboomer,https://i.redd.it/67wdmblwz7d71.jpg,41,2021-07-25 01:57:11,bigfatg11,False
332,No title needed,305,0.88,opv69q,okboomer,https://i.redd.it/vfqvt6bejtc71.gif,26,2021-07-23 10:19:32,Koolade446,False
333,"It's probably lighthearted, but still, holy moley.",196,0.96,op8ptu,okboomer,https://i.redd.it/7o83bsaqvmc71.jpg,9,2021-07-22 12:33:39,Quibilia,False
334,California Dreamin',421,0.97,oovsyg,okboomer,https://i.redd.it/l9a5kdjzlkc71.jpg,47,2021-07-21 23:53:35,ripjaw6442,False
335,Irony so thick and sweet you can carve it with a knife,633,0.99,oo81vn,okboomer,https://i.redd.it/18a4as3ghec71.png,17,2021-07-21 00:02:33,RayBrower,False
336,We are not the same,343,0.99,onowp4,okboomer,https://i.redd.it/x4hkudqbx8c71.jpg,61,2021-07-20 04:00:21,anoobsearcher,False
337,"""The rest of the world knows that the young doesn't know anything""",219,0.94,omtv2y,okboomer,https://i.redd.it/rxweyterzzb71.jpg,17,2021-07-18 21:57:59,__Loreany__,False
338,Ok Prequelmemes,491,0.99,olsizq,okboomer,https://i.redd.it/plxm3jk3vlb71.jpg,7,2021-07-17 04:46:55,Poonker,False
339,Most of the rappers I listen to weren’t killed from drugs but alright,37,0.96,oltvmo,okboomer,https://i.redd.it/tsacn30e5ob71.jpg,10,2021-07-17 06:08:08,ZigZagImmaBrad,False
340,These kind of jokes need to die....,272,0.97,okw5st,okboomer,https://i.redd.it/usikcxsy5db71.jpg,18,2021-07-15 21:48:02,TheTinyToastTTT,False
341,Ok baby,294,0.93,ok0joj,okboomer,https://i.redd.it/6g1hgh5w03b71.jpg,14,2021-07-14 14:40:26,Poonker,False
