,title,score,upvote-ratio,id,subreddit,url,num_comments,created,author,over18
0,Somehow I doubt this happened,349,0.99,y35m41,okboomer,https://i.redd.it/mno22eoa6mt91.jpg,65,2022-10-13 23:41:49,Comfortable_Set_9520,False
1,The most boomer shirt I have ever seen lmao I need to make this a meme,103,0.96,y29cj5,okboomer,https://i.redd.it/765d0c11pet91.jpg,5,2022-10-12 22:32:31,Legitimate_Knee_3719,False
2,Another member of the “Me” Generation feeling entitled to the attention of young women…,155,0.98,y1dxe6,okboomer,https://i.redd.it/bhm3lsr5h7t91.jpg,177,2022-10-11 22:17:30,when-in-entropy,False
3,Happens to me a lot,351,0.98,xwbd12,okboomer,https://i.redd.it/vfynw0fotzr91.jpg,10,2022-10-05 19:27:41,sockpuppet1234567890,False
4,Priuses are not doing there part!,135,0.95,xv4s4h,okboomer,https://i.redd.it/48okb3l7qpr91.jpg,13,2022-10-04 09:30:27,ajnovak,False
5,You keep your dirty Jazz Hands to yourself.,136,0.99,xur1er,okboomer,https://i.redd.it/77397jwvtmr91.png,22,2022-10-03 23:46:14,GreetingsADM,False
6,Comedy gold I experienced today.,176,0.98,xuage9,okboomer,https://i.redd.it/356azwmqzir91.jpg,10,2022-10-03 10:51:23,Indigo_Mockingbird,False
7,Eating in the Fifties,405,0.99,xtpncx,okboomer,https://i.redd.it/5am72k26ger91.jpg,133,2022-10-02 19:34:52,FUCK_INDUSTRIAL,False
8,Netflix and vaping,206,1.0,xrwg27,okboomer,https://i.redd.it/2obrtcq7oyq91.jpg,19,2022-09-30 14:31:10,derpface90,False
9,on the refrigerator at work. none of the math is right,76,0.97,xpn1ko,okboomer,https://i.redd.it/8ncgl9i6sfq91.jpg,8,2022-09-27 22:59:34,dezoneroni,False
10,Comment on my towns FB page from a post complaining about traffic,129,0.99,xp8f8u,okboomer,https://i.redd.it/uwhrqrf0fcq91.jpg,18,2022-09-27 11:40:26,wayfaringstrangerxx,False
11,"Have you tried making it funny again, instead of ranting about diversity?",277,0.96,xkl2f6,okboomer,https://i.redd.it/teglp75ytap91.jpg,34,2022-09-22 05:16:50,paxinfernum,False
12,boomers love complaining about problems they created,436,0.99,xfsh7i,okboomer,https://i.redd.it/63e4d2udb8o91.png,25,2022-09-16 19:44:40,scipio_africanus123,False
13,All boomers are gaslighters,335,0.98,xfssw7,okboomer,https://i.redd.it/u91e2yxmd8o91.png,2,2022-09-16 19:57:19,scipio_africanus123,False
14,ok boomer,216,0.98,xffseb,okboomer,https://i.redd.it/4psbdlpmz4o91.jpg,42,2022-09-16 08:33:30,stevethepirate89,False
15,“GOD SAV THE QUEEN SHOW SOM RESPECT”,162,0.95,x99a3m,okboomer,https://i.redd.it/copam995som91.jpg,6,2022-09-09 00:58:51,MFtch93,False
16,this guy gets it,296,0.99,x91uoi,okboomer,https://i.redd.it/nxbgkt0x9nm91.jpg,15,2022-09-08 19:54:56,scipio_africanus123,False
17,Old People,453,0.99,x7ghlj,okboomer,https://i.redd.it/t46yyauga8m91.png,6,2022-09-06 23:00:06,RayBrower,False
18,I don't know how we're supposed to afford motorcycles when half of us can barely make rent.,242,0.99,x5piel,okboomer,https://i.redd.it/xhlng0q50vl91.jpg,18,2022-09-04 20:50:41,FUCK_INDUSTRIAL,False
19,Ok boomer,348,0.98,x4reuw,okboomer,https://i.redd.it/rpluhoonhml91.jpg,20,2022-09-03 16:12:22,,False
20,"I am an early millennial and did plenty of these things. Some currently. Vinyl comeback, anyone?",104,0.97,x3l8mj,okboomer,https://i.redd.it/yw3soykxubl91.jpg,57,2022-09-02 04:27:11,tbgmdhc278,False
21,Found this one in the wild,320,0.98,x0dc4l,okboomer,https://i.redd.it/henegvfyekk91.jpg,68,2022-08-29 08:09:30,,False
22,Lol I didn’t think I would find another one so soon after the other 🤣🤣,23,0.96,x0dqvp,okboomer,https://i.redd.it/hoze26vkikk91.jpg,5,2022-08-29 08:29:49,,False
23,"I work at a country club, and a group of old people brought this from home and put it on their table.",213,0.98,wzdt4q,okboomer,https://i.redd.it/33dt2ehyobk91.jpg,20,2022-08-28 02:49:34,ShroomMessiah,False
24,Selfish boomers are losing shit with this on FB.,164,0.95,wv950s,okboomer,https://i.imgur.com/37Ca32x.jpg,46,2022-08-23 05:19:06,Contrerase,False
25,I think my grandma’s sister has never seen a straw before.,12,1.0,wveqdx,okboomer,https://i.redd.it/9w2y2eix0ej91.jpg,1,2022-08-23 09:36:04,No_Restaurant_126,False
26,"Okay grandpa, time for you to take a nap now.",300,1.0,wt5dl3,okboomer,https://i.redd.it/ah9re3uoyui91.jpg,51,2022-08-20 17:29:40,,False
27,Press X for Doubt,302,0.99,wru4rg,okboomer,https://i.redd.it/y6foou1d3hi91.jpg,11,2022-08-19 02:08:03,Perjink,False
28,Context: a National Geographic article analizing influencers and social media on India.,76,0.87,wp8731,okboomer,https://i.imgur.com/2ej5MvH.jpg,10,2022-08-16 00:46:48,afancycatnamedmike,False
29,Boomer music=good millennial music=bad 🙄,15,0.89,wohtw3,okboomer,https://i.redd.it/78ndsa883rh91.png,8,2022-08-15 03:23:57,octoteach17,False
30,Lick the boots of your employer,316,0.97,wnm9fw,okboomer,https://i.redd.it/ek4igbtx5jh91.jpg,36,2022-08-14 00:44:47,wolfman86,False
31,Progress,473,0.99,wm1nqs,okboomer,https://i.redd.it/7smnqauab5h91.jpg,11,2022-08-12 02:10:19,Tinkerer221,False
32,not all boomers are bad,207,0.94,wlqlim,okboomer,https://i.redd.it/d3jgfczbz2h91.png,25,2022-08-11 18:19:16,scipio_africanus123,False
33,Ok boomer,62,0.9,wlx0e0,okboomer,https://i.redd.it/mfdaay8kc4h91.jpg,9,2022-08-11 22:55:11,forrestinpeace,False
34,"Silence, Silent!",14,0.86,wlquu3,okboomer,https://i.redd.it/1r9xufxj13h91.png,4,2022-08-11 18:31:45,scipio_africanus123,False
35,Young people bad!,175,0.97,wkn3z2,okboomer,https://i.redd.it/yhqn31l04tg91.png,30,2022-08-10 09:07:42,Delicious_juice,False
36,Editor of the Irish Catholic Dunks on Cosplayers at Dublin Comic Con. Peak lack of self awareness !,196,0.99,wkc29r,okboomer,https://i.redd.it/m7mnvud2bng91.jpg,13,2022-08-10 00:48:17,16ap,False
37,From a YouTube video. Boomers can’t revel in the past without putting down the present. This is extra offensive to me because my boyfriend (23M) is a classically trained composer of electronic music who designs every aspect of his tracks from drums to synth. But “real musicians don’t exist anymore”,117,0.95,wgiopp,okboomer,https://i.redd.it/vm706n6swsf91.jpg,30,2022-08-05 07:23:01,unconventionally_,False
38,"back in the 70s, we got skin cancer like REAL HUMANS",62,0.95,wdqcsr,okboomer,https://i.redd.it/iowemg0gx3f91.jpg,8,2022-08-02 01:08:08,RevolutionaryTalk315,False
39,Never Thought I'd See a Gen-Z with Boomer Energy but Here We Are,64,0.94,wd2kw4,okboomer,https://i.redd.it/nn7biza4rze91.jpg,19,2022-08-01 05:19:38,TheLavenderAuthor,False
40,"Grandson, What's a push notification?",314,0.99,wc6bow,okboomer,https://i.redd.it/kb6k9d9ujre91.jpg,10,2022-07-31 01:44:49,Toku-Nation,False
41,This packaging for modern EtchA Sketch says a lot.,143,0.99,wabx7o,okboomer,https://i.redd.it/guu3jcqznbe91.jpg,9,2022-07-28 20:19:20,jjosh2293,False
42,My mother posted this. The boomer energy is strong,125,0.99,w98zjx,okboomer,https://i.redd.it/qujqlsm3l2e91.jpg,41,2022-07-27 13:47:05,ljqueen15,False
43,"Big retail is cutting hours...after you already clocked in. I know this wasn't the case for Boomers (lots of OT), but now it's become a problem for Millennials and Gen Z.",129,0.98,w6ijn4,okboomer,https://i.redd.it/mpen6v03ted91.jpg,7,2022-07-24 06:01:04,MillennialReport,False
44,Because feeling the pain of cracking your head open in a bicycle accident is definitely necessary. Ok boomer.,83,0.99,w67ztp,okboomer,https://i.redd.it/f78dikh2hcd91.jpg,15,2022-07-23 21:58:09,tbgmdhc278,False
45,I saw this at the hospital today an a clinical. Looks like they are embracing it now.,136,0.97,w5s538,okboomer,https://i.redd.it/ogboiz2m88d91.jpg,19,2022-07-23 07:44:11,,False
46,And then every(boomer) clapped.,224,0.98,w26ehx,okboomer,https://i.redd.it/yagyfdhdddc91.jpg,54,2022-07-18 23:55:30,FatchRacall,False
47,"The funnies have strong boomer energy. I mean it makes sense, but they’re just not funny like when I was little.",190,0.99,w1au9h,okboomer,https://i.redd.it/3q9sukt8k5c91.jpg,21,2022-07-17 21:39:22,rushaall,False
48,"Technology bad, socializing good.",181,0.99,w0gdrb,okboomer,https://i.redd.it/k62czkg9jxb91.jpg,18,2022-07-16 18:41:28,FUCK_INDUSTRIAL,False
49,Great advice found at a local pizza shop.,142,0.99,vzw92p,okboomer,https://i.redd.it/4b4hjuc31sb91.jpg,7,2022-07-16 00:25:02,dona_eis_requiem_,False
50,How many people actually think this is how teenagers sound,305,0.99,vxfjdg,okboomer,https://i.redd.it/ap9ywkvei7b91.jpg,22,2022-07-12 22:08:31,Ravenqueen2001,False
51,An interesting title,234,0.95,vv8kg7,okboomer,https://i.redd.it/607fcn9ibla91.png,21,2022-07-10 00:30:39,scipio_africanus123,False
52,I don't wear a helmet but jeez,37,0.9,vvg6gs,okboomer,https://i.redd.it/l344esud4na91.jpg,4,2022-07-10 06:51:05,scipio_africanus123,False
53,Ok Boomer,23,0.91,vvifo7,okboomer,https://i.redd.it/9ahdmffqtna91.png,1,2022-07-10 08:56:20,Nomster_Dude,False
54,Found one in the wild,301,0.99,vtrjyk,okboomer,https://imgur.com/cahlmPb.jpg,23,2022-07-08 01:30:20,Manofthedecade,False
55,boomers wouldn't know humor if it walked right up to them,232,0.98,vrhdah,okboomer,https://i.redd.it/cqhidiwb9m991.png,25,2022-07-05 02:36:05,scipio_africanus123,False
56,Homie literally made me spit out my drink in laughter,293,0.98,vphcec,okboomer,https://i.redd.it/b47l60n2x3991.jpg,24,2022-07-02 07:55:17,,False
57,How to frighten a Boomer,370,0.97,voqcbb,okboomer,https://i.redd.it/l9qr3g39hv891.jpg,3,2022-07-01 08:32:47,FUCK_INDUSTRIAL,False
58,Today’s kids are so stupid,192,0.99,vnz9kp,okboomer,https://i.redd.it/2ofo6qq27q891.jpg,12,2022-06-30 09:46:25,Lord_Curtain,False
59,What do you mean you can't afford it?!,132,0.97,vntbhr,okboomer,https://i.redd.it/lp6aeapewj891.jpg,5,2022-06-30 04:49:18,Bones4673,False
60,LAbOr sHORtAg3!11!,364,1.0,vly9eo,okboomer,https://i.redd.it/k3369v9tn6891.jpg,20,2022-06-27 21:04:36,mockingjig,False
61,This gem on a video of parents destroying kids' electronics :/,78,0.98,vllcmi,okboomer,https://i.redd.it/rrk3n8t0x2891.png,15,2022-06-27 08:29:24,gosoccerboy5,False
62,Boomers giving top of the line advice to new graduates,143,0.99,vkioqb,okboomer,https://i.redd.it/bpdsog77gs791.png,9,2022-06-25 21:57:58,scipio_africanus123,False
63,boomers want us to work to death,166,0.99,vjp6m6,okboomer,https://i.redd.it/77ipdq01jk791.png,17,2022-06-24 19:32:37,scipio_africanus123,False
64,"Comment from a post about a racist dad. As a GenXer to Millennials, we'll compare ""participation trophies""",67,0.95,vicvzj,okboomer,https://i.redd.it/vjn9r40f18791.jpg,21,2022-06-23 00:41:27,therealgookachu,False
65,Does this belong here,107,0.99,vfse8w,okboomer,https://i.redd.it/870mf53g3k691.jpg,22,2022-06-19 16:07:09,Sleepytime_noodle,False
66,This was the generation that taught me. JFC,427,1.0,vf4iuu,okboomer,https://i.redd.it/dno5637oad691.jpg,16,2022-06-18 17:15:10,mockingjig,False
67,Boomer disguised as a gen z is still a boomer,35,1.0,vf6g58,okboomer,https://i.redd.it/3ah67qjbid691.png,8,2022-06-18 19:08:38,scipio_africanus123,False
68,Phone so bad and kids even worse,251,0.99,vdxut5,okboomer,https://i.redd.it/2ndray3d82691.jpg,8,2022-06-17 04:02:37,Lord_Curtain,False
69,In light of the current market conditions…,480,0.99,vc619w,okboomer,https://i.redd.it/lx35o4roul591.jpg,12,2022-06-14 20:57:27,Litty-Jimmy,False
70,Boomers really hate the idea of people not buying homes.,83,1.0,vc34qc,okboomer,https://i.redd.it/1ixydzpguk591.png,10,2022-06-14 18:38:14,scipio_africanus123,False
71,ass and 9,236,0.98,vayj1o,okboomer,https://i.redd.it/fxkd2jmxz9591.jpg,32,2022-06-13 05:05:29,madamspam333,False
72,"We played on those too, but ok",289,1.0,v8xeas,okboomer,https://i.redd.it/0vc6qjcpgp491.jpg,33,2022-06-10 08:02:05,Electrical_Ad390,False
73,🤔,285,0.93,v81j27,okboomer,https://i.redd.it/ok7xb3ud2h491.jpg,8,2022-06-09 03:47:33,whizewhan,False
74,I said no jabs!,351,0.97,v74o5i,okboomer,https://i.redd.it/t9a9jeaoy8491.jpg,7,2022-06-08 00:32:30,Conman_in_Chief,False
75,Saw this on Facebook today.,257,1.0,v5skmk,okboomer,https://i.redd.it/adez6romvw391.jpg,40,2022-06-06 07:54:03,thealexbrockett,False
76,Ok boomer,136,0.97,v4de5h,okboomer,https://i.redd.it/49hu1sz05i391.jpg,4,2022-06-04 06:20:17,Cutiejea,False
77,ViDeO gAmEs CaUsE vIoLeNcE,250,0.98,v2ra6i,okboomer,https://i.redd.it/2wl32k61q2391.jpg,4,2022-06-02 02:29:52,Toku-Nation,False
78,Big surprise,689,0.98,v1rf8i,okboomer,https://i.redd.it/i2g3g7remt291.jpg,28,2022-05-31 19:52:54,mockingjig,False
79,Ok Boomer.,363,1.0,v0r41d,okboomer,https://i.imgur.com/EfewnjG.jpg,26,2022-05-30 08:55:51,J_G_B,False
80,this post that was recommended for me,17,1.0,v0rnt6,okboomer,https://i.redd.it/ushm5eu9ej291.jpg,1,2022-05-30 09:29:36,Eishten,False
81,Think Like a Boomer,23,0.97,v0lloh,okboomer,https://i.redd.it/16zuor15nh291.jpg,6,2022-05-30 03:36:20,heyyyjaojao,False
82,Why are they so obsessed with cursive?,235,0.99,uv2kjn,okboomer,https://i.redd.it/tiyznk455y091.jpg,41,2022-05-22 08:56:58,FUCK_INDUSTRIAL,False
83,"Boomer unsolicitedly preaches his values to people that didn’t ask for them, or care. Gets exactly what he deserves.",168,0.96,uswa7i,okboomer,https://i.redd.it/2m20evbqcd091.jpg,12,2022-05-19 11:01:54,meisterdoo,False
84,Not even sure if this belongs here but it feels boomery,83,0.94,usx2mt,okboomer,https://i.redd.it/jljjts5cmd091.jpg,3,2022-05-19 11:55:47,Satanic_Nun1,False
85,"Boomers often forget how many kids came out of childhood with serious injuries, or simply didn't make it out of childhood at all.",355,0.97,use2zz,okboomer,https://i.redd.it/na7g02cdu8091.jpg,34,2022-05-18 19:52:33,InkIcan,False
86,Good thing boomers hung out with friends in one location instead of the other!,214,0.96,uqyqhv,okboomer,https://i.redd.it/tr13r3dyxuz81.jpg,18,2022-05-16 21:06:59,ripjaw6442,False
87,Gas car go “vroom”,303,0.97,umlka7,okboomer,https://i.redd.it/7qr1gmmt4oy81.jpg,83,2022-05-10 21:08:53,Bobcatluv,False
88,My aunt keeps posting these on Facebook,122,0.99,umjvax,okboomer,https://i.redd.it/0495m0g6rny81.jpg,22,2022-05-10 19:52:25,bicchlasagna,False
89,Pinched from good ol' FB,187,0.99,ulcjyo,okboomer,https://i.redd.it/msor73e2tby81.jpg,43,2022-05-09 03:41:38,Electrical_Ad390,False
90,They don't make 'em like they used to!,192,0.97,ukd2yt,okboomer,https://i.redd.it/spwu5zbj02y81.png,45,2022-05-07 18:45:44,beefhead74,False
91,My grandma posted this,272,0.99,uinucv,okboomer,https://i.redd.it/lpd1e1r4qkx81.jpg,26,2022-05-05 08:37:04,Tokoduku,False
92,Nice to know he's not bothered by the increase,160,0.98,uhhbus,okboomer,https://i.redd.it/b7hrti5ba9x81.jpg,11,2022-05-03 19:57:04,Electrical_Ad390,False
93,Is the Daila Lama a boomer?,98,0.88,ueiid7,okboomer,https://i.redd.it/1or9m0ziyfw81.jpg,13,2022-04-29 15:31:18,Defractor68,False
94,??? What does this even mean ???,196,0.97,ubtude,okboomer,https://i.redd.it/d1say4tscqv81.jpg,30,2022-04-26 01:24:47,jujuberriii,False
95,Boomer post in r/90s,254,0.97,uazizw,okboomer,https://i.redd.it/3iym5b68giv81.jpg,40,2022-04-24 22:49:43,ripjaw6442,False
96,"i was shopping for a birthday card for my grandpa yesterday, and I saw this card",228,0.99,ua5imr,okboomer,https://i.redd.it/wmuox7ul6av81.jpg,3,2022-04-23 19:01:34,Toku-Nation,False
97,Boomers' idea of Humour,300,0.98,u9fey2,okboomer,https://i.redd.it/qwac6l8z63v81.jpg,71,2022-04-22 19:32:16,Antin0de,False
98,A grandma shared this...,247,0.97,u8hcs7,okboomer,https://i.imgur.com/QrRgqLn.jpg,27,2022-04-21 12:16:27,00010101,False
99,Facebook...,60,0.93,u8h0yg,okboomer,https://i.redd.it/yiqx40r8stu81.jpg,9,2022-04-21 11:52:32,mistrjirka,False
100,Looks good to me,317,0.98,u6lzr7,okboomer,https://i.redd.it/epbunvk2fcu81.png,50,2022-04-19 01:28:28,mim21,False
101,At least we're at lower risk for traumatic brain injuries,261,0.98,u37i7n,okboomer,https://i.redd.it/pg5oodkgtet81.jpg,24,2022-04-14 08:29:04,FUCK_INDUSTRIAL,False
102,Old Man Jenkins,351,0.99,u1xil3,okboomer,https://i.redd.it/vfisva4f93t81.jpg,2,2022-04-12 17:36:53,Toku-Nation,False
103,If I had to suffer reading this from my aunt's Facebook so do you.,159,0.97,tzjj9f,okboomer,https://i.redd.it/2ttdmqx70fs81.jpg,34,2022-04-09 08:02:15,lisamariefan,False
104,Ok boomer,310,0.98,tz6h77,okboomer,https://i.redd.it/f3vjxbg4tbs81.jpg,26,2022-04-08 21:17:08,jussbethesdagirl,False
105,Boomer parent award of the day goes to this lady.,20,0.92,txudnw,okboomer,https://i.redd.it/31axkrq3oxr81.jpg,30,2022-04-07 01:11:40,RevolutionaryTalk315,False
106,Back in my day….,114,0.97,tx2weh,okboomer,https://i.redd.it/5rhf0mgthrr81.jpg,41,2022-04-06 00:58:08,coolkid_tyler27,False
107,"Ah, those “good old days” posts. 🙄",210,0.98,tuvdjp,okboomer,https://i.redd.it/ek8u7lot17r81.jpg,16,2022-04-03 04:12:52,Litty-Jimmy,False
108,FB thirst traps for boomers starter pack,235,0.99,tsxnhx,okboomer,https://i.redd.it/vtaeql1zomq81.jpg,11,2022-03-31 16:58:10,RayBrower,True
109,Warning signs = young people stupid. Obviously found on Facebook.,286,0.98,ts2b5z,okboomer,https://i.redd.it/5ztukh8xlhq81.jpg,30,2022-03-30 14:40:45,greatdane114,False
110,"Boomer who pioneered and got rich off the mortgage backed security industry, which caused the 2008 financial crisis attempts to lecture younger generations who can no longer afford houses about ""making sacrifices""- BlackRock President Says ‘Entitled Generation’ Now Learning About Shortages",74,0.98,ts7083,okboomer,https://i.redd.it/bcih51c41jq81.jpg,11,2022-03-30 19:26:09,hei5man,False
111,Boomers are babysitting us when we show them how to edit a word file,193,0.99,tqawtn,okboomer,https://i.redd.it/znn31y1405q81.jpg,17,2022-03-28 20:15:33,Buttafuoco,False
112,What a great use of police time.,269,1.0,tpnsce,okboomer,https://i.redd.it/9ugjhgp6gyp81.png,22,2022-03-27 22:13:53,FUCK_INDUSTRIAL,False
113,Really now...,160,0.97,toh6ea,okboomer,https://i.redd.it/kpgpdudalnp81.jpg,11,2022-03-26 10:19:50,puremath369,True
114,ok boomer,306,0.95,tkgh5e,okboomer,https://i.redd.it/01ss327ut0p81.jpg,21,2022-03-23 05:09:08,kissmyass42069,False
115,Silent and Gen X do it too tho,292,0.99,tjfzd1,okboomer,https://i.redd.it/le96cix6wno81.jpg,27,2022-03-21 22:08:35,spamboi1244,False
116,Get your own damn bread! - Jesus,278,0.96,tgeeik,okboomer,https://i.imgur.com/XQg2qtK.jpg,15,2022-03-17 22:11:04,00010101,False
117,"CoronavirusCirclejerk Bans People For ""Bigotry"" For Posting This Image",211,0.97,tdjmme,okboomer,https://www.meme-arsenal.com/memes/fd54289adbfd7fcdb9f5dff6bf98bd11.jpg,18,2022-03-14 05:03:12,IVIaskerade,False
118,"Don't bring the Beatles into this ""Wi-Fi Bad"" nonsense",166,0.97,tc4kaq,okboomer,https://i.redd.it/fvybiqpqnum81.jpg,28,2022-03-12 06:16:00,ripjaw6442,False
119,"Boomers in 1982 ""This house is perfect. It has everything we need and even a playroom for little Jimmy."" Boomers 40 years later:",183,0.97,taz77v,okboomer,https://i.redd.it/g190kdquakm81.jpg,7,2022-03-10 19:25:57,Retrocomparisons,False
120,Truck-ranting millennial bashers have entered the chat,251,0.98,tamrqe,okboomer,https://i.redd.it/nnsk365iigm81.jpg,9,2022-03-10 06:41:44,UncleDogMan,False
121,pHoNeS,50,0.93,tapg6a,okboomer,https://i.redd.it/6rh1z3ne7hm81.jpg,11,2022-03-10 09:01:17,Sh0ck3dd,False
122,Maybe it’s because they’re disgusting…,306,0.98,ta5xc9,okboomer,https://i.redd.it/pctjhi34hcm81.jpg,51,2022-03-09 17:06:51,doctor_what_door,False
123,"Kids, Boomers are here!",219,0.84,t9i91a,okboomer,https://i.redd.it/giojgel396m81.jpg,49,2022-03-08 20:11:12,sneakygreedo,False
124,Millennials: literally can't afford a house. Boomers: pay court costs because their house is next to a neighbour with a mannequin and they can't be bothered to get privacy glass or draw the curtains,288,0.98,t74h17,okboomer,https://i.redd.it/g9kr51e5sil81.jpg,7,2022-03-05 13:15:12,OKIAMONREDDIT,False
125,Boomer starter pack,380,0.98,t3wu74,okboomer,https://i.redd.it/qbv3603knok81.jpg,12,2022-03-01 07:56:01,not_gerg,False
126,"Oh man, how accurate is this.",376,0.99,t339jm,okboomer,https://i.redd.it/3yglj3jp7hk81.jpg,22,2022-02-28 06:54:59,AfterThisbutNotThat,False
127,God I hate distant family,192,0.99,t1qp74,okboomer,https://i.redd.it/wfiandkyk4k81.jpg,29,2022-02-26 12:25:52,BlueCamaroGuyYT,False
128,boomer fucked the world one last time.,187,0.98,t09o8x,okboomer,https://i.redd.it/kzo1dwcuwrj81.jpg,13,2022-02-24 17:49:20,walkerszo,False
129,I disagree,321,0.98,swk76v,okboomer,https://i.redd.it/byo3f4vlwui81.jpg,46,2022-02-20 02:49:10,Delicious_juice,False
130,ok Boomer,241,0.99,sv07dg,okboomer,https://i.redd.it/4nvn2fz2rgi81.jpg,11,2022-02-18 03:13:18,PadraicThePrince,False
131,Humanity Bad,123,0.96,stl9gd,okboomer,https://i.redd.it/diq7lqtk24i81.jpg,9,2022-02-16 08:34:40,agerm393,False
132,Hurr durr tHiNgS wEre sO MucH bEtTer iN tHE PaSt,168,0.99,st3iw6,okboomer,https://i.redd.it/8avr5jll50i81.png,33,2022-02-15 19:27:31,FUCK_INDUSTRIAL,False
133,My Aunt LOVES These Types Of Posts,280,1.0,srm3kw,okboomer,https://i.redd.it/m5banpw7kmh81.jpg,54,2022-02-13 21:41:20,Suckmyass1134,False
134,Wife bad,166,0.98,sp4eyd,okboomer,https://i.redd.it/sgynm4lbdyg81.jpg,16,2022-02-10 16:53:28,ShadowMewtwoLover69,False
135,Haha millennial stoopid,245,0.99,so7lh7,okboomer,https://i.redd.it/fwpfu572erg81.jpg,32,2022-02-09 12:51:39,respiro_da_beast,False
136,Why does old lady Melanie think we care if tattoos make her sick?,239,1.0,snplj8,okboomer,https://i.redd.it/5ym8elfhglg81.png,19,2022-02-08 22:55:03,RevolutionaryTalk315,False
137,When I was a kid there were no phones or tablets. We read cereal boxes at breakfast.,30,1.0,snogth,okboomer,https://i.redd.it/g4a836va0ng81.jpg,11,2022-02-08 22:07:21,,False
138,"Out of titles, same ol, same ol",134,0.99,sla7j6,okboomer,https://i.redd.it/bv8g3b8no0g81.png,15,2022-02-05 21:29:54,FurryIrishFury,False
139,Millennial birthday card...,167,0.99,sl2bz7,okboomer,https://i.redd.it/dk3ybr7b0wf81.jpg,8,2022-02-05 14:10:15,greatdane114,False
140,The boomer political divide,141,0.99,skfbc4,okboomer,https://i.redd.it/7dkbncx0ztf81.png,11,2022-02-04 20:30:45,mim21,False
141,"Snow storm today in Canada and the boomer page on FB is going crazy about the shoveling prices people are charging, Low pixels is by the poster on FB not me",79,0.98,sk3m3o,okboomer,https://i.redd.it/ug19eyo02pf81.png,10,2022-02-04 09:30:31,mt857,False
142,"It snowed 7 inches in Indiana, so I made this meme",213,0.98,sjnmtn,okboomer,https://i.redd.it/b4qfswulbnf81.jpg,14,2022-02-03 22:06:35,Toku-Nation,False
143,This is it. This is officially the most boomer Facebook post I’ve ever seen.,206,0.97,sizpjj,okboomer,https://i.redd.it/w5pcwztihhf81.jpg,32,2022-02-03 02:29:03,otenshalm,False
144,“I bet you use the same phone to call a plumber that you use to text your kids that you love them!”,509,0.98,siamjc,okboomer,https://i.redd.it/ii9g68ahgbf81.jpg,28,2022-02-02 06:12:31,TogarSucks,False
145,The message was good… until they said “google”,227,0.99,sgg5tk,okboomer,https://i.redd.it/n69jgor2ive81.jpg,35,2022-01-31 00:32:57,mdhussa1n,False
146,I hate my l(w)ife,271,0.99,sg4dsx,okboomer,https://i.redd.it/v8cq2mib9se81.jpg,12,2022-01-30 13:38:32,KirbyPlanetRobobot,False
147,One joke.,125,0.95,sfaq6q,okboomer,https://i.redd.it/tjy7d53fude81.jpg,19,2022-01-29 10:46:14,Withnails,False
148,"Once again, my parents told me it was rude to stare",368,0.99,sex0k0,okboomer,https://i.redd.it/5kdcgjj6zfe81.jpg,10,2022-01-28 23:47:50,Toku-Nation,False
149,Look see has no phone! She has a life! Unlike these other fetuses that don't understand the meaning of life! 🖐💯🙏🗣,128,0.95,seh7ma,okboomer,https://i.redd.it/y6ec3cqpnce81.jpg,9,2022-01-28 09:10:43,Sk8AndSupernatural,False
150,"We walked to school, uphill both ways in the snow.",279,1.0,sdy8ss,okboomer,https://i.redd.it/a1depvv0e8e81.jpg,22,2022-01-27 18:50:09,FUCK_INDUSTRIAL,False
151,This guy,37,0.94,sec1c9,okboomer,https://i.redd.it/u4e8gooafbe81.jpg,7,2022-01-28 05:01:47,IryanShaan,False
152,Phone not clock!?!,167,0.98,sdmdua,okboomer,https://i.redd.it/yvuqpsf5x4e81.jpg,9,2022-01-27 07:09:21,TogarSucks,False
153,"Coincidentally born in 1961, Boomer Esiason throwing a football at your head",12,1.0,se105k,okboomer,https://i.redd.it/hqpl12kh19e81.jpg,0,2022-01-27 21:00:48,cognitivetriad,False
154,Rule,238,0.99,sco5re,okboomer,https://i.imgur.com/yJ6ACo9.jpg,11,2022-01-26 02:46:08,Local_Surround8686,False
155,"Because millennials don't cook, right?",74,0.99,sc24ir,okboomer,https://i.redd.it/atb7k498rqd81.jpg,17,2022-01-25 07:31:34,FUCK_INDUSTRIAL,False
156,On marriage and compromise,149,0.99,sbxhnu,okboomer,https://i.redd.it/m19h3d30fnd81.png,6,2022-01-25 03:17:27,DoctorTurkelton,False
157,Having authority does not make you intelligent.,187,0.98,s8u6it,okboomer,https://i.redd.it/kbye1s5s0xc81.jpg,2,2022-01-21 03:31:19,meisterdoo,False
158,My parents always told me that it's rude to stare at others,336,0.99,s8jgqt,okboomer,https://i.redd.it/vrgzo22bluc81.jpg,1,2022-01-20 19:21:27,Toku-Nation,False
159,Quote to live by,248,0.99,s7pd5p,okboomer,https://i.redd.it/bypb4lxt3lc81.jpg,14,2022-01-19 18:14:47,ShadowMewtwoLover69,False
160,"You say boomer, I say…",91,0.98,s7w7w5,okboomer,https://i.redd.it/phsexnxbpoc81.jpg,3,2022-01-19 23:33:19,Nice_Meet_6685,False
161,"FUNNY HOW INFLATION IS REAL TO BOOMERS NOW. PICK YA SELVES UP BY YA BOOTSTRAPS, SHOULDA SAVED SOME MONEY LIKE A RESPONSIBLE ADULT",130,0.99,s78l7n,okboomer,https://i.redd.it/4sal7isgmic81.jpg,12,2022-01-19 03:06:14,ItIzWatItIz28,False
162,You know it’s sad but true,404,0.98,s3b6yn,okboomer,https://i.redd.it/j4s9t6pg4jb81.jpg,27,2022-01-14 03:42:53,Equal-Bus-557,False
163,Ugh.,115,0.99,s2l49e,okboomer,https://i.imgur.com/0B89fg2.jpg,16,2022-01-13 05:38:24,Padre_G,False
164,Brought to you by Grandma Marlene.,237,0.98,s2a9ov,okboomer,https://i.redd.it/fcehakwo9ab81.jpg,28,2022-01-12 21:56:09,chantzyboy78,False
165,This screams boomer so much its making my ears combust,207,0.97,s1wu88,okboomer,https://i.redd.it/8vdwgsuul6b81.jpg,9,2022-01-12 09:37:12,Sh0ck3dd,False
166,I am selfish.,291,0.93,s129dl,okboomer,https://i.redd.it/bxp8g61l3za81.png,18,2022-01-11 08:22:19,RUFtotheRESCUE,False
167,The Boomer defense,193,0.99,rzv2ix,okboomer,https://i.redd.it/dzcmb93btoa81.jpg,6,2022-01-09 21:46:54,MrGrimmlock,False
