,title,score,upvote-ratio,id,subreddit,url,num_comments,created,author,over18
528,Makes sense to me.,59,0.94,xkowbm,rareinsults,https://i.redd.it/tmw8vc6pnbp91.png,12,2022-09-22 08:03:13,MavisCanim,False
529,Repost with identify details removed - Found a great one with CNN's Don Lemon getting owned discussing reparations - Link in the comments..,75,0.8,xkm0jj,rareinsults,https://i.redd.it/cz6rlj041bp91.jpg,12,2022-09-22 05:56:33,Knight1967,False
530,Crank Review Reviewed,402,0.98,xk54ig,rareinsults,https://i.redd.it/hcqg8kxys7p91.png,5,2022-09-21 19:05:34,Fantastic_Mr-Fox_,False
531,Maybe that’s the pose that pulled his mother?,33,0.95,xkp9fq,rareinsults,https://i.redd.it/dkt9l0voqbp91.jpg,2,2022-09-22 08:19:55,Villan_99,False
532,a true fantasy,54197,0.94,xjfrn4,rareinsults,https://i.redd.it/r2bhcsxbz1p91.jpg,607,2022-09-20 23:30:35,seasonaltoothreport,False
533,Rare but nearly incomprehensible,154,0.92,xk7exn,rareinsults,https://i.redd.it/cm54atcx88p91.jpg,3,2022-09-21 20:35:02,Coconutmallmaniac,False
534,Won't vacuuming your nose suck your brain out?,21,0.97,xknv3t,rareinsults,https://i.redd.it/e4dd2wycfbp91.png,2,2022-09-22 07:18:06,Abi_Slayer234reload,False
535,I don’t even know what this had to do with Big Brother,135,0.88,xk3k7o,rareinsults,https://i.redd.it/w6ykaji3h7p91.jpg,10,2022-09-21 17:59:02,emerppa,False
536,found this gem,751,0.99,xjsndr,rareinsults,https://i.redd.it/z5abtnsal4p91.jpg,7,2022-09-21 08:17:14,The_JokerGirl42,False
537,Gordon Ramsay concurs,31625,0.92,xj6tqs,rareinsults,https://i.redd.it/gw4fhjr260p91.jpg,1103,2022-09-20 17:28:09,Sinister_glitter,False
538,new shrek leaked?,266,0.98,xjxkij,rareinsults,https://i.redd.it/qqn56945u5p91.jpg,7,2022-09-21 12:28:35,noolavo,False
539,Facebook is torching Adam Levine,921,0.98,xjhtm2,rareinsults,https://i.redd.it/th1aqltbd2p91.jpg,59,2022-09-21 00:49:00,ChiefWarBear,True
540,But it’s so perfect with just that right amount of sheen.,147,0.99,xjrknr,rareinsults,https://i.redd.it/exr2zm0pc4p91.jpg,2,2022-09-21 07:29:00,ChaoticFluffiness,False
541,This one in r/hmmm,53,0.95,xjwl1t,rareinsults,https://i.redd.it/361npr49k5p91.jpg,6,2022-09-21 11:33:11,CH33KC14PP3R96,False
542,It seems like she thinks the same,127,0.99,xjojdv,rareinsults,https://i.redd.it/dd2qokjwo3p91.jpg,5,2022-09-21 05:15:39,maya2133,False
543,"a man so trash, not even a cannibal can stomach him",232,0.99,xjhxxw,rareinsults,https://i.redd.it/2daxtiq4e2p91.jpg,5,2022-09-21 00:53:31,tittieholder,False
544,"""Wastebasket taxon"" – probably not malicious, but absolutely genocidal in scope",27,0.87,xjxnhc,rareinsults,https://i.redd.it/cj8gzl0qu5p91.jpg,2,2022-09-21 12:32:58,dbulger,False
545,Just imagining this NASA employed fish,166,0.98,xjk3gw,rareinsults,https://i.redd.it/ysf4ciqzs2p91.jpg,1,2022-09-21 02:17:00,Nallaerts,False
546,Watching pedo stings on fb and found this comment I thought you'd appreciate,32,0.97,xjv5hi,rareinsults,https://i.redd.it/9ipm560o65p91.jpg,5,2022-09-21 10:17:00,bobbybuddha,False
547,Someone’s been destroyed by blasters,70,0.9,xjomyd,rareinsults,https://i.redd.it/4xvswwsop3p91.jpg,11,2022-09-21 05:20:06,seankao31,False
548,Reupload because I forgot to censor username,58,0.95,xjnzpo,rareinsults,https://i.redd.it/dyfgd7sok3p91.jpg,2,2022-09-21 04:52:02,BananaNutLoafBread,False
549,imagine been call a unseasoned chicken wing,19115,0.93,xio55n,rareinsults,https://i.redd.it/su4n06y75xo91.jpg,197,2022-09-20 02:14:38,i_need_serious_help-,False
550,Unnecessary but accurate,2319,0.99,xirdqm,rareinsults,https://i.redd.it/crod9jc1awo91.jpg,28,2022-09-20 04:19:56,hmmthatguy17,False
551,This is just <chef's kiss>,32,0.86,xjfn2c,rareinsults,https://i.redd.it/g53ppthdy1p91.jpg,1,2022-09-20 23:25:56,brother_p,False
552,His gf is into old guys ig!,325,0.99,xiti48,rareinsults,https://i.redd.it/mrk3drhg7yo91.jpg,6,2022-09-20 05:49:00,amungus45,False
553,lol I kinda get it,951,0.99,xigw0y,rareinsults,https://i.redd.it/hvgf0udctvo91.jpg,7,2022-09-19 21:46:18,MrAnimeWeirdo,False
554,"Context - someone posted cringe on a video about Buckethead, a guitarist who famously wears a mask on stage. I discovered they don't know the meaning of the word ""irony"" and I don't believe I was too harsh.",146,0.91,xivii0,rareinsults,https://i.redd.it/aa7hp7zb5xo91.jpg,11,2022-09-20 07:16:08,SeventhSunGuitar,False
555,Pillsbury Doughboy rofl. The roasts in army are always gold,60,0.93,xiz9h0,rareinsults,https://i.redd.it/fhs6qb921yo91.jpg,2,2022-09-20 10:13:09,Pharah_is_my_waIfu,False
556,It was 6:30 am,129,0.95,xis71i,rareinsults,https://i.redd.it/w1jj5iy1gwo91.jpg,2,2022-09-20 04:53:35,stars_without_number,False
557,Looks more like marker than a tattoo. (足 = leg/foot btw),375,1.0,xigkxx,rareinsults,https://i.redd.it/kcseykdu9uo91.jpg,13,2022-09-19 21:35:26,Awesome_fire,False
558,Found on a video about British kids trying American foods,1713,0.99,xi5eam,rareinsults,https://i.redd.it/5zabt7x5tro91.jpg,31,2022-09-19 13:18:40,Sirfryingpan123,False
559,the collective IQ of Twitter is that of a dumb ostrich,208,0.97,xikia0,rareinsults,https://i.redd.it/k1liw9bnzuo91.jpg,3,2022-09-19 23:59:56,Human_Capital_2518,False
560,The more you look at it the better it gets,21689,0.97,xhrkwk,rareinsults,https://i.redd.it/dz1is32j0qo91.jpg,209,2022-09-19 02:15:53,cycloneariel,False
561,I really like this one (about a team killer in Tarkov),68,0.97,xinyqs,rareinsults,https://i.redd.it/1xquq0ygmvo91.png,1,2022-09-20 02:07:56,Sgt_Redwood,False
562,*insert that one fat tom cruise laughing picture here*,94,0.97,xikf2a,rareinsults,https://i.redd.it/iior3qyjgwo91.jpg,1,2022-09-19 23:56:25,Charon581,False
563,A very specific kind of energy,213,0.99,xibvxm,rareinsults,https://i.redd.it/hn6yc9kjgto91.jpg,3,2022-09-19 18:51:01,uwubaite,False
564,Better call jigsaw.,49,0.93,xiomcn,rareinsults,https://i.redd.it/d4eggtatqvo91.png,4,2022-09-20 02:32:15,lil_deezer101,False
565,I don’t speak ketamine 😂,26487,0.94,xhkzhh,rareinsults,https://i.redd.it/oel148ww7no91.jpg,402,2022-09-18 21:51:57,Ravekat1,False
566,Pitchfork Always Finding Creative Ways to Say Someone’s Music Sucks,18,0.87,xisc2x,rareinsults,https://i.redd.it/ur7nq375hwo91.jpg,3,2022-09-20 04:59:41,oncogenie,False
567,Started a bit of a feud in my town subreddit and this majestic insult was thrown.,26,0.76,xil3xd,rareinsults,https://i.redd.it/7eqjtfum3vo91.jpg,17,2022-09-20 00:22:13,PoweredByVeggies,False
568,double down on the insults,3041,1.0,xhm8wd,rareinsults,https://i.redd.it/zg3f1mbayoo91.jpg,6,2022-09-18 22:41:37,meg4_,False
569,Marty is a savage,29,0.98,xie5dc,rareinsults,https://i.redd.it/i6dsgec4wto91.png,2,2022-09-19 20:18:46,Nuphovem,False
570,The ginger wasn't in contest to the statement but had plenty time to a drag b*tch,126,0.88,xi3d8c,rareinsults,https://i.redd.it/ibfw2prxpso91.jpg,12,2022-09-19 11:21:53,obsidianbreath,False
571,A new way to deal with your frustrations,51,0.85,xi71fz,rareinsults,https://i.redd.it/4a2z401naso91.png,6,2022-09-19 14:56:48,i_am_a_happy_man,False
572,Bro living in a video game,88,0.95,xi0hqq,rareinsults,https://i.redd.it/b7k911s8zro91.jpg,2,2022-09-19 08:52:15,Bandito21Dema,False
573,It almost looks like a finished Ubisoft game,348,0.99,xhpsro,rareinsults,https://i.redd.it/3t9a8u2knpo91.jpg,5,2022-09-19 01:03:10,SC1Sam,False
574,More kinks than Jeffrey,305,0.99,xhqh6l,rareinsults,https://i.redd.it/ih96na3yaoo91.jpg,8,2022-09-19 01:30:42,keenjataimu,False
575,Response to a Tinder profile where the first photo is the guy wearing a Speedo,28,0.9,xi5bp2,rareinsults,https://i.redd.it/lo45213z9to91.jpg,1,2022-09-19 13:14:11,megaloduh,False
576,those pointy Italian shoes,29475,0.96,xh0vpj,rareinsults,https://i.redd.it/ljsgzlho6io91.jpg,152,2022-09-18 04:56:06,XPurplelemonsX,False
577,I see your point and raise you: plot armor,156,0.99,xhshx9,rareinsults,https://i.redd.it/i51mlxtkpoo91.jpg,5,2022-09-19 02:52:43,AR-Tempest,False
578,728 Ton Ball at The Top of a Skyscraper,103,0.98,xhuidr,rareinsults,https://i.redd.it/1pgjrj1k4po91.jpg,1,2022-09-19 04:16:43,Apothic_Black,False
579,Where the crawdads cry (after reading this film review),78,0.96,xhvasm,rareinsults,https://i.redd.it/vnjb7n37sqo91.jpg,5,2022-09-19 04:50:58,notilucent,False
580,i struggle with simple tasks,74,0.93,xhvawe,rareinsults,https://i.redd.it/v3kme6wgapo91.jpg,6,2022-09-19 04:51:06,kxizukoi,False
581,I laughed so hard at this one,164,0.98,xhn1y1,rareinsults,https://i.redd.it/x71qshvgmno91.jpg,8,2022-09-18 23:13:39,UrMomAintGay,False
582,"""Nerd nugget"". [Sauce: Legendary Starfy for DS]",12,0.66,xi3ypb,rareinsults,https://i.imgur.com/bkBJyK9.jpg,2,2022-09-19 11:55:28,Icy_Guidance,False
583,There was an attempt at food,5889,0.99,xgx43p,rareinsults,https://i.redd.it/qcjkphgkdho91.jpg,55,2022-09-18 02:12:56,gacoug,False
584,On a post about She Hulk,112,0.89,xhjl7z,rareinsults,https://i.redd.it/ml79ikl1ymo91.jpg,6,2022-09-18 20:56:40,,False
585,"2 medals, no A*",26,0.91,xhv0wt,rareinsults,https://i.redd.it/xsyqh74j8po91.jpg,3,2022-09-19 04:38:58,ThatSpecialKeynote,False
586,An Amazon review for a monitor stand.,2096,1.0,xgw5z7,rareinsults,https://i.redd.it/u94zsksj6ho91.jpg,5,2022-09-18 01:33:35,-Speechless,False
587,Face hair salad is dope.,228,0.97,xh9cc2,rareinsults,https://i.redd.it/wjioulk4cko91.png,2,2022-09-18 12:10:53,somethingsoddhere,False
588,The human incarnation of a TapOut T shirt,25,0.91,xhkska,rareinsults,https://i.redd.it/3zrl5c3l6no91.jpg,1,2022-09-18 21:44:32,Delux_Takeover,False
589,I laughed a little too hard at this one lol,1391,0.99,xgtn3y,rareinsults,https://i.redd.it/aabr1l8nngo91.jpg,26,2022-09-17 23:47:38,BassBoostedBruh,False
590,"""he's right behind me isnt he?"" ahh mf",178,0.95,xh7bv3,rareinsults,https://i.redd.it/v1qugh6wrjo91.jpg,2,2022-09-18 10:16:47,spaghettifrom,False
591,He's everyone in the Heffley family,83,0.95,xh9zjs,rareinsults,https://i.redd.it/f7zh2yyviko91.png,1,2022-09-18 12:48:51,knotme69420,False
592,*Roblox oof sound*,11,0.7,xhi2j4,rareinsults,https://i.redd.it/y8zgs4danmo91.png,1,2022-09-18 19:56:20,GoodGuyBuddyBoy,False
593,Keep your eye on the ball,189,0.9,xgz94b,rareinsults,https://i.imgur.com/5LdYfLY.jpg,13,2022-09-18 03:43:34,kevonicus,False
594,On a post about a nerf to a game,49,0.9,xh5no5,rareinsults,https://i.redd.it/mvy9yan7cjo91.jpg,3,2022-09-18 08:48:59,Pale-Camera5376,False
595,Rare and Unhinged,25,0.86,xh8azo,rareinsults,https://i.redd.it/rejyx96c1ko91.png,1,2022-09-18 11:11:24,Its_Metaphorical,False
596,found this violation on YouTube,181,0.99,xgu1b8,rareinsults,https://i.redd.it/f6bov1gjqgo91.png,5,2022-09-18 00:03:52,kimi____7,False
597,Nobody burns like a sibling’,10835,0.97,xg3ke3,rareinsults,https://i.redd.it/hvjx7ze2hao91.jpg,40,2022-09-17 03:00:04,eilonwe,False
598,Who doesn’t love a bit of cultural insensitivity?,331,0.97,xgltq9,rareinsults,https://i.redd.it/mzzjkj7j2fo91.jpg,6,2022-09-17 18:27:31,LordLaffyTaffy,False
599,She got wrecked,190,0.98,xgpvfm,rareinsults,https://i.redd.it/cmmolodhwfo91.jpg,4,2022-09-17 21:15:27,mod_xd,False
600,Not my Ariel,69437,0.7,xfzq74,rareinsults,https://i.redd.it/bdkf6r5hp9o91.jpg,275,2022-09-17 00:25:29,filreal7,False
601,Y’all got any more of that 99% isopropyl?,56951,0.85,x4uex3,rareinsults,https://i.imgur.com/r2FMy5C.jpg,1321,2022-09-03 18:56:15,OMGLMAOWTF_com,False
602,hot dog water,68021,0.95,wyq2uc,rareinsults,https://i.redd.it/5tia4yk7t5k91.jpg,563,2022-08-27 07:02:42,SpicyHashbrowns,False
