,title,score,upvote-ratio,id,subreddit,url,num_comments,created,author,over18
174,brilliant take down of an innocent Redditor,5701,0.97,xxy5vj,rareinsults,https://i.redd.it/ru8sdg18qds91.jpg,56,2022-10-07 18:13:17,Gizoogler314,True
175,Inside out Timberland,13,0.82,xz0vls,rareinsults,https://i.redd.it/s202r3t4sms91.png,1,2022-10-09 00:40:13,elyca98,False
176,Rare but unforgettable. Have never seen anything with Spidey in it without thinking about this.,116,0.94,xyl8ba,rareinsults,https://i.redd.it/82f1twnvxis91.jpg,11,2022-10-08 11:45:05,ewwwitsamanda,False
177,he misses everything by a few inches,132,0.96,xyjdxg,rareinsults,https://i.redd.it/j15gvvz0fis91.png,2,2022-10-08 10:00:20,Frostwolf74,False
178,This man is speaking absolute Facts,26,0.96,xyroj6,rareinsults,https://i.redd.it/q1065m2itks91.jpg,2,2022-10-08 18:04:07,Scarface2010,False
179,Thanos could not have snapped this guy out of existence any harder,89,0.96,xyibja,rareinsults,https://i.redd.it/vyr439m45is91.jpg,5,2022-10-08 09:03:56,stopXstoreytime,False
180,"this is so rare its shiny. also, ouch bro",34618,0.96,xxmdza,rareinsults,https://i.redd.it/80e4v1fwgas91.jpg,268,2022-10-07 07:15:40,darktowerseeker,False
181,"Haha, not seen this insult before",148,0.96,xychrn,rareinsults,https://i.imgur.com/TpI8RQp.jpg,13,2022-10-08 04:13:51,I_Formulate_Infinity,False
182,Perfect science-based insult,428,0.98,xy3qhh,rareinsults,https://i.redd.it/dlh0bfbsves91.jpg,6,2022-10-07 22:06:15,Hyper-B,False
183,What a ladies man,298,0.98,xy5ipk,rareinsults,https://i.redd.it/92fghq3s8fs91.jpg,18,2022-10-07 23:19:12,noodlemcfoodle,False
184,Mike M is not wrong,27,0.97,xyknlg,rareinsults,https://i.redd.it/dm4a25ltris91.jpg,1,2022-10-08 11:11:08,SFgirll,False
185,Damn he is already dead bro,41,0.88,xyhhfx,rareinsults,https://i.redd.it/eaco5gwcxhs91.jpg,2,2022-10-08 08:20:23,Puzzleheaded_Addd,False
186,not that there’s anything wrong with girl shoes,41,0.89,xycgdu,rareinsults,https://i.redd.it/nnddba12pgs91.jpg,4,2022-10-08 04:12:06,randomturtle333,False
187,His grammar died,31,0.89,xydu8v,rareinsults,https://i.redd.it/gnlclp4g0hs91.jpg,1,2022-10-08 05:15:58,Beanconsumer200,False
188,Dude is in a international orgy,26929,0.96,xx8iu1,rareinsults,https://i.redd.it/i4irv7f8i7s91.jpg,107,2022-10-06 21:17:49,mod_xd,False
189,Dude be chillin with Frankie and Bloo,387,0.98,xxsnkr,rareinsults,https://imgur.com/uyz4eki.jpg,11,2022-10-07 12:56:13,KarmaCasino,False
190,“you make michael reeves look well-adjusted”,9,0.66,xyi10o,rareinsults,https://i.redd.it/w9l3jpvd2is91.jpg,2,2022-10-08 08:48:35,tangerinebaskets,False
191,Review for Starlit Kart Racing. The game is free as well...,63,0.98,xy1n72,rareinsults,https://i.redd.it/psgorv4lges91.png,2,2022-10-07 20:41:02,AlmightyWings232,False
192,2 insults in 1 thread!,33,0.88,xy58kt,rareinsults,https://i.redd.it/36t1bqhr6fs91.jpg,1,2022-10-07 23:07:47,nvrgonnagiveuponyou,False
193,Somehow she even worked Hitler into her long winded insult,20,0.8,xy8ewj,rareinsults,https://i.redd.it/p2rg6q76ufs91.jpg,6,2022-10-08 01:18:59,x2o6,False
194,best one I've seen so far,193,0.97,xxnv7b,rareinsults,https://i.redd.it/gmks5512uas91.jpg,3,2022-10-07 08:29:25,BO-LYNCHED,False
195,This is not rare I just wanted to put this on Reddit,2,0.54,xyehmc,rareinsults,https://i.redd.it/whm9xb906hs91.jpg,5,2022-10-08 05:47:05,ShanJJam,False
196,When GF tried to explain to OP why she cheated.,437,0.97,xxga75,rareinsults,https://i.redd.it/7budyb4r29s91.jpg,5,2022-10-07 02:34:35,Kitkatdog13,False
197,Where my depressive Taurus gang at 😥,296,0.98,xxigbi,rareinsults,https://i.redd.it/c7c9z7l9j9s91.jpg,4,2022-10-07 04:07:09,FlumeLife,False
198,dude looks like he played the rat in a high school play,148,0.98,xxm7tc,rareinsults,https://i.redd.it/0uc669wdfas91.jpg,6,2022-10-07 07:07:11,farsenic,False
199,Not even boundless beings can pull that off,155,0.97,xxlrpp,rareinsults,https://i.redd.it/z34pio9dbas91.jpg,3,2022-10-07 06:45:15,ExtraMOIST_,False
200,School discord is back 💀,62,0.95,xxoq3b,rareinsults,https://i.redd.it/4i2yw56t1bs91.png,2,2022-10-07 09:13:10,med_designs,False
201,The Balkans always had funny insults,150,0.94,xxijgk,rareinsults,https://i.redd.it/2aacmmwgj9s91.png,15,2022-10-07 04:11:09,Bobipicolina,False
202,Get a job,68,0.85,xxmayv,rareinsults,https://i.redd.it/5mo7nbi5gas91.jpg,3,2022-10-07 07:11:29,supercrazestar,False
203,The earth is definitely not flat,77,0.97,xxje5t,rareinsults,https://i.redd.it/2rt2zprwq9s91.jpg,3,2022-10-07 04:50:00,DreadedPopsicle,False
204,"Broncos Country, Let's Cry",30,0.94,xxpwzb,rareinsults,https://i.redd.it/zo1ppsfbdbs91.jpg,1,2022-10-07 10:17:22,Smiling_longhair6870,False
205,On r/nice guys about bf’s friend who wanted to sleep with the poster of the thing,102,0.95,xxgdme,rareinsults,https://i.redd.it/57oy4taf39s91.jpg,19,2022-10-07 02:38:22,Imincrediblyboring1,False
206,Bubbles from Trailer Park Boys as Darth Vader.,38,0.98,xxna8u,rareinsults,https://i.redd.it/clyucw9soas91.jpg,5,2022-10-07 08:00:01,Parabellim,False
207,Life isn’t easy,206,0.97,xxa18y,rareinsults,https://i.redd.it/t3u18ek8t7s91.jpg,2,2022-10-06 22:19:28,s-reaper,False
208,a real dodo bird,17,0.84,xxpj3k,rareinsults,https://i.redd.it/nqzr4wrh9bs91.jpg,1,2022-10-07 09:55:56,yeet_yeet_boi123,False
209,About a guy who argued with me that homemade broth and brown rice is fast food,112,0.98,xx8znm,rareinsults,https://i.redd.it/tcwdf5xll7s91.jpg,3,2022-10-06 21:36:43,notitymp,False
210,About a woman who had cheated on her boyfriend.,57,0.96,xxd90m,rareinsults,https://i.redd.it/fua8u7uog8s91.jpg,1,2022-10-07 00:30:56,JamesEAnderson1,False
211,Your parents skipped the loading screen,193,0.98,xx3m2l,rareinsults,https://i.redd.it/la8mhgvve6s91.jpg,5,2022-10-06 17:37:15,Ginger-Ale58,False
212,You Anthropomorphic Font,24,0.8,xxgu3p,rareinsults,https://i.redd.it/ei2ny5fr69s91.jpg,4,2022-10-07 02:57:03,MisterKayfabe,False
213,"Weirdly accurate, right?",177,0.98,xx1039,rareinsults,https://i.redd.it/n69roeden5s91.jpg,10,2022-10-06 15:03:11,Quzga,False
214,Courtesy of r/BostonBruins,19,0.91,xxi990,rareinsults,https://i.redd.it/l2omz6hph9s91.jpg,1,2022-10-07 03:58:27,Mattx603,True
215,Destroyed by basic maths.,336,0.98,xwxicp,rareinsults,https://i.redd.it/zz75rsd5j4s91.jpg,1,2022-10-06 11:17:36,Cambi-,False
216,Got ‘em with the Mc Fibs. Balls in Your court.,99,0.98,xx2yrs,rareinsults,https://i.redd.it/woj6bdhl86s91.jpg,5,2022-10-06 17:02:01,AcanthisittaGlum138,False
217,About a person trying to swim in Chernobyl water,1148,0.99,xwnfb1,rareinsults,https://i.redd.it/qz8piosp52s91.jpg,3,2022-10-06 03:18:44,YaBoiGazza_,False
218,I didn't even know that was even possible,97,0.96,xx0u8e,rareinsults,https://i.redd.it/2dx3bywq65s91.png,3,2022-10-06 14:52:16,Fuklyn,False
219,classic Emily behavior,37,0.9,xx6a95,rareinsults,https://i.redd.it/5mbkgj4a17s91.jpg,1,2022-10-06 19:42:51,Dumbasscomrade,True
220,The only time I have or ever will laugh at social darwinism,38,0.91,xx5y36,rareinsults,https://i.redd.it/u2ygemwny6s91.jpg,4,2022-10-06 19:28:06,Jephobi,False
221,Rare insult of the day,39,0.95,xx652z,rareinsults,https://i.redd.it/tvo6p8j307s91.jpg,4,2022-10-06 19:36:19,cyc10n3,False
222,"I was browsing YouTube for the English dub of a web series called “Metal Family.” This was in the comments on episode three from season two. I have never been more thrilled to see an insult to a character - in this case, a bad father.",37,1.0,xx4azs,rareinsults,https://i.redd.it/vfa0h5l3l6s91.jpg,1,2022-10-06 18:12:04,Arrow_F_Doxon,False
223,Teaser so bad that people are demanding to ban the movie,63,0.95,xx0gow,rareinsults,https://i.redd.it/fynjzgv1h5s91.jpg,3,2022-10-06 14:27:38,jackkkass,False
224,thought this was a gem,102,0.99,xwxlrz,rareinsults,https://i.redd.it/fcpg8gn6k4s91.jpg,1,2022-10-06 11:23:24,redrumrea,False
225,My mate works in a college and sent this gem today,27,0.89,xx3nqs,rareinsults,https://i.redd.it/swsii803f6s91.png,5,2022-10-06 17:39:41,AlmightyAnalAssault,False
226,He’s not wrong,27811,0.97,xvytts,rareinsults,https://i.redd.it/5a7i2twokwr91.jpg,159,2022-10-05 08:31:58,DoctrDonna,False
227,A Polished Indian,101,0.97,xwuj74,rareinsults,https://i.redd.it/vlmuankwq3s91.jpg,16,2022-10-06 08:39:17,lionplayz,False
228,found on a review of gabbie hanna's album,29,0.97,xx0yvo,rareinsults,https://i.redd.it/eus3dfkqm5s91.png,1,2022-10-06 15:01:00,das_a_dawg,False
229,After Tottenham lost the derby,173,0.98,xwl2da,rareinsults,https://i.redd.it/tea3is76p1s91.jpg,2,2022-10-06 01:46:00,wartoof14,False
230,He does WHAT?!,134,0.98,xwl8bx,rareinsults,https://i.redd.it/17q75j6bq1s91.jpg,8,2022-10-06 01:52:26,AVeryConfusedMice,False
231,This person must be a gamer,190,0.98,xweb0f,rareinsults,https://i.redd.it/pj6gz1ade0s91.png,5,2022-10-05 21:24:12,_dfrts,False
232,Didn’t know you could destroy someone with a bot command,90579,0.91,xvl1od,rareinsults,https://i.redd.it/8e7nudroptr91.jpg,1034,2022-10-04 22:54:39,Nearby-Simple-7594,False
233,the sheets are crusty,33,0.82,xwqs7t,rareinsults,https://i.redd.it/p3yy0cj4v2s91.png,4,2022-10-06 05:41:43,ViviPlaysX,False
234,Character Select Screen IRL,49,0.92,xwkogn,rareinsults,https://i.redd.it/dxnjbxbim1s91.jpg,1,2022-10-06 01:31:04,OPsUnbornChild,False
235,"My new second favorite game genre, just behind roguelikes",27,0.97,xwouee,rareinsults,https://i.redd.it/0zwy0ef1g2s91.png,1,2022-10-06 04:16:52,TheNerdyChewy,False
236,"Sharpie, is that? 🗿",237,0.99,xw672f,rareinsults,https://i.redd.it/3c8zcb7alyr91.jpg,5,2022-10-05 15:18:51,Drop-Kickz,False
237,This insult has reached a new level,39,0.8,xwgfi0,rareinsults,https://i.redd.it/ihrb2yuvs0s91.jpg,1,2022-10-05 22:45:02,sailorsparkles,False
238,On a bo burham song,87,0.97,xw9075,rareinsults,https://i.redd.it/dkjmk6h2bzr91.jpg,5,2022-10-05 17:43:23,scrapcafe,False
239,it's right there.,1988,0.99,xvnvsf,rareinsults,https://i.redd.it/cwi64trd9ur91.png,76,2022-10-05 00:45:01,celestiallion12,True
240,Suspiciously specific rare insult,5674,0.99,xvg7ee,rareinsults,https://i.redd.it/fcnzf5umrsr91.jpg,20,2022-10-04 19:43:49,docksa,False
241,Yo Magneto so fat he creates his own gravitational pull,65,0.99,xw91au,rareinsults,https://i.imgur.com/K4uywiI.png,2,2022-10-05 17:44:46,MrAatishB,False
242,Throwing some Halloween candy shade,5,0.7,xwrg8x,rareinsults,https://i.redd.it/cadbvv6s03s91.png,1,2022-10-06 06:12:52,xrayhearing,False
243,Randy coming with the smokes,161,0.91,xvzvix,rareinsults,https://i.imgur.com/YZXQPIz.png,12,2022-10-05 09:23:19,jadedfigured,False
244,From a video about cyberpunk edgerunners,14,0.8,xwe79n,rareinsults,https://i.redd.it/aict8i9pd0s91.png,2,2022-10-05 21:20:08,Nakensteak,False
245,it's too 'big' for my innocent brain.,34,0.91,xw5xew,rareinsults,https://i.redd.it/sjei1oddiyr91.jpg,1,2022-10-05 15:02:36,NisERG_Patel,True
246,Regarding Hans Niemann's chess contraversy,8,0.84,xwfk6u,rareinsults,https://i.redd.it/soebwk6zm0s91.jpg,2,2022-10-05 22:11:56,win_awards,True
247,When you measure nasal passages in light-years.,119,0.99,xvwgb6,rareinsults,https://i.redd.it/qt78vpie1wr91.png,3,2022-10-05 06:43:55,KelbosaDownAHallway,False
248,Idk what to out as the title,59,0.84,xvy77c,rareinsults,https://i.redd.it/8gkinhthfwr91.jpg,4,2022-10-05 08:02:50,prestotren,False
249,"Apparently my insult is rare, the tag lead me to this subreddit. I join and thought I’d share with you all.",52,0.87,xvxv3k,rareinsults,https://i.redd.it/fi9v1hoscwr91.jpg,2,2022-10-05 07:47:44,BiPolarBenzo,False
250,imagine getting owned so hard parliament decides nobody can ever use that insult again,40408,0.98,xuqan6,rareinsults,https://i.redd.it/eh1phvq1pmr91.jpg,400,2022-10-03 23:18:34,wolfbutterfly42,False
251,A cinephile thinking about a film’s user ratings logically.,109,0.94,xvn4je,rareinsults,https://i.redd.it/p39ha2w44ur91.jpg,8,2022-10-05 00:15:41,VinTheHater,False
252,Gordom Ramsay wold be proud,37,0.83,xvupog,rareinsults,https://i.redd.it/w0cvsfphnvr91.jpg,1,2022-10-05 05:25:57,Psychological_Fuel57,False
253,i’ve seen a lot of dream insults in discord over the past day and this one was the most imaginative,16,0.69,xw03r6,rareinsults,https://i.redd.it/nczcuv1svwr91.jpg,6,2022-10-05 09:34:07,Lez_The_DemonicAngel,False
254,Slav Squat in Peace,13663,0.95,xulap1,rareinsults,https://i.imgur.com/YEuVeBu.jpg,91,2022-10-03 20:10:29,tenhou,False
255,well that's new,34,0.92,xvhsa6,rareinsults,https://i.redd.it/t9dfwec03tr91.jpg,2,2022-10-04 20:47:31,TheOddPogger29,False
256,TIL what my voice tastes like...,16,0.91,xvhx3r,rareinsults,https://i.redd.it/eokknbid3tr91.png,1,2022-10-04 20:52:49,talesoflumin,False
257,on Fandom acquiring gamefaqs,335,0.99,xuxvf1,rareinsults,https://i.redd.it/8n1li6pu5or91.jpg,9,2022-10-04 04:14:34,malay_turk,False
258,I don’t know,167,0.99,xv2mma,rareinsults,https://i.redd.it/q0ahzjhv7pr91.jpg,4,2022-10-04 07:47:39,FullHonor9482,False
259,You sweet summer child…,1259,0.99,xuj5po,rareinsults,https://i.redd.it/iv9fghw6clr91.jpg,5,2022-10-03 18:44:44,FireBird89,False
260,Want to see a magic trick?,165,0.96,xuvhfu,rareinsults,https://i.redd.it/9afp1h75onr91.png,2,2022-10-04 02:36:32,tinmart56,False
261,Drake is a funny guy to insult,115,0.9,xuwdw1,rareinsults,https://i.redd.it/vbfywdzqunr91.jpg,8,2022-10-04 03:12:26,spaghettifrom,False
262,I’m genuinely impressed by the creativity…,136,0.97,xutyae,rareinsults,https://i.redd.it/2aspgdesdnr91.jpg,11,2022-10-04 01:37:20,sethfern11,False
263,"Sometimes, cloud cover can’t save you from the burn…",4469,0.99,xu620d,rareinsults,https://i.redd.it/hjd0tuqywhr91.jpg,59,2022-10-03 07:14:08,onbiver9871,False
264,On a video where delivery driver steals a package after delivering it.,69,0.96,xuxsvq,rareinsults,https://i.redd.it/51sxr67b5or91.jpg,2,2022-10-04 04:11:32,VanBeelergberg,False
265,Illegally high levels of soy,74,0.92,xuvu5x,rareinsults,https://i.redd.it/hcftqz4vqnr91.jpg,2,2022-10-04 02:50:36,OurResidentCockney,False
266,Elon isn't exactly the brightest dude,30,0.78,xv0j6k,rareinsults,https://i.redd.it/vfur4vu8qor91.png,3,2022-10-04 06:12:40,CAPSGOD,False
267,They’re not wrong,92,0.9,xusbim,rareinsults,https://i.redd.it/von29wzs2nr91.jpg,10,2022-10-04 00:35:41,Daddy-Shaxx,False
268,He got chernobyled,184,0.96,xukapx,rareinsults,https://i.redd.it/61n6kcbiklr91.jpg,5,2022-10-03 19:31:25,theADDMIN,False
269,waste of sentience,38,0.93,xuyc1t,rareinsults,https://i.redd.it/glhgttjd9or91.png,2,2022-10-04 04:34:18,_Erindera_,False
270,Is she a Stormtrooper?,65773,0.89,xts3hp,rareinsults,https://i.redd.it/iyuk7r31zer91.png,601,2022-10-02 21:21:03,LucYd777,False
271,Callmecarson’s poor lungs,49,0.99,xuv7wb,rareinsults,https://i.redd.it/5ffoti1lmnr91.jpg,3,2022-10-04 02:26:33,Peanut_Opossum,False
272,Dream's face reveal,95,0.97,xuoom0,rareinsults,https://i.redd.it/mnhng3a1emr91.jpg,1,2022-10-03 22:16:51,PsychologicalWaltz6,False
273,An interesting tile,71,0.87,xur8vb,rareinsults,https://i.redd.it/jcrnlmrevmr91.jpg,8,2022-10-03 23:54:18,Good-Illustrious,False
274,New Dahmer Fancast,17,0.66,xv2ksh,rareinsults,https://i.redd.it/7yqtk4dc7pr91.jpg,7,2022-10-04 07:45:21,aore3d,False
275,An accurate description of Elon Musk.,41,0.87,xuttzk,rareinsults,https://i.redd.it/kp7j0cqzcnr91.jpg,2,2022-10-04 01:32:48,Nervardia,False
276,New tinder find,21524,0.95,xtr9y2,rareinsults,https://i.redd.it/qqe3weduser91.jpg,165,2022-10-02 20:45:46,mod_xd,False
277,"On a thread about OP's dildo package stolen by ""Savage"". Well I guess we found the subject.",138,0.99,xuiaxm,rareinsults,https://i.redd.it/9iuavmws4lr91.png,2,2022-10-03 18:07:33,Uvalde-Cop,False
278,This is accurate,69,0.96,xumwpc,rareinsults,https://i.redd.it/lb9cz6mc2mr91.jpg,2,2022-10-03 21:12:33,beerbellybegone,False
279,Bro looks like the most mid white guy,56,0.83,xunj0g,rareinsults,https://i.redd.it/dzj14zon6mr91.jpg,3,2022-10-03 21:35:34,Tomthetank_irl,False
280,He does though,84,0.92,xuk7c0,rareinsults,https://i.redd.it/x1nxnguvjlr91.jpg,2,2022-10-03 19:27:51,TheRealNightTerror,False
281,Will definitely use this in the future. Response to a fairly harsh review of an RPG.,28,0.81,xut1j1,rareinsults,https://i.redd.it/uf084dnn7nr91.jpg,5,2022-10-04 01:02:53,Hereforthe_tshirt,False
282,The worst she can say is no.,26,0.82,xusbnw,rareinsults,https://i.redd.it/jdg8nvtt2nr91.jpg,4,2022-10-04 00:35:50,ishyaboikar,False
283,enemy a10 war thong incoming,29,0.92,xurh63,rareinsults,https://i.redd.it/cskm56s0xmr91.jpg,1,2022-10-04 00:03:19,di-propane_tank,False
284,You unseasoned chicken wing,11,0.84,xux8z0,rareinsults,https://i.redd.it/y2u4k7r61or91.jpg,1,2022-10-04 03:48:26,Tiredpersons,False
285,his guy knows the true meaning of Catcher in the Rye,8,0.84,xv12j4,rareinsults,https://i.redd.it/dbb2r892vor91.png,1,2022-10-04 06:36:47,Expired_Twinkie23,False
286,So this guy just did a face reveal...,65,0.78,xui2tl,rareinsults,https://i.redd.it/49lr4d7o3lr91.jpg,15,2022-10-03 17:57:21,Not-A-myth,False
287,Not sure if insult or fact,44,0.92,xuks1a,rareinsults,https://i.redd.it/fcz48h3wnlr91.jpg,3,2022-10-03 19:50:19,GalaxyGuyYT,False
288,Quick + Silver,141,0.97,xud0hv,rareinsults,https://i.redd.it/e3o5cmmoqjr91.jpg,1,2022-10-03 13:22:25,supercrazestar,False
289,comment sections be like,75,0.94,xuge9h,rareinsults,https://i.redd.it/a5gcboqcpkr91.jpg,1,2022-10-03 16:36:46,LowVermicelli6464,False
290,Stormtrooper Accuracy Guide,219,0.95,xu99cj,rareinsults,https://i.redd.it/rz5slmvcoir91.jpg,11,2022-10-03 09:47:35,JohnnyTsunami90,False
291,"in reference to the ""name a more iconic duo"" meme",29,0.96,xumjrp,rareinsults,https://i.redd.it/9su6ogl40mr91.png,3,2022-10-03 20:59:02,Insane_Grape479,False
292,"Not a fan of the guy, but god damn…",9,0.77,xuunbx,rareinsults,https://i.redd.it/1tj7cdplinr91.jpg,1,2022-10-04 02:04:16,Whydoihavealive,False
293,Dream is getting cooked,172,0.89,xu64g6,rareinsults,https://i.redd.it/20rrknpjxhr91.jpg,10,2022-10-03 07:17:21,MegaMan-1989,False
294,talking about dream 💀 (couldn’t upload a photo of him),25,0.85,xuhssa,rareinsults,https://i.redd.it/40iy6x9h1lr91.jpg,1,2022-10-03 17:44:41,isaac_c1234,False
295,An egg-sellent insult,202,0.93,xu4xg3,rareinsults,https://i.redd.it/ptjh1z8fnhr91.jpg,8,2022-10-03 06:20:34,Wonderful-Ad5116,False
296,he was talking about dream's face,2,0.56,xv4toe,rareinsults,https://i.redd.it/vyq7aipjqpr91.jpg,2,2022-10-04 09:32:25,KeplerCorvus,False
297,dream is breaking bad,8,0.61,xuo1lb,rareinsults,https://i.redd.it/fi7n8wwy9mr91.png,5,2022-10-03 21:54:07,TheRaspberry7,False
298,My friend’s reaction to the Dream face reveal,59,0.79,xu76p4,rareinsults,https://i.redd.it/segbsyq96ir91.jpg,3,2022-10-03 08:06:12,GayRats53,False
299,Wanna hear a riddle???,54,0.79,xu6thb,rareinsults,https://i.redd.it/112arwr43ir91.png,9,2022-10-03 07:49:09,83C0M3_Newman,False
300,He's like Tom Cruise,12496,0.98,xt9bei,rareinsults,https://i.redd.it/xt89lkcv2ar91.png,74,2022-10-02 04:54:00,SexyTimeDoe,False
301,Poor Dream man,45,0.84,xu6mrs,rareinsults,https://i.redd.it/q7nha55o1ir91.jpg,8,2022-10-03 07:40:27,Toxicgoat69,False
302,My brother messaged me back…,37,0.8,xu7eog,rareinsults,https://i.redd.it/r7yhn0558ir91.jpg,3,2022-10-03 08:16:42,KristiSoko,False
303,Probably breaks a ton of rules but this guy went crazy in a server I’m in.,5,0.61,xumeb5,rareinsults,https://i.redd.it/19h942y2zlr91.jpg,1,2022-10-03 20:53:05,NuggetWarrior09,False
304,Damn I guess I’m dead then,114,0.93,xtyl34,rareinsults,https://i.redd.it/wuhcja62agr91.jpg,3,2022-10-03 01:43:53,Clumsy24,False
305,My school discord sometimes 💀,42,0.99,xu5sem,rareinsults,https://i.redd.it/oopnpo3juhr91.png,1,2022-10-03 07:01:08,med_designs,False
306,World’s worst scumbag has left the internet.,0,0.5,xuv9ci,rareinsults,https://i.redd.it/pqarlprvmnr91.jpg,1,2022-10-04 02:28:13,IrongenicConduit,False
307,bro rlly looks like Rumpelstiltskin,34,0.78,xu5lwf,rareinsults,https://i.redd.it/4p9d8nitshr91.png,7,2022-10-03 06:52:30,NotTheTinPot,False
308,A lot of people have been roasting Dream but this one takes the cake for me,27,0.76,xu6wi7,rareinsults,https://i.redd.it/2hsx1frw3ir91.jpg,7,2022-10-03 07:53:01,KillingMoon62,False
309,Some call it alternative fashion and some call it this,158,0.98,xtt1u3,rareinsults,https://i.redd.it/sdyb65i16fr91.jpg,7,2022-10-02 21:59:34,laughingatmypainlol,False
310,maybe he has,92,0.92,xtxpa6,rareinsults,https://i.redd.it/y8tt0x0q3gr91.jpg,20,2022-10-03 01:08:23,Adamskyvara,False
311,Justin Bieber: No Way Home,107,0.98,xtv2fn,rareinsults,https://i.redd.it/df9rfd2qkfr91.jpg,5,2022-10-02 23:21:54,Charon581,False
312,Stolen from my friend's discord lol,107,0.96,xtugzd,rareinsults,https://i.redd.it/puo9r2r9gfr91.png,3,2022-10-02 22:57:36,Zettss,False
313,Even worse than being backup to a backup,47,0.94,xu08n3,rareinsults,https://i.imgur.com/mrFVqk9.png,1,2022-10-03 02:51:33,OMGsuperHAX,False
314,the person lives in the mii channel,166,0.97,xtpkj8,rareinsults,https://i.redd.it/m866ih9ifer91.png,4,2022-10-02 19:31:32,XPVMNotUsed,False
315,Fuck you Ramirez,9,0.92,xua5yg,rareinsults,https://i.redd.it/2w30eggwwir91.png,2,2022-10-03 10:35:31,Harrpot,False
316,this is my favourite insult from now.... woah,49,0.81,xtw0ic,rareinsults,https://i.redd.it/ov3hjbierfr91.png,3,2022-10-02 23:59:50,im_in_your_walls_0,False
317,ROBLOX has some really good insults sometimes,52,0.97,xtun6o,rareinsults,https://i.redd.it/pxljqewmhfr91.jpg,3,2022-10-02 23:04:35,ArtifactLime,False
318,My friends on Discord,42,0.93,xtw7pi,rareinsults,https://i.redd.it/esyjkpvxsfr91.jpg,2,2022-10-03 00:07:55,MiniNinja824,False
319,Comment about Dream's face reveal,7,0.61,xu7mx9,rareinsults,https://i.redd.it/medm06s4air91.png,1,2022-10-03 08:27:53,RexDino1966,False
320,bro looks like the troll face 💀,10,0.58,xu78yx,rareinsults,https://i.redd.it/du7m6f0t6ir91.jpg,15,2022-10-03 08:09:13,anonadvance,False
321,gamers be getting tense,11,0.92,xu513p,rareinsults,https://i.redd.it/9nes4xuaohr91.jpg,2,2022-10-03 06:25:29,Practical_Culture833,False
322,man really said that,6,0.59,xu6t3f,rareinsults,https://i.redd.it/m8kkfyv43ir91.jpg,8,2022-10-03 07:48:38,Skyfe9909,False
323,Why fucktrumpet? (Context it was a picture of a cool jar),8,0.75,xu6hix,rareinsults,https://i.redd.it/dntw4keh0ir91.jpg,1,2022-10-03 07:33:51,Stonkover9000,False
324,Cracker barrel biscuit,19,0.86,xtz615,rareinsults,https://i.redd.it/sceei7qdegr91.jpg,2,2022-10-03 02:08:06,New_Programmer2323,False
325,This is just a joke btw,8,0.63,xu680d,rareinsults,https://i.redd.it/4h0r3pxcyhr91.jpg,3,2022-10-03 07:21:58,Pikagamer3210,False
326,Strange but true,24,0.89,xtvthl,rareinsults,https://i.redd.it/68f3whh2qfr91.jpg,1,2022-10-02 23:51:49,Le_Bush,False
327,Kevin Bacon throwin’ the pigskin,41,0.88,xtrdof,rareinsults,https://i.redd.it/xovscg2pter91.jpg,2,2022-10-02 20:50:25,shipsandshoclate,False
328,From the Seattle Kraken's mascot reveal,11,0.93,xu0pr3,rareinsults,https://media.discordapp.net/attachments/653714108918530048/1026246230646456431/unknown.png,1,2022-10-03 03:10:58,ldrago915,False
329,He even said sorry,40,0.93,xtpykd,rareinsults,https://i.redd.it/dsu73mmmier91.jpg,1,2022-10-02 19:48:21,sarma55,False
330,cracker barrel 😋,24,0.93,xttc4r,rareinsults,https://i.redd.it/7hrwjhc38fr91.jpg,3,2022-10-02 22:11:07,MADU_IN_HEAVEN7,False
331,Saw one in the wild,51,0.96,xtnu4a,rareinsults,https://i.redd.it/r0hhtxh81er91.jpg,13,2022-10-02 18:10:52,Le_Vrai_Mouton,False
332,Man United player Jadon Sancho gets insulted after his performance,18,0.91,xttnew,rareinsults,https://i.redd.it/8yk44k6cafr91.jpg,1,2022-10-02 22:23:42,jackfickan,False
333,He could tell time without saying it,2392,0.99,xsw362,rareinsults,https://i.redd.it/iw7inresa7r91.jpg,8,2022-10-01 19:31:56,Dubr1s,False
334,Haaland the thumb from spykids,6,0.75,xu408t,rareinsults,https://i.redd.it/2my8ywkifhr91.jpg,1,2022-10-03 05:36:14,_heyASSBUTT,False
335,blurry ahh walls,16,0.94,xttm9e,rareinsults,https://i.redd.it/izuk7yd1afr91.png,6,2022-10-02 22:22:28,wantupvoteposts123,False
336,He should've kept his mouth shut,2,0.58,xua35m,rareinsults,https://i.redd.it/atsr60ruvir91.png,5,2022-10-03 10:31:16,HenryAnthony7775,False
337,A 2 litre is also acceptable,269,0.98,xt7hyw,rareinsults,https://i.redd.it/co6obwjco9r91.jpg,6,2022-10-02 03:31:29,WeeabooHunter69,False
338,Now i cant unimagine delaware computer store.,34,0.94,xthk9b,rareinsults,https://i.redd.it/ryc7nwff7cr91.png,1,2022-10-02 12:02:23,RuTrEaLlY,False
339,Don't offend dog shit like that.,95,0.9,xtbful,rareinsults,https://i.redd.it/cp9xf6m3lar91.jpg,2,2022-10-02 06:35:04,JackdawMiles,False
340,Naaawwww there's no way my homie said this about Dream 💀💀💀,0,0.45,xu7hu6,rareinsults,https://i.redd.it/kbl1z8kw8ir91.jpg,4,2022-10-03 08:20:59,NicktheSickBrick,False
341,5000$ for the broke man look,38088,0.93,xsblss,rareinsults,https://i.redd.it/l0jl1w1f22r91.jpg,1019,2022-10-01 01:56:12,Mei-Zing,False
342,Very moist indeed,33,0.84,xtdvg3,rareinsults,https://i.redd.it/82ahwlr17br91.jpg,3,2022-10-02 08:38:05,Striking-Reason5792,False
343,Someone Likes the Taste of Glue.,219,0.99,xsyzxh,rareinsults,https://i.redd.it/7vu2ajy6w7r91.jpg,4,2022-10-01 21:31:54,Mr_Blurple_Nurple,False
344,bro wanted to fake his death over a group of friends he didn't like,25,0.76,xte7sc,rareinsults,https://i.redd.it/i4171fc9abr91.png,3,2022-10-02 08:56:06,jellybit65,False
345,*Tactical Nuke Inbound*,92,0.95,xt3xm3,rareinsults,https://i.redd.it/v4puuc9rw8r91.png,1,2022-10-02 00:57:32,Dr3emar,False
346,I had to look up what ‘lickspittle’ meant and now I’m going to try to incorporate it into my daily vocabulary,108,0.98,xt29s1,rareinsults,https://i.redd.it/x1jv6708k8r91.jpg,7,2022-10-01 23:46:35,SoothsayerSurveyor,False
347,the struggle is real,39,0.94,xt80ku,rareinsults,https://i.redd.it/pmkseroks9r91.jpg,2,2022-10-02 03:55:12,Savakashi,False
348,Rare Face ID,1047,0.99,xslnpy,rareinsults,https://i.redd.it/3n60agr5d4r91.jpg,12,2022-10-01 09:39:56,supercrazestar,False
349,quicksilver after reading that comment: 💀,387,0.97,xspbh7,rareinsults,https://i.redd.it/3r2zcdddf5r91.jpg,4,2022-10-01 13:14:04,CursedKrait,False
