,title,score,upvote-ratio,id,subreddit,url,num_comments,created,author,over18
0,Muscles and Testosterone,2670,0.96,y681o8,rareinsults,https://i.redd.it/t9m9dm7ykcu91.jpg,62,2022-10-17 16:30:12,CyNovaSc,True
1,Tweet qualifies as disability pass,20940,0.97,y5wriu,rareinsults,https://i.imgur.com/fOraLyE.jpg,177,2022-10-17 06:10:06,Hecz15,False
2,Bananas and Broken Dreams,1468,0.99,y65r4o,rareinsults,https://i.imgur.com/Z2lnn22.jpg,10,2022-10-17 14:17:10,themikecampbell,False
3,Dont burn me,450,0.94,y6cobl,rareinsults,https://i.redd.it/s9sceil6mdu91.jpg,17,2022-10-17 19:58:57,MadOgh_DarKcaRnaGe,False
4,“He looks like an orc captain…”,378,0.91,y6b736,rareinsults,https://i.redd.it/onukbpnhadu91.jpg,31,2022-10-17 18:53:20,killingmemesoftly,False
5,‘His face looks like a muscle spasm’,565,0.98,y64t2m,rareinsults,https://i.redd.it/0wvoyvekmbu91.jpg,5,2022-10-17 13:17:30,birkinbaby,False
6,haven’t seen this one b4,10767,0.97,y5lvpr,rareinsults,https://i.redd.it/jzmr6b3i87u91.jpg,36,2022-10-16 22:31:31,Acrobatic_Confusion,False
7,"Context: This guy is probably mid eye roll because his mom started a FB pose to find him a girlfriend. She had very specific criteria. Regardless, the insult is spot on.",162,0.99,y68rwe,rareinsults,https://i.redd.it/fvwmgox7rcu91.png,2,2022-10-17 17:05:21,melisser1400,False
8,He looks like a Korean Jackie Chan.,124,0.95,y68qgi,rareinsults,https://i.redd.it/d2d7m5evqcu91.jpg,3,2022-10-17 17:03:29,BlackHoleEra_123,False
9,My doctor uses it every time he sees me :D,38,0.98,y6eefi,rareinsults,https://i.redd.it/b9eu914bzdu91.jpg,1,2022-10-17 21:12:32,Inevermiss_,False
10,This guy has worse than brain rot,11300,0.98,y5e0it,rareinsults,https://i.redd.it/8v5jty6sf5u91.jpg,43,2022-10-16 16:28:46,theraybenton,False
11,Vegan activists try to stop livestock truck and almost get hit.,143,0.96,y63iuj,rareinsults,https://i.redd.it/02f58j0l8bu91.jpg,3,2022-10-17 11:59:06,Mr_Dodongo64,False
12,"In real life, she'd be selling pencils from a Styrofoam cup...",27,0.92,y6dayc,rareinsults,https://i.redd.it/foub6jmhqdu91.jpg,6,2022-10-17 20:25:06,Ampers-and,False
13,You cold be in a circular room and redditors would still pick sides,35,0.91,y69iay,rareinsults,https://i.redd.it/ota12dl6xcu91.png,3,2022-10-17 17:38:49,Ornery-Personality10,False
14,"Comment on a post ""Wich celebrity do you dislike""",15,0.86,y6dndm,rareinsults,https://i.redd.it/054sytd8udu91.jpg,2,2022-10-17 20:44:03,Snoo-34159,False
15,A bicycle seat,15,0.84,y6ckj9,rareinsults,https://i.redd.it/myube9hbldu91.jpg,1,2022-10-17 19:54:03,Art_pog,False
16,roasted chicken butt,49,0.95,y64hc6,rareinsults,https://i.redd.it/bv4k7sdwibu91.jpg,1,2022-10-17 12:56:55,davidklg,False
17,a rare insult found on a rare app,10,0.92,y6ctzh,rareinsults,https://i.redd.it/m6fne3hgndu91.jpg,1,2022-10-17 20:06:01,Lost_the_Piece,False
18,Is the cavity where your brain supposed to be just filled with bone?,9,0.91,y6d4if,rareinsults,https://i.redd.it/uz9gvidlpdu91.jpg,1,2022-10-17 20:18:01,peri_5xg,False
19,"The insult is not for Geralt, its for player",13,0.79,y6avmp,rareinsults,https://i.redd.it/xqbh8rtv7du91.png,3,2022-10-17 18:39:29,Sipbloodyhell,False
20,"Intel is better than AMD (a joke, for legal reasons)",27,0.8,y60igk,rareinsults,https://i.redd.it/2af45mqqeau91.png,2,2022-10-17 09:12:45,antonov_a-40,False
21,It kinda makes sense,153,0.98,y5oar8,rareinsults,https://i.redd.it/zu9j1llyp7u91.jpg,1,2022-10-17 00:09:24,Carlosrehu,False
22,Skull thicker than plot armour,188,0.99,y5j9c1,rareinsults,https://i.redd.it/vhr7lezap6u91.jpg,4,2022-10-16 20:43:55,NipahSama,False
23,I like the way this one just keeps going,25,0.9,y5x9me,rareinsults,https://i.redd.it/eb035tmjm9u91.jpg,1,2022-10-17 06:33:48,tylersky100,False
24,This was relating to the new pokemon that was just announced. Bellibolt,24,0.84,y5s5ff,rareinsults,https://i.redd.it/y7krmxkuh8u91.png,1,2022-10-17 02:46:14,DragonPast132,False
25,"Some guy was faking giving away $1,000,00",12,0.85,y5r2tg,rareinsults,https://i.redd.it/rddpeoh3a8u91.jpg,1,2022-10-17 02:02:17,Bill_Cipher_emit,False
26,"You, My friend. Are a Karablast.",14,0.85,y5pkje,rareinsults,https://i.redd.it/8d21zzgzy7u91.png,1,2022-10-17 01:00:46,FlamTWO,False
27,Slap-hitting shit goblins…,13,0.8,y5lgzc,rareinsults,https://i.imgur.com/WQdNRFN.jpg,1,2022-10-16 22:14:51,Deago78,False
28,Hitbox complaint turned into a micro adjustment of insult,33,0.76,y5cocj,rareinsults,https://i.redd.it/ohai4wap15u91.jpg,3,2022-10-16 15:09:51,XCV_DRYMMO,False
29,melted cheese on a what?,40,0.78,y57xti,rareinsults,https://i.redd.it/vztpwve0m3u91.jpg,1,2022-10-16 10:20:09,ThisRandomUsernamee,False
30,Can't argue with that,29488,0.83,y45j95,rareinsults,https://i.redd.it/5el1jbn58ut91.png,1111,2022-10-15 02:47:58,Sir_flaps,False
31,"Dang, low poly?",14,0.95,y58ng5,rareinsults,https://i.redd.it/nz46bx3dt3u91.jpg,1,2022-10-16 11:01:19,__NausiatedCum__,False
32,nice family tree,93,0.96,y4wjzc,rareinsults,https://i.redd.it/yn40cmpsu0u91.jpg,9,2022-10-16 01:04:02,YourCasualNerd1,False
33,My friends comment om my coordinates I had of a desert temple in minecraft,28,0.71,y50dgk,rareinsults,https://i.redd.it/wy9r3zeuo1u91.jpg,6,2022-10-16 03:52:26,captain_glitch69,True
34,not sure why i thought this was so funny lmfaoo,7,0.59,y579on,rareinsults,https://i.redd.it/vhc73ut7f3u91.jpg,6,2022-10-16 09:42:01,cowboysfromhellll,False
35,"Anyway, standards were not met",67,0.9,y4p3ro,rareinsults,https://i.redd.it/i1zzolj9azt91.jpg,5,2022-10-15 19:47:11,Icratos,False
36,When your vocabulary is lacking,106,0.98,y4gz3k,rareinsults,https://i.redd.it/9hfufudk3xt91.jpg,1,2022-10-15 12:26:03,Matt32490,False
37,An apple a day,64,0.91,y4j78e,rareinsults,https://i.redd.it/di22668bsxt91.jpg,6,2022-10-15 14:44:45,cozigotgamebitchez,False
38,0/10 would not recommend,26,0.84,y4mucr,rareinsults,https://i.redd.it/x1gi7uc5syt91.jpg,1,2022-10-15 18:05:36,SnooRevelations2041,False
39,What a brain dead moron lol,324,0.99,y45nvc,rareinsults,https://i.redd.it/tvadanwd9ut91.jpg,37,2022-10-15 02:53:19,freebagofbirdhair,False
40,When insulting strangers goes wrong.,39,0.83,y4fqc8,rareinsults,https://i.redd.it/yrtuvklypwt91.png,11,2022-10-15 11:09:46,KelbosaDownAHallway,False
41,I guess it depends on how much you like toast?,4068,0.99,y3j8xy,rareinsults,https://i.redd.it/54m49wr22pt91.jpg,22,2022-10-14 09:23:26,xOscarO,False
42,When you want abs but don't want to workout,130,0.99,y45qs7,rareinsults,https://i.redd.it/bfn4sliy9ut91.jpg,6,2022-10-15 02:56:44,le_petit_robin,False
43,And he took it personally.,13986,0.98,y3c26a,rareinsults,https://i.redd.it/5ennwp46fnt91.jpg,86,2022-10-14 03:53:16,12percentage,False
44,Lena Dunham back like polio in the sewage system,802,0.98,y3nsqf,rareinsults,https://i.redd.it/dudcetw6bqt91.jpg,3,2022-10-14 13:36:25,AsstownMayor,False
45,I like your pets more than you.,30,0.92,y49i00,rareinsults,https://i.imgur.com/QpxC3bU.png,1,2022-10-15 05:43:10,roviuser,False
46,Those things look like floor fondlers,66,0.93,y42wph,rareinsults,https://i.redd.it/5j60mnpuott91.jpg,3,2022-10-15 00:58:14,jahambo,False
47,A little much don't you think?,16,0.75,y4cird,rareinsults,https://i.redd.it/7rg3sm8nuvt91.jpg,5,2022-10-15 08:14:15,OpenRepeat7,False
48,OP Renews his license,66004,0.93,y31czi,rareinsults,https://i.imgur.com/pTp7r6r.jpg,387,2022-10-13 20:47:58,Clayman2198,False
49,Nobody calls me chicken,173,0.98,y3tmya,rareinsults,https://i.redd.it/lv4s0htytrt91.png,4,2022-10-14 18:43:20,KWAKUDATSU,False
50,Found this duo on twitter just now,268,0.99,y3olta,rareinsults,https://i.redd.it/uwptbzh5kqt91.jpg,1,2022-10-14 14:26:33,subspaceculture,False
51,Man just enjoys a sweetened beverage,105,0.89,y3tykc,rareinsults,https://i.imgur.com/yJL7J7N.jpg,12,2022-10-14 18:57:18,ccwithers,False
52,My names skyler white yo,27,0.84,y44vkk,rareinsults,https://i.redd.it/62auu4zi3ut91.jpg,13,2022-10-15 02:20:30,ImA_NormalPerson987,False
53,Human cutlery drawer,25,0.97,y44u53,rareinsults,https://i.redd.it/ibgzwxs63ut91.jpg,1,2022-10-15 02:18:48,send_me_your_ashes,False
54,80kg of rhino ballsack,90,0.93,y3ui7t,rareinsults,https://i.redd.it/fd8gryqk0st91.jpg,1,2022-10-14 19:20:22,Wesssel_,False
55,Should he include the 70k tweets on his resume?,53,0.97,y3wpw3,rareinsults,https://i.redd.it/xcrzwy68gst91.jpg,3,2022-10-14 20:48:06,mattpfeifr,False
56,"The ELI5 was ""How do our hearts beat 24/7?""",51,0.92,y3w3fr,rareinsults,https://i.redd.it/60sjcvjubst91.jpg,2,2022-10-14 20:23:36,nondescriptun,False
57,"Shots fired, Mark Wahlberg.",25,0.92,y418qp,rareinsults,https://i.redd.it/aixipfudctt91.png,5,2022-10-14 23:48:44,unclefishbits,False
58,Alan Moore in pokemon GO,29,0.93,y3xf85,rareinsults,https://i.redd.it/tfmgrie2lst91.jpg,3,2022-10-14 21:15:14,Dabbing-jesus,False
59,Responding to Musk and his heavily subsidized SpaceX program,36,0.91,y3vd80,rareinsults,https://i.imgur.com/MzO1CPL.jpg,1,2022-10-14 19:54:50,yournamehere2787,False
60,OP has history with nuns,29,0.91,y3vn30,rareinsults,https://i.redd.it/a2j07goh8st91.png,3,2022-10-14 20:05:31,a_guy_that_loves_cat,False
61,They should have never left the island.,409,0.99,y3b9e5,rareinsults,https://i.redd.it/nsxu06zd9nt91.jpg,5,2022-10-14 03:21:10,truthfullygaudyregul,False
62,I feel this,17,1.0,y3te8g,rareinsults,https://i.redd.it/1grkmyk3srt91.jpg,1,2022-10-14 18:32:52,tax-collecting,False
63,Taking things to the necks level,18,0.95,y3tff6,rareinsults,https://i.redd.it/gmu2muccsrt91.jpg,2,2022-10-14 18:34:14,DrinkPrimeM8,False
64,Blaming nature now I guess...,23,0.87,y3p82i,rareinsults,https://i.redd.it/m6tt4sanqqt91.jpg,3,2022-10-14 15:02:57,DNAmaster10,False
65,Cops please settle down for a minute,29967,0.95,y2jpnm,rareinsults,https://i.redd.it/wl9kqvajrgt91.jpg,350,2022-10-13 05:30:07,EmilioRandomPoster,False
66,French fry behind the bed is now my favorite insult.,62,0.96,y3g26z,rareinsults,https://i.redd.it/6lmig5xraot91.jpg,4,2022-10-14 06:50:28,FartxAss,False
67,Alex Jones finally comes up with a legitimate use for his SuperSilver Wound Dressing Gel.,63,0.89,y3f4b5,rareinsults,https://i.redd.it/7te5ab1x0ot91.png,11,2022-10-14 06:07:11,uglymule,False
68,The best insult I have ever seen on YouTube,74,0.86,y3bxt9,rareinsults,https://i.redd.it/kypfaetaent91.jpg,6,2022-10-14 03:48:24,SaymehPoop,False
69,I mean he tried...,80,0.99,y3aeed,rareinsults,https://i.redd.it/mjtg260i3nt91.jpg,2,2022-10-14 02:47:52,x97sfinest,False
70,Comment section of a post about someone's shitty decorations on a jeep.,77,0.96,y38w0z,rareinsults,https://i.redd.it/ds1jt955tmt91.png,6,2022-10-14 01:49:47,Jollygreengiant69,False
71,Now that's a burn,21,0.76,y3h9pz,rareinsults,https://i.redd.it/f61l7thykot91.jpg,5,2022-10-14 07:47:29,TheonlyAngryLemon,False
72,A storming slew of Wit,133,0.97,y31lbi,rareinsults,https://i.redd.it/yrpfw031dlt91.png,6,2022-10-13 20:57:42,OnePageMage,False
73,Slaps harder than his mums pills,32,0.92,y3boyj,rareinsults,https://i.redd.it/u22rpjmhcnt91.jpg,2,2022-10-14 03:38:14,a_local_weeb,False
74,Harry Potter and the failed steamer career,31,0.94,y3c0s6,rareinsults,https://i.redd.it/sljwjdsvent91.jpg,1,2022-10-14 03:51:40,jamon5555,False
75,Like Ray Charles playing jenga,38,1.0,y3b7bx,rareinsults,https://i.redd.it/23a15yc19nt91.jpg,2,2022-10-14 03:18:54,slangforweed,True
76,This woman's getting hit hard,77,0.95,y32ic4,rareinsults,https://i.redd.it/15txvnhojlt91.jpg,5,2022-10-13 21:35:01,PygmyPuff_X,False
77,Damn. Didn’t have to do him like that man. (Weezer is good),35,0.87,y32ljj,rareinsults,https://i.redd.it/kvpst1zbklt91.jpg,4,2022-10-13 21:38:38,Iamnothuman77,False
78,In a video about starfishes,6146,0.99,y24lr4,rareinsults,https://i.redd.it/j9j0yymhrdt91.png,11,2022-10-12 19:24:32,JorgeSuperGamer,False
79,Debate on Price of Wales title,35,0.94,y31rap,rareinsults,https://i.redd.it/s14uk9s9elt91.jpg,1,2022-10-13 21:04:39,rutlandclimber,False
80,Cosplaying every single girl 💀,24,0.81,y2zjeb,rareinsults,https://i.redd.it/qkdrbdioxkt91.jpg,1,2022-10-13 19:31:45,XboxO-DryNikoBellic,False
81,Made me chuckle coz I can totally relate!,187,0.97,y2ns0n,rareinsults,https://i.redd.it/jla98sjfpht91.jpg,1,2022-10-13 08:40:06,TheRookieGetsACookie,False
82,Some Redditor on languages,44,0.89,y2t1iw,rareinsults,https://i.redd.it/8tr5bhki7jt91.jpg,5,2022-10-13 13:43:14,DerG3n13,False
83,on a dance video (fixed),56,0.94,y2rcla,rareinsults,https://i.redd.it/ezpv28shoit91.jpg,2,2022-10-13 11:56:36,plenebo,False
84,Thot bot destroyer at it again,117,0.95,y2mt6y,rareinsults,https://i.redd.it/l87kjfoxght91.jpg,3,2022-10-13 07:52:28,linden-films,False
85,😀 -> 🙂 -> 😐,59958,0.91,y1o7uh,rareinsults,https://i.redd.it/e6gi8bvmj9t91.png,601,2022-10-12 05:17:26,ad2022,False
86,Forehead Vs Predator,11983,0.98,y1r8lz,rareinsults,https://i.redd.it/nj0mlrdg9at91.png,201,2022-10-12 07:38:12,Illusion_Hashima1999,False
87,bella hadid if she never had surgery and was obese,30,0.84,y2qq5d,rareinsults,https://i.redd.it/nh1ll9qzgit91.png,5,2022-10-13 11:19:24,musingstork,False
88,In a fun cool way,144,0.96,y2g8r0,rareinsults,https://i.imgur.com/1mfYAvv.jpg,13,2022-10-13 03:04:36,footysocc,False
89,Minecraft and the snifferseeds.,101,0.95,y2gq7a,rareinsults,https://i.redd.it/ttencswl4gt91.jpg,10,2022-10-13 03:23:57,Steckdose_HD,False
90,Responding to a racist,114,0.95,y2f7th,rareinsults,https://i.imgur.com/TCSSkfD.jpg,2,2022-10-13 02:24:41,original_livewire,False
91,context: he is a young football star who plays for England.,27,0.92,y2p8tm,rareinsults,https://i.redd.it/ng5wlhmx2it91.jpg,7,2022-10-13 09:55:51,amungus45,False
92,Celery my fave vegetable tho,50,0.91,y2l93u,rareinsults,https://i.redd.it/vthedn5v3ht91.jpg,3,2022-10-13 06:39:12,KWAKUDATSU,False
93,my friend got the worst roast of his life while streaming the other day,50,0.95,y2isxv,rareinsults,https://i.redd.it/zbqj8amdkgt91.png,1,2022-10-13 04:50:01,FiveTail,False
94,I don't think the teacher is gonna round up his grade after that,30,0.87,y2l04b,rareinsults,https://i.redd.it/f4ly5anm1ht91.png,1,2022-10-13 06:27:58,TestSubject003,False
95,Got a winner in the AEW Dynamite live thread tonight,24,0.97,y2mkn9,rareinsults,https://i.redd.it/lyfq50gyeht91.jpg,2,2022-10-13 07:41:25,SonofTombstone,False
96,now with less personal information,66,0.84,y2f4bh,rareinsults,https://i.redd.it/w9vfrs4rtft91.png,3,2022-10-13 02:20:45,Omni_chicken2,False
97,Man looks like a bts member,112,0.98,y2922t,rareinsults,https://i.redd.it/jdnrkr43net91.jpg,7,2022-10-12 22:21:36,angrynibba69,False
98,Review of new The Munsters Movie,43,1.0,y2ez03,rareinsults,https://i.redd.it/nmqwhzbpsft91.jpg,9,2022-10-13 02:14:51,El-Chewbacc,False
99,I guess they didn't watch the Direct.,29,0.97,y2f8mg,rareinsults,https://i.redd.it/p3i1yebmuft91.jpg,1,2022-10-13 02:25:36,Agt_Falcon,False
100,Context: Post was a video of a courtroom family drama show where a guard is called out to be unhappy in his relationship by a man and next clip is of a news anchor saying the actor who played the guard is found guilty of killing his wife.,50,0.95,y28ewt,rareinsults,https://i.redd.it/20vgh8ciiet91.jpg,1,2022-10-12 21:56:32,ishanG24,False
101,Stupid coward cancer pickle?,19,0.88,y2g7ge,rareinsults,https://i.redd.it/t76cdcob1gt91.jpg,5,2022-10-13 03:03:11,DexterTheWulf,False
102,Coming to a TV near you.,106,0.94,y1x1v7,rareinsults,https://i.redd.it/rkcwjqhbsbt91.png,8,2022-10-12 12:45:36,DrewidN,False
103,Walmart visitors are a bit more of themselves,1953,0.99,y18uid,rareinsults,https://i.redd.it/2sh5p6gxf6t91.jpg,11,2022-10-11 18:47:14,pizzalover128,False
104,On a video of teens trashing a food vendor,7847,0.99,y10zlf,rareinsults,https://i.redd.it/5obj54ms74t91.jpg,19,2022-10-11 11:18:21,WildFurball2118,False
105,The commentators description on how poorly a player's attempt to score was.,65,0.98,y1snmj,rareinsults,https://i.redd.it/f95qg0zmlat91.jpg,3,2022-10-12 08:46:25,Brantley820,False
106,Lizard v lizard,49065,0.94,y0s671,rareinsults,https://i.redd.it/bp35y5m722t91.jpg,481,2022-10-11 04:03:13,ShubhamG77,False
107,Still one of the funniest rare insults I’ve ever heard,240,0.96,y1dgfs,rareinsults,https://i.redd.it/y4afeh23e7t91.jpg,3,2022-10-11 21:58:41,loppdarian,False
108,This was a response to an image in a long email thread,0,0.47,y2gbw9,rareinsults,https://i.redd.it/8rv3j4772gt91.jpg,2,2022-10-13 03:08:05,Not_AHuman_Person,False
109,KSI can't grow a beard,79,0.95,y17v44,rareinsults,https://i.redd.it/w4bgznap76t91.jpg,3,2022-10-11 18:01:14,Klusten,False
110,Football and Rugby are different things!!,98,0.95,y137xp,rareinsults,https://i.redd.it/7qus0c7qw4t91.jpg,3,2022-10-11 13:37:54,hpy2beatyou1105,False
111,Gonna need some burn cream with prime same-day shipping,624,0.98,y0nyxl,rareinsults,https://i.redd.it/kba90ryk71t91.jpg,9,2022-10-11 01:11:34,bltburglar,False
112,Am I wrong?,294,0.84,y0tqz9,rareinsults,https://i.redd.it/5ko5l0fwe2t91.jpg,24,2022-10-11 05:14:20,WATERMEL0N-SHARK,False
113,I mean i would not,143,0.97,y0yjji,rareinsults,https://i.redd.it/jkhoilfwj3t91.jpg,2,2022-10-11 09:04:10,Ssiddha_3,False
114,It is very gaping,196,0.96,y0vb59,rareinsults,https://i.redd.it/mnnnor72s2t91.jpg,7,2022-10-11 06:28:08,RigatoniPasta,False
115,In response to a very very long setup just for a pun,263,0.98,y0shgx,rareinsults,https://i.redd.it/cq21syto42t91.jpg,5,2022-10-11 04:17:06,G0D_1S_D3AD,False
116,"He wasn't, in fact, pro",112,0.97,y0x0r2,rareinsults,https://i.redd.it/1jtv0dnd63t91.jpg,3,2022-10-11 07:48:23,CrimsonEclipse18,False
117,On a party trick video,3933,0.99,y08kzb,rareinsults,https://i.redd.it/ra6d0wkbmxs91.png,12,2022-10-10 13:07:41,Godzila543,False
118,Complaining about add spamming,82,0.89,y0y1xg,rareinsults,https://i.redd.it/zs03p8whf3t91.jpg,12,2022-10-11 08:39:28,ZombieNed62,False
119,The caption says it all,69,0.96,y0xhfe,rareinsults,https://i.redd.it/3vhaulsea3t91.jpg,9,2022-10-11 08:10:57,Soggy_Chest_9345,False
120,No Neck Nick,130,0.95,y0r6as,rareinsults,https://i.redd.it/iz4u3z5nu1t91.jpg,6,2022-10-11 03:20:48,onehit2quick,False
121,Seen on the review of a $1.9 million watch,42,0.96,y0z14w,rareinsults,https://i.redd.it/8bznh69bo3t91.png,4,2022-10-11 09:29:09,dopedude99,False
122,“Through a picket fence”,96,0.91,y0reqr,rareinsults,https://i.redd.it/3ouvuj8ew1t91.jpg,7,2022-10-11 03:30:37,Bigboybong,False
123,"He asked if she would date him, she rejected him and told him he needs to work out",11464,0.95,xzz3k3,rareinsults,https://i.redd.it/d5atvl8j3vs91.jpg,246,2022-10-10 04:38:18,yurajurik,False
124,*clap* *clap* AAHHHHHHHHHHHHHHH,107,0.97,y0p0ia,rareinsults,https://i.redd.it/3eq4i3q2f1t91.jpg,1,2022-10-11 01:53:32,kristukas1337,False
125,Is strawman sex a kink?,28,0.83,y0xfqm,rareinsults,https://i.redd.it/hsxdmop0a3t91.jpg,5,2022-10-11 08:08:46,Relative_Extreme7901,False
126,we gotta go to Bendigo to get me cube morty,21,0.85,y0vbkd,rareinsults,https://i.redd.it/5b0dspj5s2t91.png,1,2022-10-11 06:28:40,bigboss-arnold,False
127,Deep sea burn,44779,0.93,xzol44,rareinsults,https://i.redd.it/793c2yu1vss91.jpg,86,2022-10-09 21:07:29,LucYd777,False
128,Way too specific,8588,0.96,xzs5nv,rareinsults,https://i.redd.it/utsmy59dmts91.jpg,56,2022-10-09 23:40:11,mod_xd,False
129,Made me chuckle.,36,0.83,y0oy0j,rareinsults,https://i.redd.it/ta2hxvbke1t91.jpg,1,2022-10-11 01:50:43,bloody_terrible,True
130,EU chat on Valorant,19,0.85,y0qjw4,rareinsults,https://i.redd.it/uzlvhrk0q1t91.png,1,2022-10-11 02:55:23,Suhitz,False
131,Peeled his hairline back like a banana,3606,0.99,xzpw4i,rareinsults,https://i.imgur.com/DK2hN1g.jpg,40,2022-10-09 22:03:54,J_S_M_K,False
132,Faking a video is easy. Just get more nutrients in your brain!,26,0.91,y0k54x,rareinsults,https://i.redd.it/1f67xygbg0t91.png,2,2022-10-10 22:38:43,TheHandsomestMuscles,False
133,The people of Facebook are cut from a different cloth,6355,0.97,xzjld5,rareinsults,https://i.redd.it/mbgjkye0prs91.jpg,125,2022-10-09 17:11:26,__ouroboros_,False
134,"This means : your mom is a tikbalang (filipino centaur), and you dont have a dad, of course your're not exempted, you're also a horse",32,0.79,y0efda,rareinsults,https://i.redd.it/zzst7qvb9zs91.png,9,2022-10-10 18:40:07,Repulsive_Sea_6601,False
135,"the new ""not the sharpest tool in the shed""",210,0.96,y03mqd,rareinsults,https://i.redd.it/4f7aefit7ws91.jpg,7,2022-10-10 08:23:59,__cream_ru,False
136,In regards to Kanyes recent tweet,386,0.98,xzzctk,rareinsults,https://i.redd.it/wyt8ax6s5vs91.jpg,5,2022-10-10 04:50:46,ItsJaaaaake,False
137,Found one in the wild,5462,0.98,xzgrpd,rareinsults,https://i.redd.it/h0ha14xuuqs91.jpg,53,2022-10-09 14:22:25,mod_xd,False
138,Self extinguished tealight,774,0.97,xzoubv,rareinsults,https://i.redd.it/l5w1zyj4xss91.jpg,8,2022-10-09 21:18:40,Art_pog,False
139,Found in a ring-shaming group. This is an interesting one.,5280,0.98,xz7ppd,rareinsults,https://i.redd.it/peae9xfsaos91.jpg,51,2022-10-09 05:46:21,sleepyboi08,False
140,This man is digging ditches just to pick his nose.,58,0.95,xzxqg6,rareinsults,https://i.redd.it/le7t1vghsus91.jpg,1,2022-10-10 03:36:14,KelbosaDownAHallway,False
141,I love Mr Bean,217,0.97,xznve9,rareinsults,https://i.redd.it/g17bomimpss91.jpg,2,2022-10-09 20:36:38,Zimzamzimbo,False
142,I'm not gonna unsee it now am i,61,0.95,xzw9dw,rareinsults,https://i.redd.it/5ia7x3k8hus91.jpg,1,2022-10-10 02:33:11,Counter-Defiant,False
143,Gotta mark the calendar too,10216,0.96,xz2ei9,rareinsults,https://i.imgur.com/xbknjot.jpg,206,2022-10-09 01:43:46,Jorger707,False
144,"Sock filled with mango chutney, that's a new one",155,0.91,xzlobe,rareinsults,https://i.redd.it/3o2yelv28ss91.jpg,3,2022-10-09 18:58:17,Josh_Your_IT_Guy,False
145,"An insult so rare, that Ramsay sent it to daycare",60,0.95,xzs9sg,rareinsults,https://i.redd.it/4m43u2q7nts91.jpg,8,2022-10-09 23:44:58,ben_claude69420,False
146,makeup brand: forbidden lottery,1903,0.99,xz6sqz,rareinsults,https://i.redd.it/7lp4ltno2os91.jpg,32,2022-10-09 05:00:58,blinktoria182,False
147,Odd way to describe straight hair,108,0.92,xzmprp,rareinsults,https://i.redd.it/s5byw6vfgss91.jpg,3,2022-10-09 19:45:09,IchBinTaiga,False
148,wishes do come true (double whammy),102,0.8,xzm16x,rareinsults,https://i.redd.it/q2avojqzass91.jpg,6,2022-10-09 19:14:43,FlippyFlopsMcGee,False
149,It’s his first day,3236,0.98,xz0yd0,rareinsults,https://i.redd.it/q3k6grcqsms91.jpg,54,2022-10-09 00:43:21,ActuallyCausal,False
150,Apparently haircuts in Croatia are built different,424,0.99,xz9u59,rareinsults,https://i.redd.it/3hklnbf5uos91.jpg,6,2022-10-09 07:34:54,Parabellim,False
151,He’s very constipated,133,0.97,xzf8e5,rareinsults,https://i.redd.it/xbdd7kwbdqs91.jpg,1,2022-10-09 12:44:09,AdUpstairs6082,False
152,"you need to close your entrance to your digestive system permeantly,",18,0.89,xzq02m,rareinsults,https://i.redd.it/camaqp3t5ts91.png,1,2022-10-09 22:08:39,Isawyourwillylol,False
153,She will need that for hospital bill,477,0.95,xz5jiq,rareinsults,https://i.redd.it/asr6htj6sns91.png,1,2022-10-09 04:02:09,MrKiDD0,False
154,I bet even in that universe he gets no bitches,142,0.82,xzcs6x,rareinsults,https://i.redd.it/rvvv6zg1nps91.jpg,9,2022-10-09 10:16:49,supercrazestar,False
155,The rare Double-barrel insult. just like his nose.,237,0.97,xz4axn,rareinsults,https://i.redd.it/a4sa9l67ins91.png,2,2022-10-09 03:06:06,KelbosaDownAHallway,False
156,The Minecraft mob vote,130,0.95,xz74h1,rareinsults,https://i.redd.it/a5wdh3bk5os91.jpg,7,2022-10-09 05:17:05,cassilveR101,False
157,On a post of a guy talking about everyone else but this comment perfectly sums up what he looks like without actually showing face 😅,25,0.92,xzfvhd,rareinsults,https://i.redd.it/8syp7r8ukqs91.png,1,2022-10-09 13:26:15,Busy-Friend1072,False
158,The things on my class group,44,0.9,xzd1h3,rareinsults,https://i.redd.it/nvdp518lpps91.png,3,2022-10-09 10:31:45,Blackong252,False
159,On a post about the mob vote.,27,0.86,xze4gc,rareinsults,https://i.redd.it/923qe8201qs91.jpg,2,2022-10-09 11:35:05,Nivi2006,False
160,Thomas the Spank Engine,42,0.94,xzbj5z,rareinsults,https://i.redd.it/s5edp8aeaps91.jpg,6,2022-10-09 09:05:57,nevergaveafuuuu,False
161,Found on a comment where someone said they were patted on the back.,135,0.99,xz040i,rareinsults,https://i.imgur.com/ThMCfTi.jpg,1,2022-10-09 00:07:25,TallBoiPlanks,False
162,well that comes to mind often nowadays,201,0.98,xyw77y,rareinsults,https://i.redd.it/rokk9k79tls91.png,2,2022-10-08 21:25:38,fetteshaeschen,False
163,The new Mario is Chris Pratt pretending to be someone pretending to be him.,77,0.95,xz2d6v,rareinsults,https://i.redd.it/im56gf783ns91.jpg,2,2022-10-09 01:42:15,ChargedBonsai98,False
164,Hot breath climate change,53,0.9,xz3mdz,rareinsults,https://i.redd.it/32t7h7btcns91.jpg,2,2022-10-09 02:35:58,BeeBench,False
165,Dissed an entire country,48695,0.94,xy315w,rareinsults,https://i.redd.it/900xh46mqes91.jpg,368,2022-10-07 21:37:16,mod_xd,False
166,Why they gotta do him like that,1919,0.98,xydflt,rareinsults,https://i.redd.it/ndskc2h1xgs91.jpg,31,2022-10-08 04:56:53,TSanther9047,False
167,My man committing neck crimes,334,0.99,xyn8ve,rareinsults,https://i.redd.it/ey9ykqorjjs91.jpg,13,2022-10-08 13:47:47,AsstownMayor,False
168,A.K.A. The best way to sort M&M's,16,0.84,xz7g8q,rareinsults,https://i.redd.it/eu16es4b8os91.png,2,2022-10-09 05:33:18,MyNameisDavi,False
169,This post was recommended to me on tumblr and I hate that it’s kind of accurate,52,0.94,xyx0ka,rareinsults,https://i.redd.it/cqmecwtjzls91.jpg,1,2022-10-08 21:59:47,InternetAddict104,False
170,Universities charge to print??,4206,0.96,xy53cy,rareinsults,https://i.imgur.com/fU9GfBS.jpg,74,2022-10-07 23:01:36,AdamDaAdam,False
171,Idk if it's rare but it's pretty insulting,105,0.99,xyrisd,rareinsults,https://i.redd.it/3b7lrsn2sks91.jpg,3,2022-10-08 17:56:07,Conscious-Shoulder71,False
172,Where else is he gonna go for football?,18,0.87,xz5592,rareinsults,https://i.redd.it/8o2bwvg1pns91.jpg,1,2022-10-09 03:44:27,Irnotpatwic,False
173,never heard this one before,64,0.97,xyqvpl,rareinsults,https://i.redd.it/8j3cp7i2mks91.png,1,2022-10-08 17:23:19,ashnga,False
